Title,Writer,Genre,View Count,Rating,Episode Count,Comment Count,Story,Hashtags,Age Rating
정령의 펜던트,"빅피,발렌",판타지,"3,108.2만",9.9,전체210,전체 3.2만,"제국의 살아 있는 전설, 란데르트 공작의 유일한 아들 바율.
어려서부터 환시와 환청을 겪으며 일상 생활에 어려움을 겪던 바율은
아버지의 강권으로 뒤늦게 캐링스턴 아카데미에 입학하게 된다.

집을 나오기 전의 우려와는 달리 바율은 아카데미 생활을 하며
따듯하고 개성 강한 친구들을 만나 조금씩 마음의 문을 열게 되고,
그곳에서 환시로만 알고 있었던 존재가 사라진 줄 알았던 정령임을 알게 되며
바율의 생활은 새로운 국면을 맞이하게 되는데…….","#학원, #성장, #정령, #정령술사, #왕족/귀족, #정통",전체이용가
제목 없음,작가 없음,장르 없음,조회수 없음,별점 없음,회차수 없음,댓글수 없음,줄거리 없음,해시태그 없음,연령 등급 없음
하트 스테인,AG,BL,136.8만,9.8,전체56,"전체 1,835","“선생님, 저… 좋아하는 사람이 있는데요.
그게… 남자예요.”

담임 선생님을 좋아하는 우현은
졸업할 때까지 이 사실을 아무에게도 말하지 않으려 했으나
절친 도하에게 들키고 만다.

그후 자신을 대하는 도하의 태도가 변하자
남자를 좋아하는 자신에게 실망했다 생각하여
솔직하게 이야기를 꺼내놓기로 했는데…

""나는, 너 좋아한단 말이야.""

돌아온 도하의 대답이었다.


그리고,
선생님을 좋아하는 마음을 포기하고 싶던 우현은

""나랑 사귀자.
…졸업하기 전까지만.""

도하의 내기를 받아들인다.

------------------------
*매주 금요일 00시에 연재됩니다*",해시태그 없음,15세이용가
제목 없음,작가 없음,장르 없음,조회수 없음,별점 없음,회차수 없음,댓글수 없음,줄거리 없음,해시태그 없음,연령 등급 없음
제목 없음,작가 없음,장르 없음,조회수 없음,별점 없음,회차수 없음,댓글수 없음,줄거리 없음,해시태그 없음,연령 등급 없음
오늘도 빨루,빨루,드라마,201.7만,9.9,전체68,"전체 2,695","빨루가 살아온 그리고 앞으로 살아갈 좌충우돌 인생 이야기.

<넘 많은 고양!> 빨루 작가의 데뷔작이 카카오페이지에 착륙했다! 

꿀잼 외전과 함께 보는 개그 일상툰 <오늘도 빨루>!","#일상물, #일상, #귀여운",전체이용가
제목 없음,작가 없음,장르 없음,조회수 없음,별점 없음,회차수 없음,댓글수 없음,줄거리 없음,해시태그 없음,연령 등급 없음
제목 없음,작가 없음,장르 없음,조회수 없음,별점 없음,회차수 없음,댓글수 없음,줄거리 없음,해시태그 없음,연령 등급 없음
텐더 나이트 [개정판],탄콩,BL,75.3만,9.8,전체81,전체 578,"[매주 화요일 업데이트, 5화 연재 후 1회 정기 휴재]


제약 회사 마케팅팀 대리 최성원은 
그 회사의 회장이자 어머니인 최수빈에게 인정받기 위해 살아왔다. 
우성 알파인 어머니에게 인정받기 위해서는 완벽한 모습을 갖추는 것은 물론, 
형질 역시 반드시 ‘알파’로 타고나야만 했다. 

그러나 성원은 베타로 태어났고, 어떻게든 알파가 되어야 했던 그는 
몰래 알파 페로몬 유도제를 맞아가며 열성 알파로 위장한 채 살아간다. 
언젠간 형질이 진짜 알파로 바뀌기를 바라면서—

가짜 알파 행세를 하며 성원의 몸과 마음이 서서히 지쳐가던 중, 
단골 바에서 만난 바텐더인 새내기 대학생 한솔은 자꾸만 성원에게 다정하게 군다. 
한솔은 위태로워 보이는 성원이 자꾸만 신경 쓰이고, 
성원은 한솔의 다정함에 서서히 마음을 열지만 한편으로는 그의 마음을 완전히 믿지 못하는데…

 ‘이유 없는 다정함만큼 잔인한 건 없으니까.’

성숙하지만 상처가 많은 연상과
어리숙하지만 다정한 연하의 달콤 쌉싸름한 오메가버스 BL.

ⓒ탄콩/학산문화사","#현대물, #다정, #연하, #연상의, #연상연하",15세이용가
친구는 오작교에서,"YUL,산호",BL,38.5만,9.8,전체41,전체 557,"""그럼 만나볼래? 내 남자친구.""

학창시절부터 10년을 짝사랑한 친구가 커밍아웃했다. 심지어 자신의 애인을 소개해주겠다는데..
지금 이대로도 나쁘지 않다고 생각했던 관계에 균열이 생기기 시작한다.",해시태그 없음,전체이용가
짐승같은 스캔들,"박플럼 [악어스튜디오],샨탈",로맨스,"1,795.5만",9.9,전체78,"전체 9,906","청아함의 대표주자 국민 여배우 여고은, 그리고 퇴폐미 넘치는 스캔들메이커 서범의. 
사실, 이 둘에게는 비밀이 있다. 소속사의 농간으로 '절친 연기'를 하고 있다는 것.

<절친 특집> 리얼리티 프로그램에서는 한없이 애틋하고 다정해 보이는 두 사람, 하지만 이 모든 건 연기였다!

""난 너랑 친구할 생각 없거든? 영.원.히.""
""나도 없거든, 친구 할 생각.""

처음에는 분명 만날 때마다 으르렁대기 바빴던 둘. 
프로그램을 촬영하면서 어느 순간 점점 더 가까워지고, 범의를 싫어하던 고은의 마음에도 작은 변화가 생기기 시작하는데...

이런 고은의 마음을 아는지 모르는지, 자꾸 고은에게 다가오는 범의. 
누군가가 간절히 필요한 상황마다 고은 앞에 나타나는 범의의 모습과 촬영 전 술집에서 범의를 봤던 기억이 겹치며 고은은 혼란스러워 한다.
가벼운 사람인 줄로만 알았는데 자신에게 진심을 보여주는 범의의 모습에 고은은 점점 더 흔들리는데...

과연 이 둘은 오해를 풀고 '가짜 절친'에서 벗어나 '진짜 연인'이 될 수 있을까?","#현대로맨스, #재회물, #오해물, #연예계물, #운명, #우연한만남, #까칠남, #나쁜남자, #다정남, #능력녀, #다정녀, #상처녀, #상처남, #삼각관계, #달달물",15세이용가
이희재 삼국지,이희재,무협,56만,9.9,전체159,전체 629,"돗자리를 팔며 천하를 걱정하던 유비,
세상에 끌려가지 않고 세상을 끌어당기겠다는 조조,
세상은 어찌 나를 낳고 또 공명을 낳았는가 한탄하는 주유.

사람과 사람, 세력과 세력이 맞물리고 부딪치며,
대륙을 질러가고 천지를 뒤흔드는,
중원천하에서 구름처럼 일었던 영웅들의 이야기.",해시태그 없음,전체이용가
나는 회귀자가 아닙니다,"이거,박이동만,나비계곡",판타지,198.8만,9.7,전체55,"전체 1,797","어느날.
은발의 여신이 눈 앞에 나타났다.

[역천의 별. 운명을 거스르는 존재. 종말이 지어진 세계의 유일한 구원자━]

뭔 소리 하는 거야 이 여자.

[그대가 바로 회귀자로구나.]

""…예?”


아닌데요?","#복수, #성좌, #노력, #성장, #조력자, #천마, #창, #초능력",전체이용가
트레이스,네스티캣,액션,"2,739.5만",10.0,전체549,전체 1.4만,"어느날 갑자기 세상에 나타나 인간들을 공격하기 시작한 정체불명의 존재 트러블.
트러블이 나타난 후 인간들에게도 트러블에 맞서 싸울 수 있는 능력자들이 나타나기 시작했다.
트러블, 트레이스, 인간. 각자의 생존을 건 싸움이 시작된다.","#퓨전, #먼치킨, #초능력",전체이용가
제목 없음,작가 없음,장르 없음,조회수 없음,별점 없음,회차수 없음,댓글수 없음,줄거리 없음,해시태그 없음,연령 등급 없음
지금은 37.2도,김꽁,로맨스,192.7만,9.7,전체74,"전체 1,099","'선배의 마음은 뭐였을까..?' 
채은은 인정하고 싶지 않았다.
 
분명 그는 자신 앞에서 다정하게 웃고
사랑스러 눈빛으로 바라보곤 했는데, 
이제 와서 단순히 '아는 사이'일 뿐이라니.
 
우리..., 썸 타고 있던 거 아니었어..?
 
채은은 선배와의 관계가 
흔들리면서 실의에 빠지고,
 
채은의 동기, 지우는
그런 채은이 점점 신경 쓰인다.
 
그리고 채은을 짝사랑하고 있던 진성은,
채은의 마음을 얻지 못하자
자신을 좋아하는 채은의 친구를 이용해
욕망을 채우려 하는데... 
 
서로 다른 마음의 온도,
그 속에서 펼쳐지는 오해와 착각.
그리고 엇갈리는 관계. 
 
벗어나려고 할수록 얽혀드는 로맨스가 시작된다.","#현대로맨스, #성장물, #짝사랑, #다정남, #나쁜남자, #짝사랑녀, #계략녀, #친구>연인, #삼각관계, #달달물",전체이용가
제목 없음,작가 없음,장르 없음,조회수 없음,별점 없음,회차수 없음,댓글수 없음,줄거리 없음,해시태그 없음,연령 등급 없음
제목 없음,작가 없음,장르 없음,조회수 없음,별점 없음,회차수 없음,댓글수 없음,줄거리 없음,해시태그 없음,연령 등급 없음
낙제점짜리 사랑,퐁퐁,BL,19.8만,9.6,전체47,전체 400,"잘생긴 얼굴, 우수한 성적, 다정한 성격 삼박자를 고루 갖춘 전교 부회장 '은형'.
하지만 '은형'에게도 진짜 모습은 따로 있었다.
이를 우연히 알게 된 '승규'는 당황스럽다가도,
까칠하면서도 허술한 '은형'에게 자꾸 참견하고 싶어지는데...
<애정보이스>, <ASMR로 가자> 퐁퐁 작가의 신작!","#짝사랑, #학원물",15세이용가
말하지 말까,마루,로맨스,"1,690만",9.9,전체105,전체 1.9만,"첫사랑에게선 라일락과 만다린의 달콤 쌉쌀한 향기가 났다.
첫사랑의 향기를 다시 찾고 싶은 ‘한 마리'와 향기 나는 남자 ‘길 은수'가 서로 필요로 하는 이야기.","#현대로맨스, #연예계물, #재회물, #짝사랑, #까칠남, #애교남, #능력녀, #걸크러쉬, #나이차커플, #달달물",전체이용가
뉴비 키워서 갈아먹기,"수빙,면지,백삼",BL,154만,9.9,전체85,"전체 2,581","MMORPG의 씨가 마른 게임 시장에 혜성처럼 등장한 「아스타 연대기」. 꽤 오랜만의 역대급 업데이트인 ‘신화’ 난이도 레이드 업데이트 예고가 뜬 날, 전 서버 길드 랭킹전 1위, 퍼스트 클리어 최다 기록에 빛나는 유명 길드 ‘헤이스트’의 마스터 지적(성차현)의 가슴은 설렌다. 그러나 이번에도 당연히 퍼스트 클리어할 생각으로 게임에 접속한 지적은 바로 그날, 자신의 파트너 힐러가 입대한다는 소식을 듣고 마는데!

파트너 힐러 없이 새로운 레이드에 도전할 수도, 그렇다고 파트너 힐러를 탈영시킬 수도 없는 상황에 새로운 공대원 모집글을 올려봤지만 세상에서 가장 빡센 조건, ‘지적 1:1 면접’을 통과하는 사람은 존재하지 않는다. 차단 목록만 열심히 채워가며 하루하루 채팅장을 ♡♡로 도배하던 나날, 그의 앞에 GM의 선물처럼 나타난 뉴비가 있는데!?

지적은 과연 그 귀여운 뉴비, ‘힐줄랑말랑’을 잘 키워낼 수 있을까!?","#현대물, #캠퍼스물, #학원물, #오해물, #착각물, #다정, #미인, #연하, #연상의, #복수, #노블코믹",15세이용가
키스만으론 부족해,"달십,달구,강달콩",로맨스,472.8만,9.9,전체68,"전체 3,402","첫 영화를 찍게 되어 
열정이 넘치는 신인 배우 주아린에게 
크나 큰 문제가 생겼다...

그것은 바로,
한 번도 해본 적 없는 '키스 신'...!

그동안 쌓아온 간접 경험이 있으니
괜찮지 않을까 싶었지만, 역시나 감을 잡을 수 없다.

그러던 중, 같은 소속사 선배이자,
대한민국은 물론 아시아 전역을 휩쓸고 있는
톱스타 강하준이 도움의 손길을 내민다.

""가르쳐줄까? 키스하는 법.""
 
이 두근거림은 역할에 푹 빠져서일까,
선배를 좋아하는 마음 때문일까.
아린의 혼란은 깊어져 가는데...

누구에게도 말할 수 없는 은밀한 레슨의 시작
<키스만으론 부족해>","#현대로맨스, #연예계물, #운명, #능력남, #순진녀, #삼각관계, #달달물, #로맨틱코미디",15세이용가
강비서와 도련님,"김수오,표류",BL,440.1만,9.9,전체45,"전체 2,841","국내 굴지의 대기업, 대윤그룹의 망나니 사생아 윤희수.

""앞으로 도련님의 품행교육은 제 담당이니까.""
""…….""
""아무도 신경쓰지 말아주십시오.""

희수의 일거수일투족을 감시하며 그를 통제하게 된 비서 강주찬,
그리고 그에게서 벗어나고 싶어 발버둥치는 도련님 윤희수.
10년 간 그들은 서로를 길들이며 그렇게 함께 지내게 된다.",#현대물,15세이용가
리버스 빌런,"한여름,Hz,하목,건드리고고",액션,"1,165.3만",9.6,전체110,전체 1만,"과거 환생을 거듭하며 무림정복을 노렸던 정우는 계속해서 자신과 동귀어진하는 진강백 때문에 번번이 무림정복에 실패하고, 결국 5번째 시도마저 실패하며 현대로 환생하게 된다. 환생 후, 원래 목표였던 무림이 없는 현실을 보고 목표를 바꿔, 개인적인 강함을 추구하기로 한다. 하지만 여러 사건에 얽히며 자신을 노리는, 얕잡아보는 무리들이 생기고 정우는 그들을 철저히 짓밟고, 최후에는 전생부터 얽힌 끈질긴 인연인 진강백과의 대결을 펼친다.","#검, #무림, #환생, #천재, #성장, #퓨전",전체이용가
D-졸업,새끼메뚜기,BL,246.1만,10.0,전체50,"전체 2,821","고백을 하는 것도, 받는 것도 남자?!
졸업까지 D-92, 간질간질한 소년들의 로맨스가 시작된다. 

졸업을 앞둔 어느 날, 무영은 같은 반 남학생 찬희에게 고백을 받는다. 고백해 온 상대는 흉흉한 소문을 몰고 다니는 수수께끼의 전학생 백찬희. 
학생회장에 우등생으로 성실하기만한 무영은 생각지도 못한 상대의 고백에 일단 거절을 한다. 하지만 찬희는 이제부터는 자신을 ‘그런 식’으로 생각해달라며 적극적으로 무영에게 다가가는데….","#학원물, #현대물, #캠퍼스물, #성장물, #사랑꾼, #평범한",전체이용가
반야가인 [개정판],"양지,명예,조구오,그웬돌린",BL,135.1만,9.8,전체92,전체 976,"[매주 금요일 업데이트]

형의 갑작스러운 죽음으로 제갈세가의 소가주가 된 민환. 
민환은 아버지의 명을 받아 밤처럼 어두운 숲, 
야림에 들어가 마교의 교주인 범단령을 사부로 삼는다. 
민환은 매사 차가워 보이지만 자신에게만은 다정한 단령에게 
존경과 애정을 키워나간다. 
야림에 만월의 빛이 충만하던 밤, 
민환은 단령에게 피를 마시는 식성이 있다는 비밀을 알게 된다. 
애정에 굶주린 민환은 단령에게 자신의 피를 마셔달라 애원하는데…

“사부님, 이 피를 다 드시고 나면 저를 또 안아주셔야 합니다.”

제자의 피를 탐하는 사부와, 사부에게 안기고픈 제자의
애틋하고 불순한 만월의 밤이 찾아온다!

ⓒ조구오,양지,명예(원작:그웬돌린)/학산문화사","#무협물, #동양풍, #성장물, #동거물, #다정, #집착, #절대강, #꽃같은, #강한, #소심, #연상, #사제지간, #운명적사랑, #연상연하, #동양화스러운",15세이용가
천추강호,황성,무협,193.4만,9.8,전체170,전체 77,"천추강호를 꿈꾸는 천하제일가!
가문에 드리운 음모의 싹이 트면서,
어둠의 운명과 강호 혈풍이 불기 시작한다.
너는 무엇에 운명을 걸 것인가?

내가 천하제일가 적통 후계라고?
전혀 관심 없어.
그런 후광이 없어도 지금까지 잘 살아왔고, 앞으로도 그럴 거야.
내 인생은 내가 선택하는 거니까.",해시태그 없음,15세이용가
제목 없음,작가 없음,장르 없음,조회수 없음,별점 없음,회차수 없음,댓글수 없음,줄거리 없음,해시태그 없음,연령 등급 없음
21세기 무인,"스튜디오 질풍,박수영,임준후",액션,220.1만,9.7,전체61,"전체 1,701","""너희들이 열 배 강해진다면, 나는 백 배 강해질 것이다!"" 

임한은 더욱 강해지고 있다.  
약자를 유린하고 서민을 괴롭히던  
조직폭력배와 비리 정치인, 악덕 기업주들은  
한 영웅의 출현 앞에 몸을 사릴 수밖에 없다.  

이제 악의 세력은 단 한 명의 적,  
임한을 상대로 싸움을 벌여야 한다!","#먼치킨, #복수, #성장, #격투, #퓨전, #경찰, #형사",15세이용가
제목 없음,작가 없음,장르 없음,조회수 없음,별점 없음,회차수 없음,댓글수 없음,줄거리 없음,해시태그 없음,연령 등급 없음
쇼윈도의 품격,"다가비,꽃제이",로맨스,"1,149.2만",9.9,전체118,"전체 7,626","태하물산 디자인센터에서 근무 중인 배서아는 8년을 함께 살던 룸메이트 민지현이 유학을 떠나고 함께 살던 집에 혼자 남는다.

그러던 어느 날, 그 집의 원주인이자 지현의 오빠인 ‘더럽게 잘생긴 악마’ 같은 민승현이 외국에서 돌아오고, 그에 의해 집에서 쫓겨날 위기에 처한다.

이러한 위기 속에 정신없이 출근한 회사에서마저 민승현이 새로운 본부장으로 부임하며 창창하던 서아의 앞날은 암운을 드리운다.

한편, 민승현은 계속 자신과 엮이는 배서아가 신경 쓰인다. 게다가 입맛이 까다로운 편인 승현은 우연히 먹게 된 서아의 음식에 반하고, 결국 쫓아내야 할 서아에게 방 한 칸까지 내어주고 마는데….","#전문직물, #까칠남, #재벌남, #직진남, #평범녀, #능글녀, #갑을관계, #로맨틱코미디",15세이용가
미생 시즌2 1부,윤태호,드라마,"1,901.7만",9.9,전체95,전체 1.9만,함께 출근하고 함께 퇴근하겠습니다!,"#현대물, #경영, #성장물, #회사원, #이야기중심",전체이용가
용의 간택 [완결],"그리다,윤정우,Zurie",로맨스,527.6만,9.9,전체74,"전체 2,847","시간을 거슬러 돌아간다 한들,
백 번을 다시 태어난다 한들,
절대 왕실의 여인만은 되지 않을 것입니다.


호조판서의 여식 열일곱 정재이, 왕가와의 연을 피하기 위해 한양을 떠났지만,
여의주를 찾아야만 하는 세자와 마주칠 줄은 상상하지 못했다.
그리고 그 순간 끊어져 버린 인연, 임성군이 그의 곁에 있다는 것도.


강물에 한월寒月이 비치니
꽃에는 유운流雲이 머문다
달은 잡을 수 없이 멀고
꽃에는 향기가 없어라


간택령 이후 재이는 다시 궁에 들어선다.
이제는
세자의 여인으로.","#시대/역사로맨스, #동양풍, #퓨전사극, #암투물, #운명, #능글남, #다정남, #왕족/귀족, #엉뚱발랄녀, #다정녀, #상처녀, #드라마, #달달물, #성장물, #재회물",전체이용가
실,보리,로맨스,"4,501.8만",9.9,전체103,전체 4.5만,"다시 돌아가는 거야. 당신에게로
환생과 운명을 이어주는 붉은 실.","#시대/역사로맨스, #재회물, #피폐물, #운명, #순정남, #순정녀, #기억상실, #신분차이, #애잔물",전체이용가
애월의 꿈,연지,드라마,"1,099.4만",10.0,전체95,전체 1.5만,"귀걸이의 요력을 빌려 강한 힘을 얻는 대신 
그 부작용으로 감정을 억제당하는 요괴 '묘족'. 

수백 년 전 멸족의 위기 속에서 살아남은 '애월'과 '판화' 두 묘족은,
대륙 서쪽 월 마을 당주 도환의 호위무사역을 맡아 조용히 살아가고 있다. 


그런 어느 날, 요괴신의 대리자 '주노'가 지상에 강림해 묘족들에게 '시련'을 선고한다. 


수수께끼 같은 시련의 과제를 풀지 못하면 이 둘마저 소멸되어 묘족이 지상에서 사라질 위기…! 


애월과 판화는 이 위기를 극복할 수 있을까? 
그리고 시련은 어째서 묘족을 찾아왔을까?",#동양풍,전체이용가
소년의 신성,범고래,액션,520.6만,9.5,전체180,"전체 2,246","드디어 모습을 드러낸 '몬스터'와 윤상필...
더욱 더 견고해진 반일진 연합 '와일드 래빗'에 전쟁을 선포하다!!
소년들의 삼국 전쟁, 과연 그 최후의 승자는..?!",해시태그 없음,15세이용가
토요일은 새우튀김,"인톨,봄봄치",BL,142.6만,9.8,전체59,"전체 1,833","태권도 사범(특이사항:금사빠)인 구원과,
그의 친구이자 매일의 식사를 책임지고 있는 작은 식당의 사장 토람.

매번 구원의 실연을 위로해주고, 배고플 때 밥 먹여주고,
술 취했을 때 뒤치다꺼리까지 해주는 우렁각시(?) 토람과
3년 동안 미묘한 관계를 이어오던 구원은,
어느 날 토람이 꼭꼭 숨기고 있던 크나큰 비밀을 알게 되어 버리는데...!

츤데레 미남 토람과, 쾌활하고 능청스러운 구원의 바삭바삭한 보은 로맨스!","#현대물, #동양풍, #짝사랑, #운명, #다정, #무심, #미인, #츤데레, #능글한, #미남, #아방, #계약연애/결혼, #운명적사랑, #친구>연인, #사랑스러운",15세이용가
제목 없음,작가 없음,장르 없음,조회수 없음,별점 없음,회차수 없음,댓글수 없음,줄거리 없음,해시태그 없음,연령 등급 없음
하드캐리 서포터,"넬피,홍현,라포르테",판타지,393.9만,9.7,전체86,"전체 2,809","기억 속에서 잊혀진 게임.
'아스라'의 랭킹 1위, 서현.

이젠 가상현실 게임으로 다시 태어난
'아스리안'을 점령하러 왔다!

그런데…

[축하합니다! 히든 직업 '서포터'가 선택되었습니다!]
딜러인 줄 알았던 히든직업의 상태가?

지금까진 없던 최강의 서포터!
현의 플레이가 지금부터 시작된다!","#게임, #먼치킨, #시스템, #천재, #노력, #성장, #고인물, #마법사, #서포터, #만능, #플레이어",전체이용가
제목 없음,작가 없음,장르 없음,조회수 없음,별점 없음,회차수 없음,댓글수 없음,줄거리 없음,해시태그 없음,연령 등급 없음
계약직 신부,"여호경,이윤희",로맨스,312.3만,9.8,전체50,"전체 1,668","""우리 계약하자. 앞으로 2년, 부부로 사는 걸로.""

결혼하면 10억, 이혼하면 10억.
한결의 거절할 수 없는 제안에 은수는 2년 동안의 계약직 신부가 되기로 한다.
""대신 조건이 있어요, 저와 결혼한 동안엔 다른 사람은 만나지 말아주세요.""

그런데…큰 집에서 같이 살자는 회장님 a.k.a 시할아버지…!
덩달아 같이 이사 온 부사장님 a.k.a 사촌 시누이…!

저는 이제…어떻게 되는 건가요…?!","#현대로맨스, #오피스물, #순정남, #재벌남, #절륜남, #엉뚱발랄녀, #순정녀, #다정녀, #계약관계, #달달물",15세이용가
나태한 소드마스터,"마루코믹스,초록차",판타지,714.2만,9.4,전체121,"전체 4,172","자신의 의지와 상관없이 성검의 선택을 받은 용사.
세계의 구원을 위한다는 명목에 오로지 타인을 위해 살아온 인생이 지긋지긋하기만 했다.
구원을 위해 마지막 남은 최후의 적, 마왕을 쓰러뜨리고 결심한 건 자신의 죽음.

짊어진 용사의 의무와 성검의 주인이라는 짐을 벗기 위해
마왕과 함께 목숨을 버리고 영원한 안식에 빠져들려고 했는데…

""오!! 도련님께서 하루라도 빨리 검을 잡고 싶어하시는 것 같습니다!!""
""백작님! 도련님 좀 보십시오! 벌써 검에 관심이 생기셨나 봅니다!!""

검에서 벗어나려고 목숨까지 버리고 마주한 건 검술명가의 막내아들로 환생이라고!?

""차라리 다시 죽여줘!!""","#차원이동, #환생, #먼치킨, #천재, #고인물, #검사, #마검사, #마왕, #명문세가",전체이용가
"다녀왔어, 어서 와 시리즈",이치카와 이치,BL,491.6만,10.0,전체58,"전체 3,194","훈남 남편과 깜찍하고 귀여운 아기에게 둘러싸인
평화로운 주부 라이프♥

스스로에게 자신감이 없는 전업주부, 후지요시 마사키.
엘리트 샐러리맨인 남편 히로무와 곧 2살이 되는 아들 히카리와 함께
평범하지만 소중한 일상 속에서 조금씩 자기 자신을 받아들여 간다.
기쁨과 슬픔을 딛고 어제보다 더 “가족”이 되어가는 세 사람.
당신에게 따뜻함을 안겨줄 후지요시 가의 일상 속으로 어서 오세요.

[THE OMEGAVERSE PROJECT COMICS]
TADAIMA OKAERI
©Ichi Ichikawa 2016
All rights reserved
First published in Japan in 2016 by FUSION PRODUCT Publishers Ltd., Tokyo 
Korean version published by NEXCUBE, Inc.
Under license from FUSION PRODUCT Publishers Ltd.",해시태그 없음,15세이용가
세이프 파트너 [개정판],"상한녹차,후웅",BL,120.4만,9.8,전체48,전체 592,"입사 첫날부터 쭉 짝사랑 해오던
장현수 사장을 대신해 줄 상대를 찾아 바에 왔던 하경은 
우연히 그 자리에서 현수와 마주치게 된다.

""그 녀석 말고 나랑 해, 파트너.""
""하지만 사장님은 약혼자가 있으시잖아요.""

이 관계, 괜찮은 걸까?

#오피스물 #현대물 #재벌공 #강공 #직진공 #짝사랑수 #소심수",#현대물,15세이용가
제목 없음,작가 없음,장르 없음,조회수 없음,별점 없음,회차수 없음,댓글수 없음,줄거리 없음,해시태그 없음,연령 등급 없음
