Title,Writer,Genre,View Count,Rating,Episode Count,Comment Count,Story,Hashtags,Age Rating
영원한 조연은 없다,"dudu,김로아",로판,174만,9.5,전체66,"전체 1,526","눈을 뜨니 한 순간의 실수로 추락한 조연에 빙의했다.

“하필이면 여주인공도, 돈 많은 부자도 아닌,
대형 사고 한 번 치는 걸로 나오던 그 덜떨어진 신관 엑스트라라니!”

‘하급 신관 엘레나’가 강제 노역의 위기를 벗어날 방법은 단 하나.
평민의 신분을 숨기고 황제의 남동생을 가르치는 신학 교사가 되는 것.

기왕 이렇게 된 거,
같은 교사이자 여주인공인 ‘로잘린느’ 옆에서 삼각 로맨스를 직관하고
결국은 남주인공인 황제에게 정착하는 러브 스토리나 지켜볼까 했더니….

“당신 정말 평민이었군요?”

정체를 들킴과 동시에 로잘린느의 무시무시한 민낯을 마주하고 만다.
그런데… 로잘린느의 일을 대신하며 남주인공들과 엮이기 시작한다?
잠깐, 이건 여주인공의 역할이라고!

하지만 그들의 맹렬한 접근에도 불구하고
엘레나에게는 우연히 만난 보잘것없는 수습 기사가 눈에 밟히는데….","#로맨스판타지, #빙의물, #역하렘, #왕족/귀족, #소유욕/독점욕, #짝사랑남, #조신남, #순진녀, #엉뚱발랄녀, #쌍방삽질, #로맨틱코미디, #육아물, #착각물",전체이용가
사자 김명수,탐이부,드라마,5.5만,10.0,전체30,전체 112,평생 고양이 인줄 알고 살아온 사자 김명수! 초원으로 돌아가 사자답게 살기 위해서는 혹독한 훈련을 견뎌내야 한다! 겁많고 허약하기 짝이 없는 명수는 과연 초원으로 돌아갈 수 있을 것 인가!?,해시태그 없음,전체이용가
술김에 황후가 되었습니다,"혜빈,매랭초,거주자",로판,104.4만,9.9,전체99,전체 859,"“술김에 청혼해서 황후가 된 여인의 일과 사랑을 모두 잡은 성공담”

최연소 박사학위 취득! 아카데미 수석 졸업생! 
이 모든 이력에도 불구하고 여자가 너무 똑똑하다는 이유로 10년 만에 만난 약혼자에게 대차게 차인 엘리에르.
분한 기분에 술집에서 취한 채 이름도 모르는 미남에게 덜컥 청혼을 해버린다.
술에 취해 던진 얘기라 결혼이 될 리 없다 생각하고 있었는데… 상황이 이상하다!

“황제였다고?”
“설마, 황제에게 청혼하고 농담이었다고 하는 건 아니겠지?”

술 취해 던진 헛소리에 상대를 골라도 단단히 잘못 골랐다. 도망치려고 해도 포악하기로 유명한 황제에게 벗어나기란 쉽지 않다.
황실 모독죄로 형장의 이슬로 사라지지 않으면 다행인 상황. 황제가 무슨 이유로 취중 결혼을 받아들였는지 모르겠지만 이 남자 진심인 것 같다. 

“널 만난 순간부터 내 인생에는 너뿐이었다. 엘리에르.”","#로맨스판타지, #궁정로맨스, #운명, #왕족/귀족, #능력남, #능력녀, #뇌섹녀, #걸크러쉬, #달달물, #회귀물, #정략결혼, #사이다녀, #계략남",15세이용가
설련화,신상윤,드라마,19.1만,9.6,전체43,전체 164,"미모를 무기로 수많은 남자들에게서 애정을 채우고,
그것으로 자존감을 유지하며 살아가는 설련화.

그 많은 남자들 중에서도
자신을 사로잡는 남자가 딱히 없다고 느끼던 때,
꿈에 그리던 완벽한 남자,
박강식이 그녀의 눈앞에 나타난다.

그 남자에게 관심을 두기 시작하지만
먼저 관심이 있었던 김민혜가
그 상황을 호락호락하게 두고만 보지 않는다.
결국 둘은 박강식을 두고 신경전을 벌이기 시작하는데...","#현대물, #썸, #스릴 넘치는",15세이용가
"그 어장, 내가 가져보겠다","안하나,다온스튜디오,꽃니랑",로판,427.5만,9.9,전체60,"전체 2,889","재벌가 사생아였던 첫 번째 삶, 
마교주의 사생아였던 두 번째 삶을 지나 
이번 생은 소설 속 멸문 당하는 가문의 사생아로
빙의했다...!

멸문당하는 가문따위 버리고 떠나려고 하는데,

원작에서는 사생아에게 신경도 쓰지 않던 아빠가 이상하다.
""블리스, 너를 위해선 뭐든지 해줄 수 있단다.""

그리고 미래에 가문을 멸문시킬 악녀인 언니가 눈에 들어오기 시작한다.
""안녕, 아가야, 나는 네 언니야...""

그래! 이번 생은 가족들과 함께 살아보자!
라고 결심하자마자 


원작 여주의 어장에 있어야 하는 
남주들이 나에게 집착하기 시작한다...!

내 세 번째 인생, 이대로 괜찮을까?","#로맨스판타지, #육아물, #빙의물, #먼치킨, #로맨틱코미디, #치유물, #힐링물, #능력녀, #다정녀, #직진남, #계략남, #다정남, #초월적존재, #천재, #역하렘",전체이용가
이세계 몬스터들,삼계애니메이션,액션,4.6만,7.7,전체69,전체 54,"99지역에 무시무시한 몬스터가 나타났다!
어떡해? 죽는 거 아냐? 하지만, 걱정하지 마시라. 
나 문영수에게는 공격해 오는 적을 튕겨내는 '저항 오라'가 있으니!
평범한 소년 문영수는 몬스터가 판치는 이세계로 오게 된다.
그러나 '몬스터 홀리기'라는 패시브 스킬 탓에 몬스터는 계속 꼬이고 결국 잡아 먹힐 위기에 놓인다.
그 순간, 새 패시브 스킬 '저항 오라'를 얻어 엄청난 힘으로 상대를 쓰러뜨리고 위기에서 벗어난다.
이제 고생은 끝인 줄 알았건만, 이 스킬에도 치명적인 약점은 있었으니…","#지존, #플레이어, #초능력, #영웅/신화, #생존, #복수, #무림, #고인물, #먼치킨, #천재, #격투, #퓨전",15세이용가
양아치의 스피치,"네온비,김인정",드라마,23.4만,10.0,전체21,전체 140,"온정 고등학교 2학년,
훈훈한 외모에 적당히 날티나는 남학생 이솔.
미술관 현장학습에서 이솔은 옆 반 여학생 송이도를 만나고,
첫눈에 반한다.

연애가 제일 쉬웠던 이솔은 평소 하던 대로
송이도에게 냅다 고백하지만, 
송이도는 이솔의 정제되지 않은 언어를 듣고
일주일 안에 '자신이 제안한 방식대로' 말할 수 있다면
이솔의 고백을 받아들이겠다고 대답한다. 

일주일 후 이솔은 제대로 된 고백에 성공할 수 있을까?
생각조차 ‘밈’으로 하는 이솔,
정돈되지 않은 말이 힘든 송이도의 본격 ‘언어’ 로맨스 코미디!","#학원물, #성장물, #짝사랑, #친구, #학생, #사랑스러운",15세이용가
그라티아,"상민,기현",판타지,11.4만,10.0,전체235,전체 400,"예수가 창조했다고 알려진 무한한 힘을 지닌 '권능의 열쇠'!

10년 전, 그것을 얻기 위해 나타난
대악마 사탄으로 인해 뉴욕이 붕괴하고,

살아남은 유일한 생존자, 전설의 엑소시스트 진오기는
악마에게 빼앗긴 권능의 열쇠를 찾아 전 세계를 돌아다닌다.

열쇠의 흔적을 쫓아 서울에 도달한 진오기는
씩씩한 소녀 길가온을 만나고,

반 년 전에 자살로 죽은 친구 귀신을 지키는
가온에게서 엑소시스트 가능성을 본다.

진오기를 만난 후,
친구를 지키지 못했다는 죄책감을 지니고 있던 가온도
소중한 사람을 지키기 위해 엑소시스트가 되기로 결심한다.","#이종족, #초능력, #성직자, #마교, #전쟁, #영웅/신화, #선계",15세이용가
언니의 인생을 연기중입니다,"두민,그리는달",로맨스,87만,9.7,전체50,전체 551,"사랑이 없던 계약 결혼이 문제였던 걸까?
여름은 언니의 결혼식 당일, 언니와 함께 사고에 휩쓸리고 만다.

“한겨울은 너잖아. 한여름은 네 동생이고.”
“…….”
“네 동생은 그 사고로 죽었어.”

무표정한 얼굴, 까칠한 말투, 무심한 눈빛.
딱딱하게 전해져오는 남자의 말엔 언니에 대한 일말의 애정도, 사랑도 없었다.
분명 그랬는데…….

“주제넘게 굴지 말라고.”
“…….”
“한겨울, 내 여자라고.”

언제부터였을까.
그의 눈에 짙은 소유욕이 들어차기 시작한 건.

그의 말 한 마디에 내 가슴이 떨리기 시작했던 건.","#현대로맨스, #빙의물, #영혼체인지, #전문직물, #법조계, #운명, #까칠남, #재벌남, #카리스마남, #능력녀, #걸크러쉬, #사이다녀, #계약관계, #달달물, #로맨틱코미디",전체이용가
미리내,양생,로맨스,19만,10.0,전체50,전체 332,"학교 숙제로 방문한 유적지에서 이상한 일들을 겪은 원란.
기이한 목소리에 홀려 도착한 사찰에서
어제 본 이상한 남자의 승천을 도와달라는 부탁을 받는다.

수능에 체육 실기까지 준비해야 하는 원란은 겨우 2학년의 고등학생.
복잡한 일에 휘말리고 싶지 않은 원란은 거절하려 했지만,
혼자 남겨질 그의 뒷모습이 눈에 밟힌다.

“자열씨가 승천할 수 있도록 도울게요. 대신, 딱 내년 ‘봄’이 오기 전까지만!”","#인외존재, #드라마",전체이용가
전직 성녀와 흑막의 비밀 연애,"49,연아,KKY,꽃니랑",로판,215만,9.8,전체65,"전체 1,968","평범하게 살아가던 휴학생 김지연,
그녀는 친구가 보여주었던 로맨스 소설 <성녀의 꽃>에 빙의를 하게 된다. 
절반밖에 읽지 못한 소설 속에 등장했던 아이올라라는 소녀. 성녀인게 분명한 여주인공과 남주인공의 로맨스 속 세계는 자신의 것은 아니다.  
그래도 소설 속의 인물이 되었으니 행복할 수 있으리라 생각했다. 소설 속의 주인공이 된 것처럼 그렇게. 하지만 모두가 그녀에게 증오를 던진다. 혐오를 말한다.
여주인공을 괴롭히는 악녀이자 가짜 성녀인 아이올라라고. 

그러나 아니었다. 바로, 아이올라 그녀가 진정한 성녀였다. 
신의 축복으로 다시 되돌아간 처음의 시작. 그녀는 가족도, 증오하는 사람들도, 성녀의 자리도, 사랑했던 약혼자도 다 필요 없었다. 
과거와는 다른 길을 걸을 것이다.

""이 세계가 나를 악녀로 만들려고 해도 상관없어.
난 반드시 살아남아 행복해질 테니까!""","#로맨스판타지, #빙의물, #회귀물, #도도녀, #능력녀, #사이다녀, #순정남, #능력남",전체이용가
재투성이 소녀는 빛의 공녀님,"Izumi Sasa,Shimano",로판,44.1만,9.7,전체50,전체 399,"잿빛 머리의 고아 '신더'는 재처럼 더럽다고 천대받으며 노예로 부려지는 고통스러운 나날을 보내고 있었다.
유일한 마음의 쉼터인 말벗은 작은 새 '심'뿐.
그런데 어느 날 밝혀진 신더가 '빛의 여신'의 후예이자 일제스타 가문의 유일한 딸이라는 소식!
그렇게 신더는 하루아침에 후작가의 영애가 된다.
지금까지의 괴로운 나날로부터 해방되어 다른 삶을 살게 된 신더는
'루미엘라(빛)'라는 진짜 이름을 얻으며 조금씩 자존감을 되찾아 간다.
처음으로 가지게 된 '가족'이라는 존재에 당황하면서도,
상냥한 오빠들 사이에서 사랑받으며 후작 영애로서의 삶이 시작된다...!","#로맨스판타지, #가족물, #왕족/귀족, #오빠, #애교녀, #순진녀, #순정녀, #신분차이, #치유물, #힐링물",전체이용가
340일간의 유예 [개정판],미치,로맨스,57.5만,10.0,전체71,전체 396,"다종 국제사회. 
평생 한 사람만을 사랑하는 종 ""셧"" 화린은 
자신의 짝인 율도성을 쫓아 영국에서 한국의 고등학교로 전학한다. 

하지만 도성은 화 린에게 지나치게 차갑고, 
린을 싸늘하게 거부하는데... 
한편 한국에선 잔인한 살인 사건이 연달아 일어나고 있다.

""18년 동안 만나고 싶었어. 내 짝. 내 사랑.""","#현대로맨스, #학원물, #가상시대물, #운명, #카리스마남, #순정녀, #금단의관계, #드라마",15세이용가
그 던전의 S급 시한부 영애,"여울,유람,면,67층의",로판,281.6만,9.7,전체70,"전체 2,027","대한민국 최초의 S급 헌터이자 신유리 헌터팀의 리더.
신유리.

초 고난이도로 예상되는 L급 게이트 클리어를 위해 던전에 입성했는데…!!

『연약한 시한부 영애에 빙의해버렸다』 던전에 입장합니다.

로판이 배경인 RP던전에 입장하더니
시한부 영애에 빙의해버렸다…?!

같은 팀원들은 삐까번쩍한 애들한테 빙의했는데 왜 나만…!!!

걷기만 해도 체력이 깎이는 이 몸뚱이도 갑갑해 죽겠는데
왜 너희들까지 그러니..?!

과연 이 던전, 멀쩡한 꼬라지로 깨고 나갈 수 있을까?","#로맨스판타지, #여주판타지, #차원이동물, #빙의물, #레이드물, #시한부, #짝사랑",전체이용가
제목 없음,작가 없음,장르 없음,조회수 없음,별점 없음,회차수 없음,댓글수 없음,줄거리 없음,해시태그 없음,연령 등급 없음
당신의 서정적인 연애를 위하여,"래고,김모래",BL,55만,9.8,전체51,전체 630,"""저는 당장 사람이 급하고, 승혁 씨는 일자리가 없고. 딱 좋지 않아요?""
""숙식제공도 되는데.”  
누구보다 서정적일 것 같지만 속내는 시커먼 남자와 
전직 조폭이지만 앞으로는 서정적인 인생을 살 남자가 만났다. 
 
사랑은 일기를 쓰게 한다. 사랑은 시를 쓰게 한다. 사랑은 글을 쓰게 한다. 
사랑은 서정적인 글을 쓰게 한다.","#현대물, #조직/암흑가, #복수물, #다정, #소심, #연하, #존대하는, #원작소설",15세이용가
제목 없음,작가 없음,장르 없음,조회수 없음,별점 없음,회차수 없음,댓글수 없음,줄거리 없음,해시태그 없음,연령 등급 없음
팬픽 탈출 백서,"마풍각,좌청룡,빌리버스",로맨스,32.8만,9.9,전체67,전체 848,"인기 아이돌 '소년백서'가 끔찍한 사고로 죽은 그날, 2016년 7월.
열혈팬이었던 한나는 자신이 4년 전 썼던 팬픽 속에 들어가게 된다.
졸지에 남장여자 멤버로 빙의한 그녀는 팬픽의 주인공인 멤버 해준과 주원을 이어줘야만 하는데...
그녀는 무사히 팬픽의 엔딩을 내고 빠져나갈 수 있을까?


OST: 소년백서 - Funk! Funk!
멜론 및 모든 음원 사이트에서 감상 가능합니다

#아이돌 #소년백서 #SNBS #funkfunk #버튜버 #쇼호스트 #빌리버스 #카카오페이지 #팬픽 #OST","#현대로맨스, #빙의물, #연예계물, #남장여자, #드라마, #동거물, #남장여자물, #차원이동, #짝사랑, #역하렘, #능글남, #사이다남, #외유내강, #순진녀, #직진남",전체이용가
[드라마 외전] 힘쎈여자 황금주,"이원식,참치캔,백미경",드라마,189.7만,9.9,전체39,"전체 1,770","드라마 <힘쎈여자 강남순>의 스핀오프 웹툰 <힘쎈여자 황금주>!

모계혈통으로 이어져 내려온 타고난 힘을 가진 여자 황금주.  

금주는 힘도 세지만 어릴 때부터 돈에 대해 촉수가 발달했다. 
20살에 엄마에게 빌린 1억으로 차린 선짓국 집이 대박이 나기 시작하면서 
금주는 떼돈을 벌어 엄청난 부를 축적하기 시작하는데…

사랑하는 남자를 만나 쌍둥이를 낳고 행복하게 살던 어느 날, 금주의 딸 강남순이 실종되는 사건이 벌어지고 만다. 

세상이 무너지는 슬픔을 겪게 된 금주는 딸 남순이 누군가의 도움을 받아 
잘 살길 바라는 마음으로 돈없고 힘든 사람들을 도와주기 시작하는데… 

여자와 어린이와 노약자는 무조건 지키는 '강남의 가죽부츠' 황금주의 활약상이 시작된다!","#현대물, #권선징악, #초능력, #가족, #라이벌, #사업가, #여주중심",전체이용가
야설록 죽음의 승부 컬렉션,야설록,무협,34.9만,10.0,전체178,전체 69,"<야설록 죽음의 승부 컬렉션> 작품구성

1. 전능대공 [개정판]
2. 백발마도 [개정판]
3. 혈오제 [개정판]",해시태그 없음,15세이용가
방구석 아싸인 내가 폭군에게 청혼 받아버렸다,"로미유,외이레,(주)툰플러스",로판,155.6만,9.8,전체51,전체 923,"'귀신 보는 년'이라는 꼬리표로 방구석에서 나가지 않던 내가 노잼이라며 읽다만 소설 속에 떨어졌다.
소설 속 남주인 녹티스 대공에게 죽은 엑스트라 악역, 플로티 베베니아에게!

무사히 살아남기만 하고자 다짐했건만.

""잘 잤나, 부인?""
""그대는 나를 언제까지 어려워하는 건지""
""서운해서 참을 수가 없어""

날 죽이려던 대공이 조금 이상하다?
난 이 노잼 소설에서 빠져나가고 싶을 뿐이라고!","#로맨스판타지, #성장물, #빙의물, #여주판타지, #먼치킨, #왕족/귀족, #계략남, #집착남, #능력녀, #계약관계, #쌍방삽질, #달달물, #권선징악",15세이용가
짝사랑의 스킬 [GL],"튼튼,까르보",로맨스,15만,9.9,전체51,전체 451,"레즈비언인 유나는 17살 때부터 10년지기 친구인 다혜를 짝사랑하고 있다. 
하지만 다혜는 남자를 너무너무 좋아하는 이성애자로, 항상 썸남이 끊기지는 않지만 한편으로는 제대로 남자를 사귀어본 적 없는 모태솔로이다. 다혜가 모태솔로인 이유는, 다혜의 썸남들이 어째서인지 모두 유나를 좋아하게 됐기 때문이다. 하지만 다혜는 유나와 계속 친구 관계를 유지해줬고, 유나는 너무 다행이라고 생각하고 있다.
그러나 짝사랑도 10년이 다 되어가니 기약 없는 사랑에 지쳐가기만 한다. 
그때 마침 27년만에 생애 처음으로 사귀게 된 레즈비언 친구 주영과 일 때문에 만나게 된 레즈비언 거래처 사장 조이의 등장으로 유나는 짝사랑을 졸업하고 새로운 사랑을 찾을 준비를 한다. 
그런 유나를 바라보며 다혜의 마음에도 변화가 생기는데…",해시태그 없음,15세이용가
제목 없음,작가 없음,장르 없음,조회수 없음,별점 없음,회차수 없음,댓글수 없음,줄거리 없음,해시태그 없음,연령 등급 없음
세기의 악녀,"네온비,PITO",로맨스,10.2만,9.5,전체52,전체 202,"잃어버린 아름다움과 영광을 다시 찾을 수 있는 단 한 번의 위험한 기회! 
당신이라면 미(美)칩을 이식하시겠습니까?","#현대로맨스, #성장물, #연예계물, #다정남, #조신남, #걸크러쉬, #사이다녀, #능력녀",전체이용가
어떠한 경우라도,말가,BL,28.5만,9.6,전체59,전체 410,"지옥의 통학을 버틴 끝에 드디어 자취를 시작하게 된 최경우. 
자취의 단꿈에 부풀어 있던 것도 잠시… 투자한 돈을 몇 배로 불려준다는 동기의 말에 혹해 자취방 보증금을 홀랑 날리고 만다. 
집도 절도 없는 경우를 딱하게 여긴 선배가 지낼 곳이 있다며 ‘집 넓고 혼자 사는 애’ 원태희를 소개시켜주고 태희는 흔쾌히 경우를 자신의 집에 머물게 한다. 
그날 밤, 세상은 아직 살 만하다며 편안히 잠든 경우의 방에 태희가 조심스레 들어오는데?!",해시태그 없음,15세이용가
도깨비는 우는 법을 모른다던데,"젤리빈,누텔라",로맨스,92만,9.8,전체32,전체 984,"산속에서 평화롭게 살던 도깨비 이매는
두 여인에 의해 인생이 송두리째 바뀐다.

지금까지 누군가를 이렇게 사랑했던 적도
이토록 미워했던 적도 없다!

씩씩한 소녀와 말썽꾸러기 여우,
그리고 잔혹하지만 순정을 간직한 도깨비.

셋의 인연이 선연이든 악연이든 한 가지는 확실하다.
누구 하나가 죽어야만 끝나겠구나!

유쾌와 애달픔을 오가는 서정적인 로맨스 드라마.","#동양풍, #오해물, #동거물, #인외존재, #차도남, #까칠녀, #순진녀, #라이벌/앙숙, #삼각관계, #드라마",전체이용가
조연도 나름 힘들다,"정,하일라",드라마,32.2만,9.7,전체70,전체 522,"춘향이의 향단이 같은 삶을
살다 교통사고를 당한 미향,
'이번 생은 그렇게 살지 않겠어!' 다짐한다.

하지만― 왕비의 운명을 지닌체 빙의한 친구, 시연을
맞닥뜨리고 한계를 느낀 데미안은
새로운 다짐을 한다.

'로맨스가 안된다면 다른 쪽을 노리겠어.
난, 여성 최초 재무대신이 되겠어!'","#서양풍, #가상시대물, #성장물, #영혼체인지/빙의, #차원이동, #차원이동물, #왕족/귀족, #두근거리는, #귀여운, #사랑스러운",15세이용가
공녀는 지금부터 파업합니다,"포토푀,MAMAKOTO,가람달",로판,356.1만,9.8,전체66,"전체 2,229","공작가의 사생아로 자란 공녀, 아르릴 프레이 브릭시아. 
붉은 눈동자와 검은 반점으로 평생 가면을 쓰고 살아야 했던 그녀는
가족의 인정과 사랑을 받기 위해 자신을 혹사 시켜가며 가문의 일을 도맡았다.
타고난 머리와 깔끔한 일 처리로 수완을 보이며 인정을 받는 듯했으나, 그것은 그녀의 착각이었다.
죽기 살기로 발버둥 친 그녀에게 내려진 대가는 가문을 위한 죽음 뿐.
 
그리고 회귀.
 
다시 돌아온 과거, 거울 속에 비친 얼굴에 흉측한 반점은 더 이상 존재하지 않았다.
깨끗해진 자신의 얼굴을 들여다보던 그녀는 결심한다.
 
자신을 죽인 가문에게 복수를 위하여 파업하기로.","#로맨스판타지, #회귀물, #천재, #트라우마, #다정남, #순정남, #직진남, #능력녀, #무심녀, #계략녀, #권선징악, #드라마, #친구>연인",전체이용가
안젤리카 : 우리 아내가 달라졌어요,"탄지,DY,마셰리",로판,76.9만,9.6,전체55,전체 834,"""안젤리카, 난 당신 아니면 결혼 못해.""

긴 짝사랑 끝에 결혼했지만 
늘 무심하고 냉정했던 남편, 도미닉.

숙부의 반역, 천정부지로 쌓인 빚, 멸문당한 친정,
견디다 못해 스스로 목숨을 끊고 난 후 
회귀한 안젤리카 앞에 집착과 열기를 가득 머금고 전남편이 나타났다.

""저는 더 이상 소공작님을 사랑하지 않아요.""
""사랑해, 안젤리카. 절대 실망시킬 일 없을거야.""

……아무래도 내 약혼자가 미쳤나 보다.","#로맨스판타지, #회귀물, #정략결혼, #상처녀, #냉정남, #후회남, #직진녀, #능력남",전체이용가
피나는 사랑,게,BL,18.2만,9.9,전체28,전체 227,"다정순애 댕댕공X만년빈혈 뱀파이어수

뱀파이어와 인간의 혼혈인 박이람은
어린 시절의 사고를 계기로 피를 마시지 못한다.

피를 마시지 않고 살아가려면 인간이 되어야 하는데,
진정으로 사랑하는 사람의 피를 마셔야 한다고!?

그런 이람의 앞에 나타난 취향저격의 남자!
과연 이람은 인간다운(?) 사랑을 할 수 있을까?","#현대물, #캠퍼스물, #사내연애",15세이용가
"중대발표 구독, 좋아요 그리고... 복수",쿠도 피타곤,드라마,10.9만,9.9,전체50,전체 170,"중학교 때, 예쁘지 않다는 이유만으로 학교내 괴롭힘의 피해자가 되어야만 했던 레이카.
고등학교 진학도 포기한 채 수술비를 모아 성형수술을 받은 후 자신감이 생긴 레이카는 검정고시를 통해 대학에 입학했지만 중학교 때의 일이 발목을 잡아 주변 사람들과 거리를 둔 채 생활하게 된다.
그러던 어느날 거리 인터뷰를 하자며 말을 걸어온 너튜버, 그는 다름 아닌 중학교 때 자신을 괴롭혔던 당사자였다.
절망에 빠져 있었던 레이카는 트라우마를 극복하고 인생을 새롭게 시작하기 위해 중학교 때 괴롭혔던 녀석들에게 복수를 다짐하며, 그들이 운영하는 너튜브팀에 합류하게 되는데...","#현대물, #음모, #여주중심",15세이용가
"할부로 해주세요, 마왕님!",판톰,BL,20.5만,9.9,전체37,전체 476,"운전면허 필기시험에만 다섯 번 떨어진 유진은
과음을 하고 어찌저찌 악마를 소환하게 된다.

그렇게 소환된 악마는 
본인 취향 얼굴이라면 사족을 못쓰는 악마 ‘달링‘!
유진은 술김에 달링에게 운전면허 시험합격 소원을 빌지만
합격은 커녕 무이자 할부(?)로 영혼을 넘기게 되는데…
""","#판타지물, #우연한만남",전체이용가
마녀의 딸이 남주의 저주를 풀면,"마루코믹스,슈룹",로판,243.8만,9.8,전체70,"전체 2,138","남주에게 야수가 되는 저주를 건 마녀.
의 수양딸로 빙의해버렸다!
마녀와 함께 남주를 괴롭히다가 죽고 싶지는 않으니,
남주를 지극정성으로 보살폈는데…

""부탁이야, 나를 두고 가지 마.""
""네, 네?""
""네가 그랬잖아. 네 말만 잘 들으면 먹여주고, 재워주고, 잡아먹어 주겠다고.
네가 나를 버린 후에도 나는 그 말만 생각하며 버텼어.""

버려요? 제가요? 누구를요?

한 마리 흑표범 같은 남주가 내게 애원을 하며 매달리기 시작했다.","#로맨스판타지, #빙의물, #성장물, #우연한만남, #운명, #까칠남, #능글남, #직진남, #츤데레남, #외유내강, #엉뚱발랄녀, #능력녀, #라이벌/앙숙, #쌍방삽질, #로맨틱코미디",전체이용가
