Title,Writer,Genre,View Count,Rating,Episode Count,Comment Count,Story,Hashtags,Age Rating
하수도,갈까막E,드라마,36.2만,9.5,전체51,전체 568,"8년 전.. 정체불명의 생물체에게 딸과 아내를 잃은 노형사 천도철. 실낱같은 희망의 끈이라도 잡기 위해 그는 계속해서 강력 범죄자들을 조사해 나아갔다. 그렇게 야속한 8년의 시간이 지나는 듯했다. 

허나, 그렇게 멈춰 있던 그의 시계는 정체불명의 여 형사 ""지수원""이 천도철 혼자만의 부서인 ""특별 민정안정계""로 들어오며 다시 움직이게 되는데.. 그리고 같은 시간, 꿈도 희망도 다 잃고 하수도로 향한 청년 안하리가 지하에서 목격한 거대한 괴생명체는 작업반장과 선배를 한입에 삼키고는 말한다.
""살고 싶다면 나와 계약하라""
8년 동안 숨겨져있던 비밀이 마침내 윤곽을 드러낸다.","#스릴러, #추리물, #경찰, #무서운, #스릴 넘치는",15세이용가
꽃에게 복종하세요,"솜송,프레스노",로판,123.4만,9.8,전체53,전체 994,"광기에 빠진 남자 주인공에게 잔혹하게 죽임 당하는 악녀에 빙의됐다. 마수인 그를 길들이고 여자 주인공과 연결시키는 것이 살아남는 유일한 방법. 저 속을 알 수 없는 잔인하고 매혹적인 마수로부터 나의 계획은 성공할 수 있을까? 그러나 나를 바라보는 마수의 눈빛이 점점 변해간다.
“약속했지.”
“내가 인간으로 변하면, 네가 내 암컷이 되겠다고.” 
그 어느 때보다 진지한 그의 말과 나를 품속에 가둬 둔 단단하고 뜨거운 가슴에 나 또한 마음이 흔들린다. ‘
흔들리면 안 돼, 플로리아. 이건 계약 결혼일 뿐이야!!’","#빙의물, #수인물, #계약관계, #로맨스판타지, #피폐물, #복수물, #능글남, #계략녀",15세이용가
형의 선배 [개정판],레오,BL,26만,9.8,전체30,전체 195,"""미안, 나 다른 사람과 각인했어.""

유학을 마치고 돌아온 인준은 오랜시간 짝사랑하던 세인이
문란하기로 소문난 재경과 각인했다는 소식을 듣고 절망한다.
애써 인준을 뒤로하고 재경에게 향한 세인은
자신을 덮치는 거대한 트럭을 미처 보지 못하고,
몸을 던져 세인을 구한 인준과 재경은 사고에 휘말린다.

한참을 깨어나지 못하다가 눈을 뜬 인준은,
깨어나 본 거울속의 자신의 얼굴을 보고 경악하는데…",#현대물,15세이용가
쌍둥이 언니의 파업 선언,"한도일,전경민,claire,요정용",로판,442.7만,9.8,전체97,"전체 2,148","'쌍둥이는 불길하다.'
아르케니아 제국에 전해오는 미신.

성녀의 표식을 가졌지만 성력이 없는 동생 레아와
표식은 없지만 막대한 성력을 가진 언니 로제트.

언제나 동생 뒤에 숨어 지내야 했던 로제트는
막연한 희생 끝에 죽음을 맞이하지만,
낯선 목소리에 이끌려 과거로 돌아가게 된다.

어쩌면 다시는 돌아오지 않을 소중한 기회,
가면을 벗어던진 성녀 로제트가 선보일 새로운 활약!","#로맨스판타지, #성장물, #환생물, #복수물, #회귀물, #운명, #왕족/귀족, #능력녀, #경쟁구도",전체이용가
하승남 골통천하 컬렉션,하승남,무협,14.7만,10.0,전체170,전체 1,"<하승남 골통천하 컬렉션> 작품구성

1. 기협천하 [개정판]
2. 골통광풍참마(원제:골통엽기마왕) [개정판]
3. 골통그놈이왔다!(원제:골통깜빡) [개정판]",해시태그 없음,15세이용가
그 동화의 끝은 막장 드라마,"고샤,정배,재겸",로판,455.7만,9.9,전체68,"전체 3,102","여기는 동화 속.

동화의 주인공인 언니의 엔딩을 도우면
다시 돌아갈 수 있을 줄 알았다.

그런데 내 삶은
끝날 일 없이 계속되고 있었다!

결혼해야 하는 게
언니가 아닌 나였나…?

아냐, 결혼하고 나서도
이 이야기가 이어진다면…?
생각만 해도 끔찍하군.

""좋아, 이렇게 된 거""

""막 살지 뭐~!""

가장 나 다운 방법으로 이 세계에서 살아남아 보겠어!
막살면서! 하고 싶은 거 다 하고!
잘생긴 약혼자도 낚고 말이야!","#로맨스판타지, #뇌섹녀, #걸크러쉬, #왕족/귀족, #계약관계, #막장",전체이용가
"레이디, 함께 가실까요?","스푼코믹스,빛아름",로판,72.4만,9.5,전체65,전체 720,"평생 충성을 바쳐 온 왕국으로부터 버림받은 기사, 아이린.

볼모가 되어 제국에 간 그녀의 앞에 황태자 카엘이 나타난다.

“당신의 남자가 되고 싶어요. 결혼을 전제로 당신과 만나고 싶어.”

다짜고짜 첫눈에 반했다며 들이대는 그의 모습에 당황스러운 것도 잠시,
아이린의 마음은 점차 흔들리기 시작하는데…….

“키스하고 싶어. 해도 돼?”
“명령인가요?”
“아니.”
“그럼 부탁?”
“아니.”
“그럼…….”
“내 마음, 당신 마음. 그냥 그거.”

과연 카엘의 키스는 아이린의 마음을 사로잡을 수 있을까?","#로맨스판타지, #성장물, #기사물, #짝사랑, #첫사랑, #다정남, #짝사랑남, #존댓말남, #직진남, #무심녀, #걸크러쉬, #철벽녀, #상처녀, #갑을관계, #친구>연인",전체이용가
제목 없음,작가 없음,장르 없음,조회수 없음,별점 없음,회차수 없음,댓글수 없음,줄거리 없음,해시태그 없음,연령 등급 없음
주근깨 가쵸,원동,드라마,10.2만,9.8,전체32,전체 182,"거대한 빙하와 희박한 대기를 품고 있는 고원 마을.
그곳에 사는 가쵸는 달콤한 사탕 맛이 궁금한 사냥꾼 소녀이다.

사냥터에서 아름다운 흰 사슴을 쫓던 와중
땅속 잠들어 있던 거대한 유적으로 떨어지게 되고
그곳에서 이상한 구슬을 삼키게 되는데…","#판타지물, #초월적존재, #성장물, #이야기중심",전체이용가
클로버 카페 메이드씨,만송,로맨스,107.2만,10.0,전체50,"전체 1,429","너무 쉽게 반하는 소녀 '민지은'.
그런 지은이 제일 좋아했던 건,
고등학교 1학년 무렵 같은 반에 학교에서 제일 잘생긴 '김건우'다.

하지만 지은은 생애 첫 용기를 내 한 고백에
""왜 하필 너인 거야….""라는 지독한 멘트로 차이고 만다.

시간은 흘러 지은은 디자인학과로 대학에 입학했지만
소질이 없는지 버겁다.
열심히 한 과제물에 친구들의 폭소가 날아오던 어느 날
지은은 휴학을 결심한다.
하지만 부모님의 허락을 받지 못한 휴학으로
집에서 내쫓기고 마는 지은.

생활비를 벌기 위해 카페 알바 면접을 보게 된 지은은
그곳에서 롱스커트 메이드복을 입은,
고등학교 시절 짝사랑 '김건우'를 마주치게 된다.

더 이상 갈 데가 없는 지은과, 
마찬가지로 물러설 수 없는 건우.

빈티지하고 괴상한 카페 속
청춘 남녀의 배틀 러브스토리!","#현대로맨스, #성장물, #사내연애, #우연한만남, #까칠남, #상처남, #엉뚱발랄녀, #평범녀, #친구>연인, #배틀연애, #로맨틱코미디",전체이용가
판타지TV,SOBORU,판타지,9.7만,9.6,전체100,전체 496,"채널명 판타지TV 하~지마~루요~!!
VR게임 스트리머인 김오근은 고난이도 스테이지를 간단하게 클리어 해 나간다.
그때 갑자기 여신으로부터 많은 돈과 ""제 세계를 구해 주시겠습니까?"" 라는 메세지가?!
농담으로 한 말 때문에 100억원이 걸린 이세계 구하기 미션을 스트리밍하게 된다.
다른 세계에 내려가니 자신의 게임 캐릭터인 오크가 되어 버리고 그곳에서 엘프의 여자아이를 만나게 되는데. 동료가 생긴다든지, 기사단이라든지, 마왕군이라든지...
과연 무사히 세상을 구할 수 있을까?!","#게임, #차원이동, #복수, #생존, #방송, #천재, #노력, #성장, #고인물, #신, #먼치킨",전체이용가
화산검가 [개정판],묵검향,무협,31만,9.9,전체102,전체 114,"음모의 중심인 화산파.
그 속에서 진실을 밝혀내기 위해 세상 끝으로 가려는 자.

옳고 그름은 무엇인가.
정의와 불의는 누가 정한 것인가.

세상을 상대로 싸우리라. 얻으리라.
거짓의 껍질이 벗겨진 진짜 세상!
그리고, 운명을 이겨낸 진정한 자유!",#무림,15세이용가
궁궐의 맹수,"한연,정오늘",드라마,104.1만,9.9,전체50,전체 950,"자신의 능력이 비범함을 알고 있었으나 자신이 왕이 되지 못할 것을 알고 있던 공주는 시녀와 조용히 여생을 살고자 했다.
하지만 현국을 탐내는 주국의 음모가 판을 치고, 공주를 위협이라 느끼는 왕자는 공주의 시녀를 건드리고 시녀는 사라진다.

평생을 궁에서 살며 자신의 이익을 위해 거짓만을 말하던 이들 사이에 진실로 자신을 아껴주던 시녀를 건드린 순간, 
비범한 구렁이는 자신의 사람을 지키기 위해 스스로 이무기를 뛰어넘는 용이 되고자 기지개를 펴기 시작한다.

“현국의 공주가 삼국을 통일할 것이다.”

신의 배려와 용의 호의로 세워진 나라 속 인간의 욕심과 용의 저주로 얼룩진 능력, 예언에서 시작된 예정되어 있던 전쟁.
예언이 완성되고 공주는 과연 황제가 될 수 있을까.","#가상시대물, #동양풍, #미스터리, #신화물, #판타지물, #복수, #성장물, #시대물, #정치물, #초능력, #초월적존재, #고퀄리티, #분량많은, #여주중심, #이야기중심",전체이용가
서울시 퇴마과,"엘가,정명섭,구해",액션,70.8만,9.8,전체52,전체 788,"영능력으로 선임병의 목숨을 구한 일병 광혁은
서울시의 부름을 받아 '퇴마과'로 차출된다. 

늘 자신의 능력을 저주해 온 광혁은 퇴마 업무가 달갑지 않지만,
군 복무를 대체해 준다는 말에 임무를 수락했다.
자신을 영입한 스님이 귀신을 보게 만드는 영안을 닫아 줄 것이라는 기대도 있다.

광혁을 포함해 퇴마과로 모인 개성 넘치는 멤버들. 
이들은 서울시의 갖가지 기괴한 일들을 처리해야 한다. 

계속되는 멤버들의 불협화음과 
누르의 부활을 기다려 온 사이비 종교 집단 새하늘교의 등장,
그리고 스님이 숨겨온, 감당 불가능한 진실...

과연 '서울시 퇴마과'는 임무를 완수할 수 있을까?","#도사, #군인, #무당, #환생, #초능력, #빙의, #복수, #성장, #생존, #격투",전체이용가
안까이,"유지태,유무비,제피가루",드라마,29.4만,9.5,전체43,전체 371,"조선족 출신 청림은 심양에서 폭력조직의 중간 보스인 사촌 형 시권과 일을 하고 있다.

시권이 시키는 온갖 위험한 일을 도맡아 하며 외줄 타기 인생을 살아가는 청림.

 

그날도 도박 빚을 받아내기 위해 한 중국인 남자의 집을 찾아간 청림에게 남성은 한 달 동안 말미를 달라며 담보를 주겠다고 한다.

청림을 데려간 곳은 창고. 그리고 그의 눈에 비치는 것은 행색이 남루한 채 묶여 있는 한 여자였다.

 

‘김옥‘이라는 이름의 탈북 여성인 그녀를 담보로 데리고 고향으로 돌아온 청림.
처음에는 청림을 경계하던 김옥이었지만, 자신을 은근히 챙겨주는 청림에게 조금씩 마음을 열게 된다.
청림 또한 김옥이 은근히 계속 신경이 쓰인다.
 
그렇게 서로의 사랑을 조금씩 키워 나가고 있었지만, 운명은 그들을 갈라놓게 되는데….","#일상물, #현대물, #동거, #범죄, #음모, #조직/암흑가, #가족, #결혼, #계약연애/결혼, #썸, #재회물, #망나니, #고퀄리티, #스릴 넘치는, #이야기중심",15세이용가
철쭉의 묘,소너딧,드라마,58.5만,9.8,전체64,전체 751,"가난하지만 평범한 삶을 살고 있던 혜원.
혜원의 학교에는 소원을 들어준다는 옥상 귀신에 대한 유명한 괴담이 있다.
혜원은 괴담을 믿지 않았지만, 유일한 친구의 배신으로 억울하게 누명을 쓰게 되자,
억울함을 풀기 위해 옥상으로 향하는데...

‘나랑 게임할래?’
그곳에 있던 예쁜 소녀 귀신이 제안한 것은 혜원의 신체를 건 게임이었다.",#스릴 넘치는,전체이용가
호접몽 [개정판],"채오,엠마",BL,7.7만,9.7,전체47,전체 83,"'이놈이 오늘 잊지 못할 밤으로 만들어드리죠.'

출셋길이 활짝 열린 장원급제의 주인공 영의정 댁 아들 백도겸.
오랜 친구의 권유로 탐탁진 않았지만 기방에 난생처음 방문하게 되었는데….
웃돈까지 얹어서 사람을 불렀더니 그게 남자 기생이라니? 맹랑하고 도도하기 짝이 없지만, 자꾸 생각이 나는 그의 이름 '소랑'.
다시는 만날 일이 없을 거라 생각했는데, 도겸은 소랑의 모습이 계속 눈앞에 아른거리고….
그런 도겸의 계속되는 연심 고백에 처음엔 시큰둥했지만 서서히 도겸에게 끌리는 소랑,

그들의 연심의 행방은 어디로? 기방 '호접몽'에 방문하여 확인해 보시길!","#동양풍, #다정, #사랑꾼, #꽃같은, #신분차이",15세이용가
비밀투표,우준용,드라마,18.4만,9.6,전체70,전체 213,"밤이 되면 한 명씩 죽는다. 서로의 잘못을 찾아낼 때까지.
""최종 용의자를 처형하겠다.""
고등학교 졸업 후 각자 제자리에서 평범한 삶을 살고 있던 일행들.

그러던 어느 날, 정체불명의 사내에게 납치당하게 되고,
정신을 차려보니 낡은 유스호스텔에 구속되어 있었다.
 
그런 그들에게 하루에 한 명씩 최종 용의자를 처형할 테니
다짜고짜 피의자를 찾기 위한 투표를 하라고 하는데...

과연 일행들은 피의자를 찾고 무사히 탈출할 수 있을까?","#미스터리, #스릴러, #범죄, #서바이벌, #음모, #기묘한, #스릴 넘치는",15세이용가
남주의 아빠를 길들여 버렸다,"스푼코믹스,손츄니",로판,139.4만,9.4,전체70,"전체 1,233","태어나자마자 능력을 발현하지 못해 버림받는 악당의 외동딸이 되어버렸다.
설원에 버려진 나를 남주의 아빠가 구해줬다.

악당의 딸이란 걸 들키면 죽임당할 게 뻔했지만
나는 아직 갓난아기, 돌봐줄 사람이 필요했다.

그렇다면야 남주의 아빠라도 꼬시는 수밖에.

“빠빠!”

자! 어서 날 데려다 키워.
귀엽지? 사랑스러워서 견딜 수가 없지?

손가락을 꼬물거렸다.
그의 시선도 손가락을 따라 움직였다.
곧 그의 입에서 감탄이 터져 나왔다.

“귀, 귀여워……!”

그런데 남주 아빠, 무심남 아니었나?

#마왕의 계약자 여주 #마왕의 대적자 남주 #악당의 친딸 여주 #도망 여주 #죽어라 쫓아오는 남주와 남주 아빠","#로맨스판타지, #빙의물, #가족물, #우연한만남, #첫사랑, #다정남, #상처남, #왕족/귀족, #능력남, #능력녀, #외유내강, #다정녀, #상처녀, #소꿉친구, #달달물",전체이용가
도사님께서 하산하셨다,"Yintianxia,JSCR studio",판타지,24.9만,9.8,전체79,전체 162,"천재 도사 서윤은 도시의 미제 사건을 해결하며 살고 있다
어느 날, 한 미제사건을 해결하다가 그가 오래전부터 찾고 있던 배신자의 실마리를 발견하게 되는데....",#대체역사,15세이용가
주말엔 야구할래,라돌,드라마,8.3만,10.0,전체38,전체 283,"사회인 여자야구단에 들어가게 된 웹툰 작가 라돌!

캐치볼도 해본 적 없는데
과연 야구를, 팀 스포츠를 잘할 수 있을까?
의욕은 가득해서 선발도 하고 싶고,
홈런도 때려보고 싶지만 몸이 따라주질 않는데...

팀원들과 전국 대회도 나가고
비 오는 날 비 맞으며 시합도 하고
진정한(?) 사야인이 되어가는 라돌!
근데 왜 할수록 몸 이곳저곳이 아픈 것 같지? 
이게 정상인가요?","#일상물, #스포츠물, #일상, #친구, #가족, #작가, #기타 스포츠, #귀여운",전체이용가
죽이고 싶다,우연히,드라마,2.6만,9.3,전체36,전체 92,"일상 속에서 타인에게 아무렇지 않게 피해를 주는 진상,
뻔뻔한 사람들을 대하면서 참고 넘기는 일이 많다.

이 작품은 그런 불쾌한 사람들을
귀여운 작화와 온갖 방법으로 대가를 치르게 만들면서
독자들로 하여금 대리만족을 느끼게 한다.","#스릴러, #복수",15세이용가
칼의 루(淚),박봉성,액션,13만,10.0,전체80,전체 73,"2010년대의 어느 날, 한, 중, 북한 첩보전쟁에 타임슬립한 조선 호위무사가 뛰어든다! 
북한의 지도자 김정일이 쿠테타 세력의 교묘한 책략에 의해 부하에게 저격당해 사망한다. 한,중,북한 3개국의 정보기관은 이때부터 치열한 첩보 전쟁 모드로 돌입하는데 국정원의 중국담당 에이전트인 진보배는 북한의 쿠테타 세력의 중심인물인 망명한 김대풍 장군을 데리고 연길로 가서 북한의 쿠테타 세력과 연결을 시도하라는 임무를 받게된다. 
그러던 중 중국의 중앙정보국 요원에 쫒기던 보배 일행은 우연히 신원을 알 수 없는 무사의 도움을 받게 되는데 그는 병자호란 시절 청나라에 대항해 싸웠던 호위무사 최 강타. 자신도 모르게 과거에서 현재로 뛰어든 최 강타는 현대에서도 여전히 한국이 중국의 영향력을 벗어나지 못하는 현실을 극복하기 위해 진보배와 함께 칼 한자루 들고 중국 대륙을 종횡무진 누비며 할약한다.",해시태그 없음,15세이용가
제목 없음,작가 없음,장르 없음,조회수 없음,별점 없음,회차수 없음,댓글수 없음,줄거리 없음,해시태그 없음,연령 등급 없음
삐딱한 기억 사전,김팍새,드라마,9.3만,9.7,전체114,전체 249,"""친구가 내 앞에서 자살하려 한다면 어떻게 해야할까?'
지난 날의 우울을 모아 만든 기억 사전.
나, 여기에서, 살아남을 수 있을까?
ㅡ 삶에 이리저리 치이며 무너지지 않게 힘겹게 버티고 있거나, 어쩔 수 없이 무너져버린 나를 보살피고 있는, 혹은 그 누구에게나 공감이 될 수 있는 이야기. 지금 시작합니다.""",해시태그 없음,15세이용가
로맨틱 마블링,한결,로맨스,30.9만,9.9,전체78,전체 474,"나는 어릴 적, 동화 속 주인공이 되고 싶었다.

운명적인 사랑과 평생을 함께하는 것을 꿈꿔왔던 수연은
오랫동안 사귄 남자친구 재준에게 이별을 통보받는다.
그런 수연에게 갑작스레 다가온 이상하고도 특별한 기회, 로맨티코.

'당신만을 위한 왕자님을 빌려 드립니다'

그렇게― 어느 날 갑자기 완벽한 이상형이 
내 일상에 끼어들었다.",해시태그 없음,전체이용가
리커버리 하프,홍성수,드라마,14.4만,9.9,전체56,전체 238,"성하그룹의 여왕 성재림 회장은 
64세로 시한부 선고를 받은 말기 암 환자.
가족들은 그녀에게 경영권을 위한 지분 상속 문제 해결을 재촉한다.

성 회장은 방어책을 만들기 위해 애쓰지만,
죽음을 눈앞에 두고서 모든 게 허무하기만 하다.

어느 날 찾아온 성하제약의 송무한 박사는
최근 여행지에서의 에피소드를 들려주는데,
그건 단순한 여행담이 아니었다.

말기 암 환자의 모든 신체 세포를 
'세포 나이의 절반 지점'으로 회복시키는
기적의 신약, '리커버리 하프’.

신약 개발의 성공과 임상 시험에서 얻은 기적의 결과들이
최초이자 유일한 임상 시험자, 장일준으로 확증된다.
장일준. 그는 신약의 1호 시험체로서
성재림 회장에게 귀한 존재다.

다 채우지 못한 욕망- 어긋난 마음으로 깨어진 관계-
삶의 끝, 허무함에 울던 두 남녀가,
기적의 신약 '리커버리 하프'의 1호, 2호 시험체로서
운명적으로 연결되어 살아가는 이야기.

인생의 절반 지점
그 시절의 나로 돌아온다면
다시 사랑할 수 있을까?","#현대물, #회귀/타임슬립, #사업가, #이야기중심",전체이용가
모든 건 아기님 발 아래,"소피아,만타,신양이",로판,230.2만,9.9,전체85,"전체 2,114","티리엔 왕국의 사랑받던 공주로서, 
왕국의 추앙받는 별이었으나 허무하게 죽임을 당한 나.

그걸로 끝인 줄 알았는데,
…알을 깨고 나왔다?

“부!”
“어머, 세상에, 세상에! 알에서 웬 애가!”

기묘한 옹알이만 할 수 있는 아주 작은 어린아이의 모습으로.

“아우우! 우!”

***

그리고 새로운 가족이 생겼다.

""우리 사랑스러운 막내딸 레티샤. 이 집 남자들을 모두 네가 길들이렴!""
햇살 같은 미소를 지닌 우리 엄마 베스,

""대공 말고, 아버지 말고. 아빠라고 부르거라. 아. 빠.""
무뚝뚝한 척하지만 실은 다정한 카시어스 대공,

“네 남자친구 같은 건 없어, 레티샤. 
알토인지 뭔지는 금방 잊을 거야. 샤샤는 그냥 오빠랑만 친하게 지내. 알았지?”
천 년에 한번 나올까 말까한 제국의 천재라지만, 
내 앞에서는 그저 질투쟁이인 오빠 드미트리에 이어 

“그러니까 못난이는 내 생일선물로 우리 집에 온 거야. 그러니까 내 거라는 소리지.”
못난이라 부르면서도 날 좋아하는 티를 내는 말썽꾸러기 동갑내기 카일러스, 

""눈나! 티샤! 조아! 형아, 시러. 저리가.""
나만 따르는 귀여운 막내 레일리까지.

다들 나를 너무 좋아한다!

“헤헤. 사실 티티 처음 봤을 때부터 좋아써.”
나만 좋다며 따라다니는 친구도 생기고,
그렇게 평화롭게 사는가 싶었는데…

내 전생의 죽음에 비밀이 있었다고? 

""찾았다. 예언의 아이.""

이왕 이렇게 된 거, 모든 걸 다 내 발 아래에 둬야겠다.


#아든가문_삼형제도 #대공부부도 #모두가_레티샤를_좋아해
#육아물 #힐링물 #로맨틱코미디 #삼각관계 #라이벌/앙숙 
#털털녀 #엉뚱녀 #쾌활발랄녀 #나쁜남자 #후회남 #짝사랑남 
#다정남 #직진남 #순진남 #능력남 #첫사랑 #성장물","#로맨스판타지, #타임슬립, #육아물, #먼치킨, #첫사랑, #나쁜남자, #다정남, #직진남, #라이벌/앙숙",전체이용가
우당탕탕따식이,"현용민,국중록,이상신",판타지,10.2만,9.4,전체50,전체 313,"정의를 위해 정의를 버린다?



정의를 위해 이기기 위해서라면 뻔뻔하고 온갖 치사한 수를 다 써도 괜찮다는 '따식이'의 올곧은 신념.

한치 앞을 내다볼 수 없는 그의 머릿속 안 정의를 구현한다!","#성장, #깽판, #망나니, #복수",전체이용가
배달부들,우주,드라마,1.4만,9.9,전체60,전체 4,"차라리 죽었으면 싶던 날이었다. 
시간도 없고, 돈도 없고, 없는 것 투성이인 인생, 아버지는 혁이 어렵게 모은 돈과 함께 사라졌다. 
집안에 남아있던 유일한 단서는 QR코드뿐... 혁은 매일 밤, 사라지기 전 아버지가 함께 있던 여자와 또다른 QR코드를 찾아 헤맨다.",해시태그 없음,15세이용가
죽어야 사는 남자,"유령아이,이정",드라마,107.2만,9.8,전체56,"전체 1,277","열악한 생활과 삭막한 일상으로 삶의 목적을 잃어버린 청년 정우진.
죽음을 결심한 그때, 그 죽음에 이끌린 저승사자가 찾아와
달콤하지만 위험한 계약을 제안한다.

""일주일에 한 번씩, 각기 다른 사인으로 죽을 때마다 1억 원.""
""만약 일주일 안에 죽지 못한다면... 내가 직접 널 죽일 거야.""

살기 위해 죽어야 하는 새로운 일상의 시작이었다.","#스릴러, #판타지물, #초월적존재, #기묘한, #무서운",15세이용가
최종 보스의 애인이라니 오해입니다,"가휘(WHYNOTME),론(WHYNOTME),팀 한소(WHYNOTME),KEN",로판,647.2만,9.8,전체85,"전체 4,015","[게임에 빙의했더니 제가 최종 보스의 애인이라고요?]

게임 캐릭터에 빙의했다.
기왕 빙의한 거, 진엔딩을 보기 위해
주인공에게 온몸을 바쳐 헌신했지만…… 헌신짝처럼 버려졌다.

배신감으로 치를 떠는 내 앞에 나타난 예상치 못한 인물.
바로 이 게임의 최종 보스인 흑기사 마이어 녹스!

“쥰 카렌티아. 내 원정대, 흑기사단에 합류해 주면 좋겠군.”

거절을 거절하는 그의 강요에 반강제적으로 흑기사단에 합류하게 되었다.
그래, 최종 보스가 주인공이 될 수도 있지 않겠어?
겸사겸사 날 버린 주인공에게도 한 방 먹이고.

하지만 일은 생각만큼 순탄하게 흘러가지 않았다.
마이어는 자꾸 과잉보호를 하질 않나…… 게다가 이상한 소문까지!

“저 여자가 그 여자야? 각하께서 간택하셨다는 그 부단장?”
“각하의 애인이라던데…….”

잠깐만요! 최종 보스의 애인이라니, 오해입니다!","#로맨스판타지, #오해물, #착각물, #레이드물, #빙의물, #기사물, #카리스마남, #능력남, #외유내강, #걸크러쉬",전체이용가
제목 없음,작가 없음,장르 없음,조회수 없음,별점 없음,회차수 없음,댓글수 없음,줄거리 없음,해시태그 없음,연령 등급 없음
