Title,Writer,Genre,View Count,Rating,Episode Count,Comment Count,Story,Hashtags,Age Rating
교수님을 빚는 중,서아,로맨스,54.8만,10.0,전체99,전체 620,"“이 분을 제가 가르쳐야 한다구요?”

재능의 벽 앞에 가수의 꿈을 포기한 도경.
보컬 트레이너로 일하는 그녀 앞에 나타난
매력적인 목소리의 수강생.
‘교수님이 여길 왜…?!’

심각한 무대공포증을 앓고 있는 희원은
오로지 도경 만이 자신의 병을 고쳐줄 수 있다고 확신한다.

그리고 도경에게 첫눈에 반한 희원은
교수와 제자 관계로 모든 것이 조심스럽기만 하다.

그러던 중, 갑자기 나타난 도경의 제자.
아이돌 메인 보컬로 되어 돌아온 서호는
오래 짝사랑했던 도경에게 연하의 귀여움으로 직진하는데...

혼자 애만 타는 희원이는 과연 어떤 선택을 하게 될까!?","#현대로맨스, #캠퍼스물, #짝사랑, #다정남, #연하남, #평범녀, #사제지간, #로맨틱코미디",전체이용가
제목 없음,작가 없음,장르 없음,조회수 없음,별점 없음,회차수 없음,댓글수 없음,줄거리 없음,해시태그 없음,연령 등급 없음
미드나잇 블루,보보군,로맨스,38.8만,9.8,전체66,전체 198,"특출난 손재주와 예술적 재능을 가진 오리온!
유복한 환경에서 태어나 성장한 라미르!

미르는 어렸을 때부터 알고 지낸 리온에게 애틋함을 갖지만,
어떤 이유에서인지 리온은 미르의 진심을 거절하기만 한다.

시간이 흘러 성인이 되고, 재회한 두 사람.

연예인이 된 미르는 작가가 된 리온의 호감을 얻기 위해,
친한 동생인 윤다솜을 전령으로 삼아 마음을 전달하지만

의도를 가지고 접근하는 다솜을 냉정하게 밀어내는 리온.
마주치고 부딪칠수록 둘의 관계는 점점 엉켜가는데..

'꿈을 좇는 남자', 오리온과 '쟁취하려는 여자', 라미르.

현실과 이상을 둔 자존심 싸움에서
이들은 각자 어떤 선택을 하게 될 것인가?","#현대로맨스, #오해물, #착각물, #트라우마, #드라마",전체이용가
들쥐,루드비코,드라마,4.7만,9.9,전체95,전체 128,십년 간 집에서만 살던 남자의 십년 만의 외출,"#스릴러, #범죄, #스릴 넘치는",15세이용가
사귄 건 아닌데,민홍,로맨스,92.7만,9.8,전체89,"전체 1,173","스물아홉 살, 서른을 목전에 둔 나이. 
고수아는 그 나이가 괜히 심란하다. 

고향을 떠나 서울에서 일을 하고 있지만,
미래를 생각하면 고민이 많아진다. 
이곳에서의 삶에 대한 확신이 없기에. 

그러던 중 대학 시절에 짝사랑했던 후범과 재회하게 된다.
9년 만의 재회에 다시 살아나는 그때의 감정.
과거에 상처받았던 후범에 대한 마음을 봉합해 나가며 
어린 시절에는 몰랐던 후범에 대해서 알아가게 된다. 

수아에게 다가온 또 다른 남자, 상사 기초롱.
속 깊은 어른의 다정함을 보여주는 그가
당황스러우면서도 마음 한쪽에선 호감이 싹 튼다. 

고민이 깊어진 스물아홉 살 수아가
자신의 마음을 찾아가는 이야기.","#현대로맨스, #재회물, #오피스물, #첫사랑, #순정남, #능력남, #순정녀, #친구>연인, #달달물",15세이용가
미래의 사진,낑깡,로맨스,4만,7.2,전체60,전체 24,"""아무래도 이 카메라, 미래가 찍히는 것 같은데..?!""

사진 찍는 것을 좋아하는 평범한 여고생 한미래는
우연히 버려진 폴라로이드 카메라의 비밀을 알게 된다.

그리고 카메라에 찍힌 충격적인 장면!
바로 미래가 짝사랑하는 반장, 
남주영이 머리를 맞은 채 쓰러져 있는 게 아닌가?

카메라를 이용해 남주영을 구하기로 결심하지만 
일진 황진일과 얽히게 되면서 범인으로 오해를 받지 않나, 
급기야 스토커 취급까지 받게 되는데!

우여곡절 끝에 주영을 구하지만 미래는 뜻밖의 말을 듣는데. 

“미래야, 왜 나를 쫓아다니는거야?”

아직 사건은 끝나지 않았다! 
설렘과 스릴이 공존하는 학원 미스터리 로맨스.",해시태그 없음,전체이용가
거울 죽이기,환상거북,드라마,5.2만,9.9,전체80,전체 289,자신과 똑같은 사람이 눈앞에 나타났다! 또 다른 나와 살아가기 위한 이야기,"#미스터리, #연쇄살인, #초능력, #친구, #사제지간, #기묘한",전체이용가
금빛도깨비 쿠비,김성주,드라마,17.6만,10.0,전체62,전체 277,"사라진 엄마를 찾아 떠난 소녀가 만난 놀라운 세계, 그리고 어디서도 보지 못한 도깨비들의 비밀은?","#판타지물, #성장물, #이종족, #귀여운",전체이용가
MAVE: 또 다른 세계,"팀 엘프(WHYNOTME),스튜디오두근두근,메타버스엔터테인먼트",드라마,103.2만,9.4,전체51,전체 996,"아이돌 데뷔 조<클리어>로 큰 기대를 받던 주인공 '이제나',
같은 소속사의 선배 아이돌 <아로제>의 '주시우' 폭행 사건으로 데뷔가 무산된다.

그렇게 홀로 아이돌 서바이벌 프로그램인 <투비돌>을 준비하던 중,
'주시우'가 ‘이제나’의 반으로 전학을 오는데...

그날 이후 의문의 대상 ‘T’로부터 메신저가 오기 시작하고,
갑자기 눈에 보이기 시작한 퀘스트 창은 모두 ‘주시우’와 팀을 이뤄야 한다고 한다.
도대체 내가 왜 그래야 하는데?!
 
특별한 능력을 가진 소녀들의 아이돌이 되기 위한 성장기!
 
 
그룹 [MAVE:]가 활동하는 또 다른 세계에 여러분을 초대합니다.","#현대물, #초능력, #성장물, #판타지물, #학원물, #이야기중심, #서바이벌, #가수, #고퀄리티, #일상물",전체이용가
내 남편은 내가 정한다,"콩고물,배고픈밤",로판,490.2만,9.9,전체75,"전체 3,456","황제의 명으로 결혼한 2황자의 손에 살해당했다.
다시 돌아온 두 번째 삶에서도
황제가 보낸 암살자의 손에 죽임을 당했다.
믿었던 하녀의 배신으로 맞은 세 번째 죽음.
이제 남은 건 악과 복수심뿐이다.

""한 번, 단 한 번만 더 기회가 주어진다면, 절대 그 기회를 놓치지 않으리라.""

그리고 찾아온 네 번째 삶,
전혀 새로운 선택을 하기로 했다.","#로맨스판타지, #회귀물, #우연한만남, #운명, #트라우마, #연하남, #계략남, #능력녀, #걸크러쉬, #계략녀, #사이다녀, #우월녀, #상처녀, #계약관계, #드라마",전체이용가
멜린의 구세 플랜,"아이나무,인시",로판,314.1만,9.8,전체96,"전체 1,694","소설 <아즐리의 황홀한 불행>에 빙의해버렸다.

비운의 조연으로 빙의한 건 둘째치고, 모두가 죽는 결말이라니.
거기다 남주 A의 첫사랑이면 뭐해, 소설 대로라면 한 달 후 죽은 목숨인걸.

살아남으려면 일단은 소설 전개를 따를 수밖에 없다.
그런데, 왜인지 자꾸만 변수가 생겨나고 이야기 흐름이 뒤틀리기 시작한다.

더 이상 망설일 틈도, 고민할 시간도 남지 않은 그녀는
남주 A와 탈출을 시도하고 원작의 다음 장으로 넘어가는데…

세상을 멸망 시킬 남주 B, 남주 C의 연이은 등장이라니?!","#로맨스판타지, #먼치킨, #성장물, #빙의물, #첫사랑, #운명, #시한부, #역하렘, #상처남, #왕족/귀족, #짝사랑남, #능력녀, #걸크러쉬, #다정녀, #힐링물",전체이용가
공략은 틈새부터,"미나,밥",BL,30.6만,9.9,전체23,전체 407,"학교 선배인 한지윤을 짝사랑 하는 한서.
선배의 옷에서 좋은 향기가 나는 것 같아 무심코 냄새를 맡게 되는데...
그 장면을 하필이면 선배의 룸메, 윤지윤에게 들켜버렸다.
윤지윤은 한서의 비밀을 지켜주는 대가로 살 곳이 필요하다며 동거를 제안한다.

""잘 부탁해, 집주인님♥""",해시태그 없음,15세이용가
제목 없음,작가 없음,장르 없음,조회수 없음,별점 없음,회차수 없음,댓글수 없음,줄거리 없음,해시태그 없음,연령 등급 없음
원님의 마법사,복복,로맨스,24만,9.9,전체40,전체 344,"음사(淫祀)가 금지된 조선시대.
남쪽 섬 판관으로 새로 부임한 ‘서 연’은
고을 사람들이 구렁이를 섬기고
해마다 사람을 제물로 바친다는 말을 듣는다.

이 허무맹랑한 말에 분노한 연은 뱀 굴로 찾아가지만
그곳에 살고 있던 거대한 구렁이에게 공격을 받는다.
그런 그 앞에 구렁이에게 제물로 바쳐졌던 여인이 나타나
요술을 부리며 구렁이를 무찌른다.

투둑, 투둑.

‘……사람인가?’

구렁이의 사체가 떨어지는 동굴 안,
연은 자신을 구해준 여인을 홀린 듯 쳐다본다.
여인의 붉은 머리가 연의 눈에 가득히 들어온다.

아마.... 이때부터였던 것 같다.","#시대/역사로맨스, #차원이동물, #성장물, #운명, #카리스마남, #유혹남, #능력녀, #순정녀, #신분차이, #계약관계, #드라마",전체이용가
벼락 맞을 인간들,곽인근,드라마,18.9만,9.9,전체82,전체 557,"로또 단독 1등으로 270억에 당첨된
주인공의 신상을 유튜버가 털어가버렸다.

많은 사람들이 돈을 위해
주인공을 노리는 와중에 첫사랑이 찾아온다.

당첨 복권을 노리는 무수한 위협 속에서
주인공은 당첨금을 찾기 위한 여정을 떠나는데...","#현대물, #기억상실, #성장물, #친구, #첫사랑, #취업준비생, #회사원, #이야기중심",전체이용가
흑막을 치료하고 도망쳐버렸다,"DNDM,일하나,이이리",로판,427.4만,9.8,전체71,"전체 2,368","좋아하는 소설 속으로 환생한 에블린.
하지만 불행하게도 그녀가 맡은 역할은, 막대한 신력을 지녔지만 이용만 당하다 비참한 죽음을 맞는 엑스트라.

백작가에 입양돼 갖은 학대와 수모를 당하면서도 신력을 쓰지 않고 버텼다. 
모든 건 이 소설의 남자 주인공, 저주받은 흑막 대공에게 납치당하기 위해서. 

""예언을 하나 들었는데, 네가 내 저주를 풀 수 있을 거라더군.""
""네, 다만 조건이 있어요. 이 제국을 떠나서 살 수 있는 돈이 필요해요."" 

살아남기 위해서는 예언 속 여신이자 여자 주인공, 코델리아인 척해야만 한다.
에블린이 원하는 건 로맨스가 아니라 자유뿐.
계약은 순조로웠다. 
……에블린이 여자 주인공이 아니라는 걸 들키기 전까진. 

""감히 날 속인 것도 모자라 도망을 쳐? 그 책임의 무게가 가볍진 않을 거야.""

결국 이대로 죽는 건가 싶어 눈을 질끈 감았는데, 

""나와 혼인하지."" 

응?! 흑막 대공이 어디가 이상하다.



*원작 : 이이리 [웹소설] 흑막을 치료하고 도망쳐버렸다","#로맨스판타지, #빙의물, #운명, #다정남, #순정남, #왕족/귀족, #상처남, #직진남, #능력녀, #자상녀, #순정녀, #다정녀, #계약관계, #달달물",15세이용가
마신이 청혼하는 방법,"코네코네코,하점상점,알넘사,ab studio",로판,102.2만,9.4,전체60,전체 947,"“후회 없는 삶이었나?”

마신이 물었다.
약혼자를 동생에게 빼앗긴 것으로 모자라 그들에게 죽임까지 당한 내게.

“율리아나 녹스 펜 일렌도르프, 그대는 잘못한 게 아무것도 없어.
내 그대에게 특권을 주도록 하지.”

과연, 그녀는 마신과 함께 복수를 할 수 있을 것인가.

그런데… 그의 도움으로 복수를 꿈꾸면서도 자꾸 이상한 기분이 든다.
대체 마신이란 존재가 왜 자신을 돕는 것이며, 난생처음 느껴 보는 사랑을 자꾸 퍼부어 주는 걸까?
머리는 수상하다고 외치지만 가슴은 거부할 수가 없다.

저기요, 마신이 이렇게 달콤해도 되나요……?","#로맨스판타지, #복수물, #신화물, #운명, #초월적존재, #능글남, #소유욕/독점욕, #능력남, #사이다남, #절륜남, #상처녀, #계약관계",전체이용가
도망쳤더니 결혼을 하게 됐습니다,"스튜디오 늘봄,토란,은솔림",로판,313.7만,9.9,전체71,"전체 2,368","""더는 지옥에서 살고 싶지 않아.”
바꿀 거야 내 인생을, 내가 있어야 할 자리를! 

후원자 ‘유리’에게 자신의 특별한 능력 ‘언령술’을 착취당하고 이용만 당하다 죽은 ‘라피아'.
고통스러운 삶에서 해방되어 그토록 원하던 안식을 얻었다고 생각 한 순간, 눈을 떠보니 유리를 처음 만난 9년 전으로 돌아왔다.
지옥 같은 삶을 되풀이 하고 싶지 않은 라피아는 전생에서 유리와 대적하던  ‘카세인’의 가문 솔레이아 공작가로 도망쳐 새로운 후원 계약을 한다. 그런데 놀랍게도 후원 계약의 내용이 카세인과의 결혼…??


 ‘도망쳤더니 결혼을 하게 됐습니다??!’","#로맨스판타지, #환생물, #소유욕/독점욕, #츤데레남, #달달물, #회귀물, #운명, #첫사랑, #짝사랑, #다정남, #순정남, #카리스마남, #짝사랑남, #외유내강, #짝사랑녀",전체이용가
수호룡과 거짓의 황녀,"금광,Havoc",로판,67.7만,9.9,전체49,"전체 1,000","천한 농노 신분의 세리아.
그녀는 금발과 청안의 아름다운 외모로 인해 
일찍이 영주의 첩이 될 운명에 처한다.

""끼이-""

어느 날 세리아는 숲에서 그녀와 똑같은 
푸른색의 눈을 가진 새끼 용과 만나게 된다.

""네 이름은 시즈렐리아야.""

평생에 한 번 있을까 싶은 운명같은 짧은 만남과 예정된 이별….
이후 그녀는 거친 운명의 소용돌이에 휘말려 목숨을 잃을 뻔한다.
죽음을 각오한 세리아의 시야에 어딘지 익숙한 푸른 눈이 가득 찬다.

-세리아.

""시즈?""
-정말 만나고 싶었어. 세리아.
""나도. 내 유일한 친구.""

시즈와 다시 만나게 된 세리아.
제국의 수호룡 '안트 세스테리아' 의 주인이 되어 
엘리안 제국의 거짓된 황녀 '엘페리아'로 거듭난다!","#로맨스판타지, #성장물, #재회물, #여주판타지, #능력녀, #걸크러쉬",전체이용가
악역이지만 즐겁습니다,"Tianmingfanpai/faloo,HuiShu animation",무협,55.5만,9.6,전체90,전체 556,"주인공 구도환은 판타지 세계로 타임슬립하였다. 타임슬립을 하자마자 바로 그 세계 주인공의 질투와 시기를 받게 되는데... 여주가 먼저 대쉬하지 않나, 남들 질투를 받기에는 충분한 vvvip대우까지 있네? 다행히도 신분도 실력도 금수저나 운만 따라주는 원래 남주를 이기기엔 식은 죽 먹기였다. 근데 잠깐, 여기 왜 또 주인공만 수집하는 시스템이 있지? 이거 참, 악역의 길에서 벗어날 수가 없게 됐네.",#회귀,15세이용가
제목 없음,작가 없음,장르 없음,조회수 없음,별점 없음,회차수 없음,댓글수 없음,줄거리 없음,해시태그 없음,연령 등급 없음
너와 나의 눈높이 [숏애니],인미,로맨스,2.5만,10.0,전체48,전체 151,"웹툰, 애니메이션이 되다! 
눈과 귀가 즐거운 웹툰을 즐기는 또 하나의 방법! 
시간순삭!!!! 애니메이션!!!!

너와 나의 눈높이

***

""거기서!! 내가 널 얼마나 보고 싶어했는데!!!
왜 자꾸 날 피하는 거야?!!!!
난 널 이렇게 놓칠 수 없어!!!!""

...
180cm 여대생 한미남
160cm 남대생 반민호
서로 다른 눈높이를 가진 두 사람의 대환장케미폭발 캠퍼스 로맨스

***

제작 : Toonimotion (투니모션)
감독 : 여성재
프로듀서 : 조규석
성우 : 석승훈, 이자영, 박하진, 박주광, 백승철, 이명호, 최결, 김성화","#현대로맨스, #캠퍼스물, #착각물, #남장여자물, #짝사랑, #첫사랑, #까칠남, #츤데레남, #능력녀, #엉뚱발랄녀, #걸크러쉬, #소꿉친구, #쌍방삽질, #달달물, #로맨틱코미디",15세이용가
달달한 그녀 [숏애니],"S,날치",로맨스,5만,9.8,전체50,전체 90,"웹툰, 애니메이션이 되다! 
눈과 귀가 즐거운 웹툰을 즐기는 또 하나의 방법! 
시간순삭!!!! 애니메이션!!!!

달달한 그녀

***

인류가 급증하자 피가 풍족해진 뱀파이어들은 맛을 따지기 시작했고, 그 결과 인간의 피를 와인처럼 숙성 시켜 마시는 시대를 열었다.

그 중 최고의 회사인 '킹스턴 와이너리'의 대표였던 '해리'는 친형 '맥스'에게 와인회사를 빼앗기게 되고,회사에서 쫓겨난 해리는 한국에서 작은 와인바를 운영하며 불법 혈액 브로커로 살아간다.

그러던 어느 날, 와인바를 찾아온 '연서'에게서 아직은 미숙하지만 잘만 키우면 천문학적인 가치를 가지게 될 피를 발견한다. 급하게 돈이 필요했던 '연서'는 자신의 가치도 모른 채 피 한 팩당 단돈 30만원에 독점 계약을 하고, 해리는 아직 덜 익은 연서를 잘 익혀 최고의 와인을 만들어 제기하려 한다.

그리고 종을 초월한 로맨스가 싹터 가는데...

***

제작 : Toonimotion (투니모션)
감독 : 여성재
프로듀서 : 조규석
성우 : 황창영, 유승희, 이연준, 김성은, 최수현, 손정아, 김동현","#현대로맨스, #우연한만남, #까칠남, #왕족/귀족, #츤데레남, #능력남, #순진녀, #삼각관계, #갑을관계, #금단의관계, #달달물, #운명, #조직/암흑가, #계약관계, #드라마",15세이용가
벼락승진,이모세,드라마,13만,9.9,전체57,전체 380,"야근과 주말 출근이 일상인 광고대행사 [페퍼기획]

두 달간 하루도 쉬지 못한 제작 3팀은
오늘도 고군분투 중이다.

워라밸이 최우선인 MZ세대 박대희 사원
회사와 일이 최우선인 기성세대 전규영 팀장

서로가 너무 달라 서로를 이해할 수 없었던 두 사람이
서로의 몸이 바뀌게 되면서 서로를 연기하기 시작한다.","#현대물, #영혼체인지/빙의, #성장물, #신분차이, #라이벌, #회사원, #이야기중심",전체이용가
죽어도 숨은 쉰다,이준표,드라마,4.5만,9.9,전체49,전체 120,"사망한 자들이 생전의 시간으로 잠시 돌아갈 수 있는 기적을 부여 받는 ‘시판’! 
이 운명의 시간을 관장하는 세 명의 재판관이 시판으로 허락한 ‘생전으로의 아름다운 여행’. 
네이버 베스트 도전 연재만으로 큰 화제를 모았던 신인 이준표 작가의 감동 대작!",해시태그 없음,15세이용가
