Title,Writer,Genre,View Count,Rating,Episode Count,Comment Count,Story,Hashtags,Age Rating
주인님이라 부르지 마!,고등어자반,로판,617.2만,9.9,전체96,"전체 7,754","집안의 가업인 향(香)방을 잇기 위해 후계자 공부 중인 이유리.

왕자병인 동급생의 고백을 거절했다가
졸지에 학교에서 그놈 패거리에게 괴롭힘을 당하게 된다.



썩은 김치를 사물함에 넣어놓는 것 정도야 유치해서 넘어간다 치지만 역시 피곤하긴 하다.

어느 날, 자신을 괴롭히는 동급생에게 한 방 날리고 도망쳐 온 산속.

하지만 갑자기 하늘에서 떨어진 깡통에 머리를 맞고 유리는 죽게 된...다!?



그대로 죽은 줄만 알았는데 눈 떠보니 잘생긴 남자의 무릎 위!

그리고 다짜고짜 유리를 주인님이라고 부르는 남자, 소우.

대체 왜 나를 주인님이라고 부르는 거야?


난 네 주인님이 아니라고오!!!",해시태그 없음,전체이용가
용의주도 황비,"자주,산맡",로판,726.8만,9.8,전체50,전체 1.2만,"최후의 용이었던 ""백룡""은 ""전사""의 손에 죽음을 맞이한다.
백룡은 자신을 죽인 ""전사""의 딸, ""미르""로 빙의하게 되는데…

엎친데 덮친 격으로, 저주를 풀기 위해 ""미르""를 황비로 맞이하려는
폭군 ""아자르""에게 잡혀가게된다?!","#로맨스판타지, #빙의물",전체이용가
"저기요, 황태자님!",이초,BL,354.7만,9.9,전체50,"전체 3,576","저기요, 황태자님!
저한테 왜 이러시는 거예요?!

예쁜 얼굴에 그렇지 못한 태도로 하루도 바람 잘 날이 없는 미소년 레이. 불같은 성격 탓에 매번 일터에서 잘리는 레이를 본 에드워드는 제법 큰돈을 만질 수 있다며 귀족 부인들의 잇템(!)을 소개해준다. 잇템의 재료를 찾아 숲속을 헤매는 레이를 향해 화살이 날아오고, 레이는 치료를 받지 않고 도망친다. 화살을 쏜 범인은 루베시아 제국의 황태자인 루카스! 여러 번의 위기에서 레이를 구해준 루카스는 자신의 청을 들어주면 목숨만은 살려주겠다며 레이에게 거절하지 못할 제안을 하는데?!","#가상시대물, #판타지물, #서양풍, #신분차이, #이야기중심",15세이용가
씨방것들,오청,드라마,694.2만,9.9,전체87,"전체 6,481","대한민국 최고의 관종 가족을 하나 뽑자면 바로 청담동 방씨 일가일 것이다.
돈 많고 잘났지만 천박한 이 가족은 관심 받기 위해서라면 어떤 막장 행동도 서슴지 않는다.
오죽하면 방씨를 거꾸로 한 ‘씨방것들’이라는 조롱조의 멸칭으로 불리울 정도이다.
불행하게도 그 안에서 막내딸 방은해는 홀로 내성적으로 태어나버렸다.
게다가 워낙 막장인 가정환경에 시달린 탓에 병적일 정도로 평범함을 추구한다.
인생의 목표는 ‘공기처럼 살기’. 
그러나 도움이 안되는 가족들은 SNS로도 모자라 그들의 일상을 다룬 ‘TV리얼리티 프로그램’을 론칭하여 방송 진출을 꾀한다.
거부하지만 결국 촬영에 강제 참여하게 된 은해.
화가 난 은해가 리얼리티를 망치려고 하는 행동들이 의도치 않게 대중의 관심의 도마에 올라 버린다.
설상가상으로 게스트로 출연하는 핫한 배우 장휘민에게 첫사랑에 빠져 버리기까지…! 
점점 더 평범한 일상은 멀어져 가고… 그 와중에 은해의 소꿉친구이자 소중한 멘토 남영원이 오랜 기간 자신을 짝사랑했다는 걸 알게 되어 그야말로 혼란의 연속이다.
목표하는 공기같은 삶과 처음 느껴보는 설렘, 그리고 자신을 이해해주는 유일한 존재. 어느 것을 지키고 어느 것을 포기해야 할까?","#현대물, #성장물, #가족, #이야기중심",전체이용가
여자친구 : 드라마 <남자친구> 스핀오프,"들깨,PAMBA",로맨스,549만,9.9,전체50,"전체 3,142","사랑에 서툴렀던 탓에
첫 번째 사랑을 떠나보내야만 했던 남자, 정우석.

휴가차 떠난 스페인에서 생기 넘치는 오렌지 같은 여자, 한유진을 만난다.

잠깐 스치는 인연인 줄 알았는데
한국에서 다시 공모전 주최자와 당선자로 만난 두 사람.
세간의 오해를 사기 쉬운 상황임을 알면서도
서로에게 점차 끌리게 되는데…!

드라마 <남자친구> 스핀오프.
우석의 마지막 사랑 이야기 <여자친구>",해시태그 없음,전체이용가
묵검향 자객출두 컬렉션,묵검향,무협,113.9만,9.7,전체296,전체 357,"묵검향 4월 신작UP
지금부터 무림의 정의는 혈월이 바로잡는다!
(본 작품은 15세로 개정된 개정판으로, 검수라인에 따라 수정과 편집된 부분이 존재합니다)


※수록작품
1. 혈월객(4월신작)
2. 천검용혈풍
3. 천룡대제
4. 자객제일문",해시태그 없음,15세이용가
대치동 일타강사,"JP YOU,송예슬",드라마,60.3만,9.8,전체191,"전체 1,140","스승으로 모시기에 좀 애매한 그들, 강남 학원가를 주름잡는 일타강사에 도전하다","#현대물, #입시, #사제지간, #망나니, #이야기중심",전체이용가
작약만가 : 불환곡,인토르노,로맨스,278.1만,9.9,전체102,"전체 3,255","선택받은 신분들만이 살아갈 수 있는 황궁 속에
우리는 도망치지 못한 채 영원히 갇혀버렸다.

인의란 무엇이고
선함이란 무엇인가.
죄업이란 무엇이고
짐승이란 누구인가.

황궁이라는 미명 하에 칼을 두른 자들, 
탐욕과 공포 아래 나는 이 황궁에서 살아남을 수 있을까?


황족의 정치를 바탕으로 피어나는 황궁 생존 군상극.","#퓨전사극, #암투물, #왕족/귀족, #순진녀, #악녀, #갑을관계, #드라마",전체이용가
어린(물고기 비늘),윤태호,드라마,331.3만,9.9,전체102,전체 3.2만,"삶이 힘들거나 곤란에 처하게 되면 우리는 어디로든 떠나고 싶어한다.
떠나면 잊을수있을거라 생각하지만 상념은 뒷덜미를 붙잡고 떠나지 않는다.
고민에 정면으로 맞서지 않으면 고민은 우리를 잡아먹을 것이다.
고뇌를 회피하다 맞서게 되는 인물의 이야기.","#현대물, #성장물, #작가, #이야기중심",전체이용가
프렌시아의 꽃,"성은태,김룸,김레인",로판,582.4만,9.8,전체91,"전체 5,068",마계 프렌시아의 순수 혈통 마녀로 되살아난 사빈. 그런데 얼굴도 이름도 모르는 마왕의 반려자가 되기 위한 시험을 치러야 한다고? 목표는 '안전 귀가'였지만 마음처럼 풀리지 않는 과정들. 세상에서 버림 받은 꽃 사빈은 마녀 레아 블레샤로서 프렌시아에서 새로운 삶을 꽃피워 나간다.,해시태그 없음,전체이용가
다정하게 쓰담쓰담,켐제,BL,108만,9.8,전체40,"전체 1,635","첫눈에 반했지만 다가갈 수 없어!

인간 캣닢이라고 불려도 좋을 만큼 동물들에게 인기 만점인 우진은 어둡고 음침한 외모와 소심한 성격 때문에 사람들과는 친해지지 못한다.
반면 그런 그의 눈에 운명처럼 나타난 애견 카페 사장, 상윤은 너무 잘생겼고! 너무 밝고! 너무 친절하다. 
첫눈에 반해 매일같이 애견 카페에 출근도장을 찍어보지만, 도저히 말 한마디 건넬 용기가 나질 않는 우진.
'사장님과 가까워지고 싶어. 친해지고 싶어. 그런데 나 같은 게 그래도 될까…'
소심한 우진은 과연 눈부신 상윤과 연결될 수 있을까?!","#판타지물, #현대물",15세이용가
어른나라의 앨리스,고래별,BL,231.9만,10.0,전체42,"전체 2,558","연애 따위 하지 않았던 모태솔로 공대생 건우!
그에게 따뜻한 바람이 불게 되었다?

반해 버린 상대는 잘생긴 형!
특별하지만 무언가 무서운(?) 생각을 가진 것 같은 형!
건우의 사랑은 이대로 괜찮은것인가..!?",해시태그 없음,15세이용가
꿈 같은 거짓말,"중년바나나,탄콩",BL,223만,9.9,전체66,"전체 1,414","사람의 마음을 조종하고, 가까운 미래를 볼 수 있는 초능력자 우해서는 자신의 장점을 살려 스피치 학원 강사로 일하던 중, 일면식도 없는 남자와 관계를 갖는 꿈을 꾸기 시작한다. TJ그룹 본사에서 리더십 교육 강연을 제안받은 해서는 예지몽을 통해 TJ그룹 로비에서 대형 참사가 일어난다는 사실을 알고 능력을 사용해 사고를 막는다. 그러나 과한 능력 사용의 부작용으로 인해 화장실을 찾았던 해서는 TJ그룹의 막내아들 차도혁에게 민망한 장면을 들키고 마는데…

#현대판타지 #리맨물 #이능력물 #재벌공 #능력공 #능글공 #후회공 #미인수 #다정수",해시태그 없음,15세이용가
아쿠아맨,맥퀸스튜디오,로맨스,189.9만,10.0,전체127,"전체 2,955","뭐든지 평범한 것만 같은 복학생 나루는 꽤 특이한 이력이 있다. 한 번도 연애를 해보지 못했다는 것!
복학을 계기로 그는 화려한 연애, 모태솔로 탈출을 꿈꾸며
본인과 같은 처지인 친구 소라와 소개팅에 나가보기도 하지만 번번히 실패.

나루와 24시간 붙어 지내는 동갑내기 친구이자
대학 내 유명한 킹카인 성준은 나루와 소라에게 매번 이러저러한 조언을 해주지만
킹카의 조언은 그들에게 도움이 되지 않는다.

반복되는 연애실패에 낙담하는 나루를 보며 성준은 항상 즐거워한다.
그런데 성준은 정말 나루를 도와주고 있는 걸까?
성준은 본격적 연애사업에 뛰어든 나루를 사사건건 방해한다.
이러한 일이 벌어지는지 꿈에도 모르는 나루는 성준의 말을 곧이곧대로 믿기 시작하는데...!","#현대로맨스, #캠퍼스물, #첫사랑, #상처남, #나쁜남자, #뇌섹녀, #평범녀, #삼각관계, #소꿉친구, #드라마",전체이용가
리벤지 웨딩,"사룡,별사탕양",로판,"1,244.9만",9.9,전체84,전체 1.2만,"외모, 돈, 신분까지 완벽한 여자 메르케디아 사샤.
기절했다가 정신을 차리고 보니 위치는 바다 한가운데 커다란 배 위, 입은 옷은 웨딩드레스.
내가 결혼을 한다고?

'감히 메르케디아 사샤를 건드려? 결혼 생각이 쏙 들어가게 해 주지!'

그런데 보자마자 칼부터 들이대는 예비 남편, 제국 최고의 전쟁 영웅 데메트리우 키프로사.
이게 어딜 봐서 결혼하러 온 남자 모습이야?

""누가 나를 이딴 식으로 초대하나 했는데…… 너를 베면 돌아갈 수 있나?""
""치워. 안타깝지만 나도 갑자기 끌려온 몸이거든?""

전대미문의 납치 결혼을 당하게 된 두 사람.
설상가상으로 무인도에서 단둘이 살게 생겼는데….

1차 목표는 무인도 탈출!
최종 목표는 복수와 이혼!",해시태그 없음,전체이용가
황후 위목화,"영문약,오유선",로판,"1,056.2만",9.9,전체202,"전체 7,249","위목화는 두 번의 삶을 허락받았다.
첫 생이 지옥보다 더 잔혹했기에 죽음 뒤에 생은 그녀에게 역류했다.

열다섯은 사랑에 빠지기 쉬운 나이였다.
이가준은 그녀에게 있어 영원보다 완벽한 운명이었다.
죽음을 맞이한 순간, 위목화는 인정할 수밖에 없었다.
그녀의 열다섯은 필연이 아니라 절망의 시작점이었다.

마침내 후회한 순간, 두 번째 열다섯이 그녀를 찾아왔다.
이번엔 이제준의 청량한 연정이 그녀의 곁을 지켰다. 
칠흑 같은 어둠 속에서도 그는 기꺼이 그녀의 빛이 되기를 희망했다.
실패할 리 없는 삶이었다. 

복수, 구원, 기적. 
어떤 말이 어울린다고 해도 좋았다.
다시 시작된 이 삶이야말로 그녀의 진짜 생이었다.",해시태그 없음,전체이용가
코네티컷 영기,신유길,드라마,13.6만,9.8,전체48,전체 529,"올림픽 사격 금메달리스트. 거기 더해 독립운동영웅 ‘김영조’의 직계후손으로 유명세를 치르던 ‘김영기’. 사이코패스임이 밝혀진 이후 그의 일상은 급변, 사회로부터 배척받은 지금은 미국 코네티컷 주에서 사냥일을 하며 살고 있다.
 어느날, 늑대떼의 습격을 받아 혼수상태에 빠진 김영기. 그는 놀랍게도 1937년의 일본, 거기 더해 일본 육군성 후원가의 외아들인 ‘와니야 나츠키’의 몸을 빌려 깨어난다. 성대한 회복연이 벌어지던 밤, 나츠키(영기)는 연회장에서 뜻밖의 인물과 마주치고, 때마침 터진 폭탄에 의한 아수라장 속에서 실수로 독립군을 사살하고 만다. 이날 영기가 쏜 한발의 탄환은, 세계의 미래를 송두리째 바꿔놓고 마는데…?!",해시태그 없음,15세이용가
레디메이드퀸,"KONN,VEX,KUB,109,어도담",로판,"1,273.7만",9.9,전체101,"전체 8,673","한밤중에 들이닥친 괴한들로 
백치로 유폐되어 있던 황녀 비올레타는 살해당한다.

황녀의 종신직 시녀 에비가일.
제게도 죽음이 닥쳐올 것을 예감했을 때.

""에비가일 딜로아는 죽었다. 너는 황녀로 다시 태어나는 거야.""

에델가르드 공작인 라키엘이
그녀를 황제로 만들겠다며 나타난다.

""할 수 없어요. 제발. 나 당신까지 망칠 수도 있어요.""

하루아침에 뒤바뀐 운명.
황궁 최대의 사기극이 시작된다.","#로맨스판타지, #복수물, #까칠남, #냉정남, #외유내강, #털털녀, #드라마, #계약관계, #중세물, #암투물",전체이용가
쇼윈도 커플,이네,로맨스,"1,596.8만",9.9,전체89,전체 1.3만,"우연히 교내 최고 인싸 인사훈의
(거침없이 차이는) 이별장면을 목격하게 된 임다연.

쪽팔림도 잠시,
사훈은 구여친 수지의 질투심을 유발하기위해
다연에게 계약연애를 제안 하지만,
이 마저도 거절 당하고 만다.
 
그러던 중 갑작스런 오빠의 사고로 다연은
어쩔 수 없이 사훈의 계·약·연·애 제안을 받아 들이게 된다.
 
모두의 인싸인 사훈, 생계형 아싸인 다연

끝과 끝인 두 사람의 계약연애 <쇼윈도 커플>","#학원물, #첫사랑, #순정남, #평범녀, #계약관계, #친구>연인, #로맨틱코미디",전체이용가
악역이 베푸는 미덕,"쿠낙,쥐똥새똥",로판,"3,097.6만",10.0,전체83,전체 2.5만,"열심히 살았을 뿐인데 라이벌에게 약혼자를 빼앗기고,
첫눈에 반한 남자마저 라이벌과 사랑에 빠지고….
나보다 쟤가 나은 게 대체 뭐야?

괴로워하던 ‘진저 토르테’의 손에 들어온 소설책 한 권.
라이벌 ‘레라지에’와 진저의 이야기가 그대로 쓰여 있는 수상한 소설책에서,
레라지에가 주인공이고 진저 토르테가 악녀…?
열심히 살았을 뿐인데 악녀라니… 악녀라니!!!
게다가 라이벌이 잘나간 건 모두 주인공 버프 덕분이었다고?

“레라지에, 네가 주인공이라고?
좋아, 그렇다면 네게 악역이 베푸는 미덕을 보여 주지.
남자 주인공은 내가 손에 넣어 주겠어!”

소설책을 통해 남자 주인공 ‘이자나’ 왕자의 비밀을 손에 넣은 진저는
레라지에에게서 남자 주인공을 빼앗으려 하는데…!

치밀함과 똑부러짐에 있어서는 2퍼센트 모자라지만
귀여움은 200퍼센트인 진저 토르테의 남자 주인공 이자나 강탈(?)기!

========================================

웹툰 <악역이 베푸는 미덕>은
매주 토요일 연재됩니다.

=========================================

[타이틀 디자인] 송가희",#로맨스판타지,전체이용가
거부할 수 없는 운명,"이종은,KOOdO,이미은",로맨스,"1,155.5만",9.9,전체110,"전체 6,827","쌍생아로 태어나 병약한 오라비를 위해
자신을 감추고 살아온 자하국의 공주, 자설란.
아버지인 왕 혜조의 일방적인 부마 간택이 달갑지 않으면서도, 
이를 자신의 거짓된 삶으로부터 벗어날 기회로 삼는다. 

그런데 순탄할 것만 같았던 혼인은 
유일한 부마 후보 최지환의 거부로 난관에 부딪치고,
급기야 최지환은 자신의 비밀을 드러내고 만다.

“저는 저주받은 괴물입니다.
부디 이 혼사를 물러주십시오.”

자설란은 어차피 자신들에게 다른 선택지는 없다며 
도리어 최지환에게 서둘러 혼사를 진행하리라 단언한다.
하지만, 그들에겐 저주보다 더 참혹한 진실이 기다리고 있었는데…

저주에 사로잡힌 불우한 영혼 최지환, 
저주보다 더한 족쇄에서 살아남은 꽃 자설란.

기적이라는 이름의 거부할 수 없는 
그들의 운명은 어디로 향할 것인가?

제작 메이드 인 코리아",해시태그 없음,15세이용가
끝에서부터 한걸음,표류,BL,330.4만,9.8,전체75,"전체 2,354","오랜 친구인 김상진을 짝사랑하는 배송우.
마음을 꼭꼭 숨기고 살던 어느날,
배송우는 김상진의 집에서
수상한 책 한 권을 발견한다.
김상진의 인생이 적혀있는 수상한 책 속
배송우는 지나가는 엑스트라 1일 뿐..?!
애써 무시하던 배송우는 모든 일이
책에 적힌대로 흘러간다는 것을 깨닫는데…",해시태그 없음,15세이용가
그 오빠들을 조심해!,"민이영,플루토스",로판,"3,557.9만",9.9,전체105,전체 3.2만,"7살에 어머니를 여의고 에른스트 공작가에 입양된 하리.
에른스트의 삼 형제에게 갖은 핍박을 받아왔지만
 시집을 가게 되면서 드디어 피눈물 나던 생활을 끝내게 되었다.

그런데 웬걸?
자다 일어났더니 지옥 같던 어린 시절로 돌아온 게 아닌가! 꿈인가?!

흥, 당장 깰 꿈이 아니라면
이제는 나도 눈치 안보고 맘대로 살거야!

하리는 그렇게 삐뚤어지기로 결심했다.","#로맨스판타지, #육아물, #회귀물, #운명, #왕족/귀족, #능력남, #오빠, #자상녀, #외유내강, #다정녀, #드라마, #힐링물, #가족물",전체이용가
살아말아,고은,로맨스,595.5만,9.9,전체100,"전체 5,391","사이가 안 좋은 70대 노부부 '한청순' 할머니와 '송육갑' 할아버지.
두 사람의 사이를 회복시키려던 아들 부부는 자식들을 앞세워 다 같이 워터파크 온천에 놀러 가게 되고
노부부는 그곳에서 없어진 손자를 찾다가 우물에 빠지게 된다.

우물 안에서 영문 모를 힘에 의해 17살로 되돌아가게 되는 두 사람.
몸은 17살이 되었지만, 여전히 70대 할아버지 할머니 행동을 하는 덕에
주변 사람들 당혹해하고 이상한 시선을 보낸다.

17살이 된 청순이는 가족을 위해 희생했던 과거를 청산하고 자신만을 위해서 새로운 삶을 살려고 하고
암 선고를 받은 육갑이는 과거로부터 잘못을 되돌려 둘의 관계를 회복하고 싶어 한다.
17살의 삶을 누리려던 그 순간 다시 노인으로 변하는 두 사람.
그 후, 시시각각 노인과 17살 모습으로 번갈아 변하면서 그들 관계도 새로운 국면을 맞게 된다.

만약 인생을 다시 살 수 있다면 과거의 실수를 반복하지 않고
정말로 자신이 원하는 삶과 사랑을 가질 수 있을까?","#현대로맨스, #가족후회물, #운명, #후회남, #상처녀, #오래된연인, #드라마",전체이용가
공작님을 거절합니다 [완결],"희야,이채영",로판,720만,9.6,전체141,"전체 5,750","""그쪽이 한 제안을 받아들이도록 하지.”


자신이 여자라는 것을 숨긴 채 펠릭스 버클리 공작을 수행하던 에단 달튼.
하지만 에단은 불의의 사고를 당하고,
정신을 차려보니 거울 안 저 얼굴은  아름다운 귀족영애 글로리아의 것이었다!

세상에나! 글로리아는 펠릭스 공작의 약혼녀 후보잖아! 
그런데 공작님께 뭘 제안했다고? 이 몸이?","#궁정로맨스, #로맨스판타지, #영혼체인지, #환생물, #빙의물, #남장여자, #짝사랑, #까칠남, #왕족/귀족, #능력녀, #로맨틱코미디, #정략결혼, #엉뚱발랄녀, #무심남, #다정남",전체이용가
"꽃을 주면, 나를 줄게","호밀,조유진",로맨스,"1,173만",9.9,전체67,전체 1만,"몽골 울란바토르 자연사 박물관에서 일하고 있는 해원. 갑작스러운 시한부 뇌종양 판정을 받은 해원은, 죽기 전에 자신의 마지막 꿈인 ‘세상에 아직 발견되지 않은 꽃을 찾아내겠다는 원대한 꿈’을 이루겠다고 결심하고 구르반사이한으로 떠난다. 그러나 뇌종양 판정은 오진이었고, 해원을 이를 모른 채 여행을 계속하다 심한 감기 몸살에 걸려 쓰러진다. 낯선 게르에서 그녀를 깨운 것은 엄청난 미남!! 그는 아버지 회사를 두고 벌어지는 후계자 싸움에 지쳐 개 한 마리와 함께 몽골 초원으로 떠나온 은성이었다.

“꽃을 찾으면, 그 꽃 이름을 당신이 지을 수 있게 해드릴게요. 이건 돈 주고도 할 수 없는 엄청난 일이라고요.”

“한 달은 너무 깁니다. 일주일 안에 찾고 최대한 빨리 떠나요.”

드넓은 초원 위에서 운명처럼 마주친 두 사람. 그들은 외롭고 낯선 이국의 땅에서 각자의 꿈을 이룰 수 있을까?

  
마지막 불꽃을 태우기 위해 온 여자, 삶에 지쳐 아무렇게나 살기 위해 떠난 남자.
두 사람의 운명 같은 사랑.

인생 끝자락에 선 청춘 남녀가 세상 끝에서 시작한 파란만장 로맨스!",해시태그 없음,전체이용가
짝사랑 동아리,서글,드라마,42.7만,9.5,전체91,전체 871,"[너, 짝사랑 어디까지 해봤니? 우리한테 말해줘]

""여름이는 한번도 내 걱정 해본 적 없고
앞으로도 그럴 일 없겠지.

하지만 아무리 여름이를 무시하려 다짐해도
그럴 수 없어

혹시 알아?

이런 식으로 얼굴 보다보면 다시 예전으로
돌아갈 수 있을지도 모르잖아?""

처음에는 이런…

이상하고 쪽팔리는 짝사랑을 하는 
사람은 나 혼자인 줄 알았다.

하지만 불행하게도 나같은 사람들은 더 있었고

더 불행하게도 우린 친구가 되었다.

심지어…
이 불행한 자들은 
정기적으로 모이는 
동아리도 만들었다.","#학원물, #성장물, #짝사랑, #친구, #학생, #남주중심, #여주중심, #이야기중심",15세이용가
입덕학개론,남은경,BL,142.6만,9.8,전체78,"전체 1,371","[입덕은 빠를수록 좋다. 그래서 과거로 간다!]

인기 그룹 'UNLOCK'의 늦덕 박지율의 한 가지 소망.
과거로 돌아가 초창기부터 UNLOCK 의 팬이 되는 것!

그러던 어느 날, 정말 과거로 돌아가게 된 지율.
하지만 엉뚱하게도 UNLOCK이 아닌 
초 절정 인기 가수 단한별과 엮이고 되고

급기야 단한별의 매니저까지 되어 버리는데!","#현대물, #타임슬립, #운명, #다정공, #미인공, #평범수, #아방수, #삼각관계, #갑을관계, #이야기중심, #사랑스러운, #두근거리는",15세이용가
해치지않아,Hun,드라마,393만,9.7,전체51,"전체 5,738","경영난에 폐장하는 동물원을 포기 할 수 없는 주인공 철수는
동물원을 살리기 위해 동물 탈을 만들어 쓰고 동물로 위장해
운영하려는 미친 계획을 세운다.
그에 필요한 각 분야의 전문가와, 적합한 직원들을 고용했지만
다들 어딘가 한군데쯤 문제있는 사람들이었다.
동물이 되어 동물원 살리기! 이 미친 프로젝트의 동참한 이들에게 일어나는
해프닝들은 때론 황당하게 때론 인간적인 사건 사고들로 가득하다.","#힐링물, #경영, #사랑스러운",전체이용가
어렴풋이,휘를,판타지,129.8만,10.0,전체236,"전체 3,605","[가로실은 기억, 세로실은 시간.]

	
귀신을 보는 인간들의 학교, ‘우화원’에 귀신이 입학한다. 완벽하게 인간흉내를 내며 들어온 그는 찾고 있는 것이 있다.","#미스테리, #이종족, #성장, #학원",15세이용가
너와 사는 오늘,"우지혜,두르",로맨스,559.2만,9.9,전체114,"전체 6,772","""연애하면 될 거 아냐!!""

소꿉친구인 재혁을 짝사랑하던 도희. 
그녀가 재혁과 멀어지기 위해 연애를 하기로 다짐한 그 순간 
교내에서 소문난 잘생긴 또라이 원영과 마주친다!

계속되는 원영의 장난에 자신도 모르게 설레는 나날들..
과연 도희는 파란만장한 캠퍼스에서 연애를 시작할 수 있을까??","#현대로맨스, #캠퍼스물, #재회물, #첫사랑, #능글남, #소유욕/독점욕, #사이다남, #선배, #털털녀, #평범녀, #걸크러쉬, #무심녀, #삼각관계, #달달물, #힐링물",전체이용가
로맨스 전기,망재,BL,87.7만,9.9,전체43,"전체 1,109","학교에서 유명한 꽃미남 5인방.
하지만 겉보기와는 다르게 실체는 싸이코인 그들에게 여러 의미로 찍혀버린 준오의 앞날은…?!

#학원물 #다섯명_중에_내_취향이_하나쯤은_있겠지
#능력공 #다정공 #계략공
#미인수 #계략수",해시태그 없음,15세이용가
