Title,Writer,Genre,View Count,Rating,Episode Count,Comment Count,Story,Hashtags,Age Rating
"인형인데, 폭군이 집착합니다","마풍각,대남,르미,진유림",로판,81.6만,9.9,전체64,전체 860,"하필이면 소설 속 폭군의 애착인형에 빙의되어버렸다.
인형이 된 것도 문제지만, 이 폭군은 남주에게 처형당할 운명이라고!

'아무것도 못하고 폭군과 함께 죽기는 싫어!'

살아남기 위해서는 반드시 폭군을 갱생시켜야 한다.
일단 몸을 움직여야 하는데…… 어라? 움직여지네?","#로맨스판타지, #빙의물, #트라우마, #상처남, #왕족/귀족, #오빠, #사이다녀, #신분차이, #갑을관계, #다정녀, #인외존재, #운명, #나쁜남자, #까칠남, #능력녀",전체이용가
너는 나의 나는 너의 수호천사,세라비,로맨스,92.3만,9.9,전체58,"전체 1,605","불운한 운명을 타고난 소녀에게 수호천사가 되어준 기이하고도 신비한 소년.

가정불화, 교내 괴롭힘과 진학 실패, 그리고 실연까지... 연이은 불행에 결국 극단적인 선택을 하게된 세나.
그때 그녀 앞에 나타난 수호천사 덕분에 새로운 삶의 희망을 얻는다.

새 삶 이후에도 잊을 수 없는 아픔에 매일 같은 악몽에 시달리지만, 저주라 생각했던 자신의 능력을 기회 삼아 당차게 사는 그녀는 고대하던 대학교에 진학하고 그곳에서 전 남친을 만난다.

절망에 빠지는 순간, 다시 수호천사 나타난다.","#미스터리, #현대로맨스, #캠퍼스물, #학원물, #짝사랑, #첫사랑, #까칠남, #나쁜남자, #소유욕/독점욕, #직진남, #능력녀, #외유내강, #걸크러쉬, #삼각관계",전체이용가
제목 없음,작가 없음,장르 없음,조회수 없음,별점 없음,회차수 없음,댓글수 없음,줄거리 없음,해시태그 없음,연령 등급 없음
제목 없음,작가 없음,장르 없음,조회수 없음,별점 없음,회차수 없음,댓글수 없음,줄거리 없음,해시태그 없음,연령 등급 없음
보스 B 베이비 [개정판],닥토,BL,118.2만,10.0,전체92,"전체 1,399","사람 좋은게 탈인 '구호진'과 권위적이고 오만한 대기업의 후계자 백유성은 최고이자 최악의 하룻밤을 보낸다.
얼마 후, 유성은 호진에게 빚을 면제시켜줄 테니 그 대가로 계약을 하자며 한가지 제안을 하는데...","#현대물, #동거물, #연하, #다정, #귀염, #연상의, #까칠한, #강한, #고퀄리티, #작화가 쩌는",15세이용가
마이 디어 아스터,"어스레,멋진세계,몽소,한민트",로판,690.5만,10.0,전체74,"전체 6,873","몇 년 전에 딸이 말했다.

“엄마가 혹시 다시 살게 되면, 나 낳지 말아요.”
“갑자기 무슨 소리니, 그게?”
“아빠 말고 더 좋은 사람 만나요.
있었다면서요, 첫사랑. 다시 기회가 온다면 고백해 봐요.”

모녀는 같이 킥킥 웃었다.
그리고 리헨 코플런드는 잠에서 깨어났다. 열아홉 살의 모습으로.

다시 살게 되었다고 인생이 크게 달라지지는 않았다.
하지만 딸을 조금 더 행복하게 해 줄 수 있을 것이다.
그러려면 남편과 다시 결혼해야 했다.
그러나 그 다짐은 곧 흔들리기 시작했다.

오랜 기억 속의 첫사랑,
슈데르멜 라프트 경을 만나고부터.


<마이 디어 아스터>","#로맨스판타지, #회귀물, #가족물, #첫사랑, #운명, #다정남, #순정남, #왕족/귀족, #능력남, #자상녀, #평범녀, #다정녀, #달달물, #잔잔물, #힐링물",전체이용가
회귀한 영애에게 용서란 없습니다,"남이,MOGU,다온웹툰스튜디오",로판,183.5만,9.6,전체49,"전체 1,139","오빠의 연인이자 절친에게 모든 걸 빼앗긴 '카시아'.
과거로 돌아가 잘못된 운명을 만회하고자 한다. 

그렇게 세운 첫 번째 목표는 바로
오빠와 악녀의 연애를 막는 것!

하지만 회귀자조차도 바꿀 수 없던 것이 사람의 감정이었으니…

좌절의 순간,
그녀 앞에 북방의 영웅이 나타난다.

현 황제의 이복동생이자
반역죄로 몰려 처형당할 대공 '카인'.

과거에 자신과 같은 말로를 맞이한 요주의 인물을 보며,
그녀는 본능적으로 직감한다.

이 사람이 바로 운명을 바꿀 열쇠라는 것을.","#로맨스판타지, #회귀물, #복수물, #가족물, #능력남, #외유내강, #후회녀, #권선징악",전체이용가
이미테이션,박경란,로맨스,5.2억,9.9,전체259,전체 59.4만,"""나는 '진짜'를 꿈꿉니다.""

약육강식과도 같은 연예계. 
그곳에서 탑 솔로 가수 라리마와 닮은 이미지로
반짝 인기를 끌었던 마하는 천우신조로 
인기 방송 프로그램에 출연하는 기회를 얻게 된다.

어떻게든 대중들에게 눈도장을 찍기 위해 
최선을 다하지만 결과는 탑 아이돌 그룹 샥스의 멤버를 
다치게 만드는 걸로 끝이 나고 마는데…

그저 열심히 했던 것뿐인데, 왜 이렇게 돼버린 걸까?

'진짜'를 꿈꾸는 별들의 이야기.

<이미테이션>

많은 관심 부탁드립니다.","#현대로맨스, #성장물, #연예계물, #능력남, #능력녀, #직진녀, #경쟁구도, #달달물",전체이용가
제목 없음,작가 없음,장르 없음,조회수 없음,별점 없음,회차수 없음,댓글수 없음,줄거리 없음,해시태그 없음,연령 등급 없음
악당의 누나는 오늘도 고통받고,"현,엘리아냥",로판,"1,187만",10.0,전체101,"전체 8,428","운이라곤 없었던 전생.
죽었다 눈을 뜨니
무려, 금수저도 아니고! 다이아몬드 수저!
드디어 내 인생에 꽃길이 폈구나!

그런데…
내가 입양아라고? 
게다가 이 세계는 소설 속 세상이고, 
나는 사이코패스 남동생에게 살해당할 운명?
그래! 동생을 여주에게 떠넘기고 도망치는거야!

그렇게 여주인공이 등장하는 날.
악당 동생이 여주를 죽여버렸다!?

맙소사 저 사이코패스가 또!","#로맨스판타지, #오해물, #착각물, #먼치킨, #환생물, #가족물, #소유욕/독점욕, #왕족/귀족, #연하남, #능력남, #사이다녀, #로맨틱코미디, #드라마",전체이용가
나의 망한 XXX [개정판],쌔우,BL,65.9만,9.8,전체90,전체 960,"나, 이시현. 신체 건강한 21세. 이미 고등학생 때 게이인 걸 깨닫고, 온갖 남자를 만나기 위해 애써봤지만...
모두 이런저런 이유로 쫄딱 망해버렸다! 하지만 이렇게 망한 채로 끝낼 수는 없지. 오늘이야말로 성공적인 헌팅을 하고 말겠다 다짐했는데...
어? 왜 옛날에 절교한 소꿉친구 놈이 내 옆에 발가벗고 누워있는 거야???","#캠퍼스물, #계략, #후회, #강한, #까칠한, #친구>연인",15세이용가
제목 없음,작가 없음,장르 없음,조회수 없음,별점 없음,회차수 없음,댓글수 없음,줄거리 없음,해시태그 없음,연령 등급 없음
"깨어나세요, 용사여","건우건조,아나나스,다나안",로판,"2,633.4만",9.9,전체150,전체 2.1만,"마나를 봉인 당한 다섯 용사,
그리고 그들을 치료할 단 한 명의 약제사.
제국의 음모에 맞서다!

제국의 감시를 피해 죽음의 숲에 자리 잡은 양 수인족 ‘카카나’.
그녀 앞에 정체 불명의 다섯 남자가 나타났다.

‘우리를 치료해 주시겠습니까?’

마나를 봉인 당한 자신들을 치료할 유일한 약사가 카카나라는 것.
제국의 세력은 이들을 잡기 위해 포위망을 좁혀오고 있는데,
과연 카카나는 다섯 남자를 무사히 치료하고
원래의 평화로운 삶을 되찾을 수 있을까?
 
세기의 천재 약제사지만 자각이 없는 여주와
제국 최고의 실력자 용사들의
예측불가 공생라이프가 시작된다!

#양수인족여주 #제대로코꿰인여주 #용사로이름꽤날렸었던남주들 #일처다부가능한세계관","#로맨스판타지, #성장물, #하렘물, #수인물, #자상녀, #엉뚱발랄녀, #순진녀, #로맨틱코미디, #드라마, #소유욕/독점욕, #트라우마, #인외존재, #운명, #우연한만남",15세이용가
제목 없음,작가 없음,장르 없음,조회수 없음,별점 없음,회차수 없음,댓글수 없음,줄거리 없음,해시태그 없음,연령 등급 없음
황제의 외동딸,"리노,윤슬",로판,2.8억,9.9,전체246,전체 31.7만,"아리아드나 레르그 일레스트리 프레 아그리젠트.

겁나 긴 이름으로 시작한 새로운 내 인생
그러나 대체 이건 무엇이란 말인가.

나름 귀한 신분으로 태어났음에도 
태어날 때부터 온갖 동정 어린 시선은 다 받고 태어났으니
그 이유는 단 하나
바로 내 아버지라는 작자 때문이었다.

아버지가 미친놈이시라면서요?

반역으로 피로 얼룩진 옥좌에 올라선 반왕,
대륙을 공포로 몰아넣은 희대의 폭군.
……나 과연 살아남을 수는 있을까?

이 황제는 아주 위험한 생물입니다.
하지만 지금은 내 아빠죠. 아, 나!

**********************************************

소설에서 풀지 못했던 못 다한 이야기가
지금 여기에서 펼쳐집니다!


[로고 및 표지 디자인] 디자인그룹 헌드레드

************************************************

웹툰 [황제의 외동딸]은 매주 목요일, 주 1회 연재됩니다.","#로맨스판타지, #육아물, #빙의물, #힐링물",전체이용가
제목 없음,작가 없음,장르 없음,조회수 없음,별점 없음,회차수 없음,댓글수 없음,줄거리 없음,해시태그 없음,연령 등급 없음
대리 신부 [개정판],"서리,오트밀홍삼",로판,47.6만,9.8,전체46,전체 219,"해당 작품은 <대리신부> 성인 버전의 일부 장면을 수정한 개정판입니다. 

이복동생 대신 '대리 신부'로 보내진 엘로이즈. 
신랑이 될 트리스탄 공작은 승전국의 적장이자 소문난 전쟁광이다. 그런 그와 동침하며 약점을 잡으라는 황명을 받게 되는데...
   
하지만 첫날밤을 치르자마자 자신의 정체를 들켜버린다.
    
이제는 죽음뿐이라고 생각하던 찰나, 공작의 한마디.
    
""침대로 올라가.""
    
""그대가 대리 신부로 온 이상 역할은 계속 수행 해야 해.""
    
살기 위해 공작과의 잠자리를 받아들이는 엘로이즈. 목숨을 건 쾌락에 점점 빠져들게 되는데...","#계약관계, #상처남, #다정남, #능력녀, #순정녀",15세이용가
제목 없음,작가 없음,장르 없음,조회수 없음,별점 없음,회차수 없음,댓글수 없음,줄거리 없음,해시태그 없음,연령 등급 없음
제목 없음,작가 없음,장르 없음,조회수 없음,별점 없음,회차수 없음,댓글수 없음,줄거리 없음,해시태그 없음,연령 등급 없음
퍼펙트 써전,"밤부즐(REDICE STUDIO),경석,뫼달",드라마,"1,596.5만",9.9,전체118,"전체 9,347","어릴 적, 아버지가 교통사고를 당했다.
아버지를 죽음으로 몰아간 것은 바로 '의료 방임'.
그 뒤 나의 꿈은 어떤 환자도 거절하지 않는 '만능 의사'가 되는 것이다.

하지만 현실은 가혹했다.
어머니의 불치병, 그로 인해 필요해진 돈.
대학 병원 인턴을 그만둔 나는 피부과 페이닥터로 근근이 살아가고 있었다.

현실의 벽에 멈춰선 나에게 어느 날 최첨단 인공지능 'AI-로니'가 찾아왔다.
인턴부터 다시 시작하게 된 만능 의사의 길.

이번에는 해낼 수 있어.
로니가 있으니까.","#현대물, #메디컬, #전문직, #가족, #라이벌, #친구, #의사, #고퀄리티, #남주중심, #이야기중심",전체이용가
내 가문에서 꺼져 주세요,"사룡,탁예하",로판,485.3만,9.9,전체64,"전체 3,052","“어쩌다가 너 같은 게 우리 가문에서 태어났는지 모르겠구나.”

가문의 수치. 오점. 불량품.
이 모든 것은 크로슈 가의 무능한 셋째,
‘위나델라 크로슈’를 가리키는 말이었다.

겨우 11살에 불과한 소녀는 가족에게 버림받고 목숨을 잃었다.
아니, 잃은 줄 알았는데...

“재능이 없다는 이유로 제 혈육을 죽이려 들어?”
죽어가는 소녀의 몸에서 전설적인 대마법사 시조님, 파베 크로슈가 눈떴다.

파베는 후손 위나델라와 함께 썩어빠진 후손들을 심판하고,
하나 둘 모여드는 과거의 인연들과 함께 가문을 재건한다!","#로맨스판타지, #육아물, #성장물, #복수물, #여주판타지, #빙의물, #천재, #초월적존재, #연하남, #걸크러쉬, #능력녀, #사이다녀, #사제지간, #권선징악, #치유물",전체이용가
제목 없음,작가 없음,장르 없음,조회수 없음,별점 없음,회차수 없음,댓글수 없음,줄거리 없음,해시태그 없음,연령 등급 없음
메디컬 환생,"키다리스튜디오,유인(流人)",드라마,"6,360.8만",9.9,전체150,전체 4.1만,"실패한 외과 의사로서의 삶을 살던 김진현,
우연한 사건으로 인해 환생의 기회를
얻는다. 그리고 돌아간 시점은 중학생 김진현의
모습. 새로 얻은 삶의 기회를 소중히
여기고 악착같이 공부하는 진현.
이번 삶의 목표는 힘들고 돈도 못 버는 외과의가
아니라 돈 많이 버는 피부과 의사다!",해시태그 없음,전체이용가
식사하고 가세요!,"스튜디오 웨이브,인기영",판타지,646만,9.9,전체117,전체 1만,"미각을 잃은 요리사 이림이 좌절에 빠진 와중 
가상현실게임인 [리얼]에서 오감을 체험하고 요리하면서 모험하고, 
현실에서도 요리사의 꿈에 다시 도전하는 성장기",해시태그 없음,전체이용가
제목 없음,작가 없음,장르 없음,조회수 없음,별점 없음,회차수 없음,댓글수 없음,줄거리 없음,해시태그 없음,연령 등급 없음
제목 없음,작가 없음,장르 없음,조회수 없음,별점 없음,회차수 없음,댓글수 없음,줄거리 없음,해시태그 없음,연령 등급 없음
객 : 혼탈자들,1230,액션,65만,9.8,전체59,전체 704,"역천자 홍시영. 시영은 태어날때부터 세상 모든 사람들이 죄악의 형상으로만 보였다.

그러던 어느 날 시영의 학급으로 전학온 차청은 인간의 죄악을 보는 시영에 대해 이미 알고 있는 듯, 
시영이 가진 문제를 해결하기 위해서는 죄악이 쌓여 모습을 드러낸 ‘죄혼탈’된 자들을 처리해야 한다고 설득하는데......
과연 시영은 본인의 업보로부터 자유로워질 수 있을까? 

웹툰 '객'은 매주 토요일, 주1회 연재됩니다.","#학생, #성장, #격투, #생존, #무당, #빙의, #학원, #초능력, #학원물, #퓨전",15세이용가
키스는 계약위반,"태연,티키,정오",로맨스,41.5만,9.5,전체56,전체 211,"""내 여자친구가 되어줘요.""

제멋대로 재벌남 재현과, 믿을 건 당찬 자신감 뿐인 단비.
무지개(?)의 인연으로 지독하게 얽혀버렸다?!
과연, 이 '계약 연애'는 무사히 끝날 수 있을까?
© 태연,티키,정오,다맏/지티이엔티​","#사내연애, #오피스물, #현대로맨스, #능글남, #다정남, #재벌남, #우연한만남, #평범녀, #계약관계, #달달물, #로맨틱코미디, #엉뚱발랄녀, #순정녀",전체이용가
처음부터 여기 있었는데요,"B,허쉬하임",로판,973.2만,9.9,전체81,"전체 6,665","B 작가와 허쉬하임 작가가 만나 다시 태어난
<처음부터 여기 있었는데요>가 드디어 웹툰으로 런칭!

작가도 잊어버린 엑스트라 하녀가 불쌍해서 댓글을 단 다음 날.
그 불쌍한 하녀, 마리아 메이어에 빙의해 버렸다.

존재감이 0에 수렴하는 탓에 유령이란 칭호까지 획득.
그래도 성실하게 제 일만 하면 되겠거니 생각했는데
그녀에게 관심을 가지는 사람들이 등장하기 시작했다.

그것도 미래의 황태자와 대공이라는 거물들이!

""기척을 느낄 수가 없다니. 네 정체가 도대체 뭐지?""
마리아의 정체에 대해 흥미 반, 경계심 반의 관심으로
제 옆에 두려는 황태자 엘리아스와

""기억이 안 난다니 별수 없죠. 앞으로는 날 잊지 않게 하면 되니까.""
처음보는 게 분명한데 다 알고 있다는 듯이
웃으며 접근하는 대공 디트리히.

저, 저……
저는 그냥 평범한 하녀1(특:존재감 없음)일 뿐인데요!","#로맨스판타지, #빙의물, #까칠남, #능글남, #다정남, #왕족/귀족, #츤데레남, #순진녀, #삼각관계, #갑을관계, #신분차이, #달달물, #로맨틱코미디",전체이용가
제목 없음,작가 없음,장르 없음,조회수 없음,별점 없음,회차수 없음,댓글수 없음,줄거리 없음,해시태그 없음,연령 등급 없음
남주의 복지를 책임지겠습니다,"앤트스튜디오,개떡,이지하",로판,"1,240.9만",9.9,전체119,"전체 7,870","내가 대충 쓰다 연중한 피폐 소설 속으로 빙의했다.
하필이면 남주에게 휘말려 죽을 설정인 악녀, '라리아 셔우드'로.

이건 등장인물들을 고통받게 한 죗값인 걸까?

나 때문에 기구한 운명을 갖게 된 남주의 복지를 위해서,
아이들과의 관계를 개선하고 여주와의 해피엔딩도 이뤄 주겠어!

그렇게 등장인물들의 복지를 위해 열심히 일했을 뿐인데…

""모두에게 소개하지. 나와 결혼을 약속한 라리아 셔우드 영애다.""

""라리아가 제일 조아! 언제 우리 엄마 돼?""

""아가씨께서 이 대공가의 안주인이 되어 주십시오!""

…뭔가 일이 단단히 잘못되어 가고 있는 것 같다!

#로판 #빙의 #선복지후연애 #육아물 #집착남주 #계약결혼","#로맨스판타지, #성장물, #빙의물, #피폐물, #짝사랑, #트라우마, #소유욕/독점욕, #카리스마남, #집착남, #능력녀, #자상녀, #평범녀, #계약관계, #갑을관계, #드라마",전체이용가
불괴신화 [개정판],묵검향,무협,2.6만,10.0,전체195,전체 21,"세상의 정대함을 오로지 자신의 믿음 하나로 귀결한 옹고집.
많은 사람들이 그를 외면하고 죽음을 빈다.
그러나 그의 고집스러운 믿음은 절대 변하지 않는다.
그리고 그는 이렇게 말한다.
나는 남을 절대 배신하지 않는다.
다만 상대가 나를 배신하도록 만든다.",#정통,15세이용가
화산권마,"진선규,우각",무협,"1,963.2만",9.6,전체183,전체 1.3만,"자신의 마을이 습격받고 유일하게 살아남은 담호, 하지만 담호는 절름발이다. 무인으로서 최악의 조건이지만 담호는 수련을 멈추지 않는다. 주변 사람들로부터 무인이 될 수 없다고 듣지만 끝까지 포기하지 않는 담호, 과연 그는 최고의 무인이 될 수 있을 것인가?","#정통, #성장, #무림, #복수, #영웅/신화",전체이용가
제목 없음,작가 없음,장르 없음,조회수 없음,별점 없음,회차수 없음,댓글수 없음,줄거리 없음,해시태그 없음,연령 등급 없음
호식이 이야기 [개정판],녹채,BL,152.1만,10.0,전체89,"전체 1,385","학교에서 가장 인기 많은 사람, 눈웃음 치는 예쁜 얼굴, 다정다감하지만 왠지 불편한 같은 과 선배.
호식이에게 성연이는 그런 존재였다.
그런 성연과 모임에 함께 참석해 술을 많이 마셨고, 기억이 끊겼고, 성연 옆에서 알몸으로 누워 눈을 떴을 때 호식이의 모든 게 달라졌다.
""임신했대요. 선배 애뱄다고요!""","#현대물, #육아물, #연상, #미인, #계략, #소심",15세이용가
삼류호텔 막내셰프,"차지운,스튜디오 이너스,제이로빈",드라마,"1,585만",9.9,전체102,전체 1만,"국내 4성급 호텔 주방 막내인 강성훈, 그에게는 식재료의 기억을 읽을 수 있는 능력이 있다.

하지만 그는 막내로서 설거지 담당을 벗어나지 못하고 있었는데...","#현대물, #요리능력물, #음식/요리, #초능력, #삼각관계, #요리사, #회사원, #PD/감독, #고퀄리티, #남주중심, #노블코믹, #이야기중심, #잔잔한",전체이용가
향현문자,"임애주,채팔이",BL,149.1만,9.9,전체82,"전체 1,258","상대방의 감정과 생각이 문자로 나타나 눈으로 읽을 수 있는 능력을 가진 주인공. 
생에 처음으로 그의 앞에 문자가 보이지 않는 남자가 등장했다!
서로에게 빨려 들어가듯 호감을 느끼는 미스터리한 두 남자의 관계의 서막이 펼쳐진다.","#현대물, #판타지물, #피폐물, #트라우마, #냉정, #무심, #연상, #재력, #능력있는, #무심한, #평범한, #나이차커플, #연상연하, #고퀄리티, #원작소설",15세이용가
죽음 대신 결혼,"도개비,밀",로맨스,"2,084.8만",9.9,전체92,"전체 9,391","다른 조직의 아들과 계약 결혼을 해야 한다고?!
평온한 일상을 위해 대학 입학 후 싸움만 일삼는 집안과는 연을 완전히 끊고 바르게 살아가고 있는 아가씨, 양혜진.
손부터 먼저 나가는 폭력적인 아버지와 그를 똑 닮은 무식한 오빠를 떠난 지도 9년째,
하지만 가족들은 갑자기 나타나 원하지도 않는 상대 무강과의 결혼을 일방적으로 알린다. 
조직 간의 계약으로 이루어진 정략 결혼,
받아들이지 않으면 죽음 뿐인 이 결혼에서 과연 혜진과 무강은 평생을 맹세할 수 있을까?","#현대로맨스, #조직/암흑가, #복수물, #첫사랑, #짝사랑, #능글남, #다정남, #외유내강, #무심녀, #걸크러쉬, #계약관계, #나이차커플, #정략결혼, #드라마, #연하남",15세이용가
학사귀환,"외솔,소유현",무협,"2,051.1만",9.7,전체202,전체 1.1만,"관리가 되기 위해 길을 떠났던 학사, 마현.  
행방불명된 지 십 년 만에 절대고수가 되어 돌아왔다.

“불효자 마현…… 돌아왔습니다.”

흑천맹이란 수상한 암조직을 뒤쫓는 한편,
학문의 뜻을 펼치고자 와룡서원을 열게 된다.

개성이 넘치는 10명의 제자들을 잘 키워내고,
흑천맹의 정체도 밝혀 낼 수 있을까?

중원 최강의 스승 마현의
서원 이야기가 지금 펼쳐진다!

*****************
소유현 작가님의 인기 소설 <학사귀환>을 웹툰으로 만나보세요!
*****************","#객잔무협, #귀환, #먼치킨, #무림, #전쟁, #학사",전체이용가
하이 클리어(HIGH CLEAR) [개정판],윤별,BL,4.9만,10.0,전체61,전체 69,"해당 작품은 <하이 클리어(HIGH CLEAR)> 성인 버전의 일부 장면을 수정한 개정판입니다. 

""ㅈ같네?""
낯 가릴수록 사나워지는 주원. 고치려고 노력 중인 나쁜 습관은 실수로 짝사랑 상대인 정민의 가슴을 만지고도 험한 말부터 뱉어낸다. 속상한 마음과 반대로 종일 정민의 말랑 가슴으로 향한 못된 손은 무언가 이상함을 느끼는데...
'잠깐, 근데 방금 진짜?
그렇게 안 생겨서...함X유두라니?!'","#캠퍼스물, #오해물, #착각물, #짝사랑, #연상, #강한, #무심한, #떡대",15세이용가
제목 없음,작가 없음,장르 없음,조회수 없음,별점 없음,회차수 없음,댓글수 없음,줄거리 없음,해시태그 없음,연령 등급 없음
제목 없음,작가 없음,장르 없음,조회수 없음,별점 없음,회차수 없음,댓글수 없음,줄거리 없음,해시태그 없음,연령 등급 없음
착한 언니는 없다,"주기,세림,내일,윤여음",로판,"1,159.9만",9.9,전체113,"전체 7,251","연년생 자매인 이렌과 리엘,
자매의 집은 언제나 몸이 약한 리엘 중심으로 돌아간다.

한 발자국 뒤로 물러서 있으면 집안의 평화를 지킬 수 있을 거라 생각했는데,
리엘에게 약혼자까지 빼앗기고 나서야 깨달았다.
가족들이 누리는 행복에 자신의 몫은 없었다는 것을.

""이젠 오직 나를 위해 살겠어.""

더 이상 착한 언니로 존재하지 않겠다고 결심한 이렌은 
우연히 서자 출신 대공자인 노엘의 소문을 접한다.
마침 결혼 상대를 찾고 있던 노엘은 이렌으로부터 뜻밖의 제안을 받는데...

""우린 서로를 구원할 수 있을지도 몰라요.""

가문에서 해방되기 위해 사랑 없는 결혼을 택한 이렌 체이스 백작 영애,
그리고 대공위를 물려받으려면 결혼을 해야만 하는 노엘 크리스탄 대공자.

필요에 의해 시작된 두 사람의 인연은 행복한 결말을 맺을 수 있을까?","#로맨스판타지, #복수물, #우연한만남, #운명, #상처남, #순정남, #카리스마남, #외유내강, #사이다녀, #순정녀, #상처녀, #계약관계, #정략결혼, #달달물, #힐링물",전체이용가
대마법사의 딸,"문설아,새벽애",로판,"8,378.4만",10.0,전체208,전체 8.4만,"줄곧 나를 미워한 부모님은 친부모님이 아니었다. 내게 진짜 아빠가 따로 있다고 한다.
그래서 떠났다. 친아빠에게로.

*원작소설 <대마법사의 딸>","#로맨스판타지, #육아물, #가족물, #천재, #츤데레남, #능력남, #순진녀, #외유내강, #경쟁구도, #신분차이, #드라마",전체이용가
제목 없음,작가 없음,장르 없음,조회수 없음,별점 없음,회차수 없음,댓글수 없음,줄거리 없음,해시태그 없음,연령 등급 없음
