Title,Writer,Genre,View Count,Rating,Episode Count,Comment Count,Story,Hashtags,Age Rating
공헌자,"정연,한서진,권이백",판타지,654.1만,9.6,전체40,"전체 3,191","근 미래의 세계.

운석이 떨어지던 도중 사라지는 이상 현상과 함께, 세상 전체에 몬스터가 나타난다. 그런 몬스터들과 대등하게 싸울 수 있는 이능력을 가진 사람들이 생겨나며, 세상이 변화하기 시작한다.

세계의 이상을 눈치챈 박태민은 자신의 힘과 세력을 늘리는 한편 여러 이상한 사건들을 해결하고, 암암리에 인류를 지배하려는 몬스터들의 존재를 깨닫는다.

그리고 진정한 인류 해방을 위한 싸움을 시작하게 되는데…….","#시스템, #이능력, #성장",전체이용가
야차-영원한 사랑 [완결],"발로,정혜",로판,357.2만,10.0,전체74,"전체 3,034","야차와 다를바 없는 잔인무도한 태자 백영.
후궁으로 오년간 독수공방의 끝은 죽음. 그리고 되살아난 영궁.

조용한 궁 안이 술렁이기 시작하고 태자 백영은 이제야 그녀에게 흥미를 느끼지만 
영비, 아니 여희의 목적은 궁을 벗어나는 것이다! 
백영이 눈을 가늘게 뜨고 여희의 얼굴을 보았다. 
“너는 사람이냐, 귀신이냐?” 
여희는 재미난 것을 들었다는 듯이 웃음을 터트렸다. 
“그 어느 것도 아니다.” 
“그럼 너는 무엇이냐?” 

인기 로맨스 소설 '야차'의 웹툰 '야차-영원한 사랑'!","#시대/역사로맨스, #인외존재, #궁정로맨스, #집착남, #권선징악, #걸크러쉬, #털털녀, #능력녀, #후회남, #초월적존재, #로맨스판타지, #환생물, #왕족/귀족",전체이용가
파트너의 영역 ∼바이 앤 하이~,아이반(Aivan),BL,"1,561.6만",9.9,전체117,전체 1.2만,"※파트너의 영역 ∼바이 앤 하이~(일반판)입니다.

[ <파트너의 영역> 프롤로그 대공개! ]
https://youtu.be/CEmj6OcIdxA

서로의 영역을 침범하는 세 남자의 거부할 수 없는 거친 로맨스.
헤어지고 다시 만나기를 반복해온 이이제와 신진기. 이이제는 계약결혼을 한 유부남 신진기와 함께 살게 되지만 과거, 자신은 호모가 아니라며 그만하자고 말했던 제멋대로인 신진기를 떠올린다.  
한편, 소울브러시에서 매니저로 일하고 있는 이이제 앞에 새로운 오너 이척이 등장하고, 그의 카리스마 있는 모습에 신진기는 불평을 하게 되는데….
(원작:김다윗)","#현대물, #사내연애, #삼각관계",15세이용가
파티시에,"일타홍,김시호",로맨스,821.2만,9.4,전체70,"전체 8,756","어릴적 부모님을 여의었지만 씩씩하게 자라온 무한긍정 백하이! 그녀의 꿈은 아빠를 닮은 파티시에가 되는 것이 꿈이다.

그리고 또 다른 주인공.

프랑스 유명 학교를 수석 졸업하고 미슐랭 3스타의 셰프였던 그! 여의치 못한 사정으로 그만 한국으로 돌아와 재기하기 위해 자신만의 샵을 내기로 하려는 파티쉐 도수혁!

꿈을 이루기 위해 부모님이 남겨주신 건물을 세주고 떠나기로한 하이. 그리고 그런 하이의 건물에서 샵을 내려던 수혁.

하지만 두 사람은 우연히 만난 만남에서 하필 최악의 첫인상을 맞게된다. 겨우 이성적으로 생각하여 유학과 개인샵을 위한 계약을 체결하지만…이 또 무슨 악연인가! 모종의 사건으로 두 사람은 원수보다 못하게 재회하는데…!

 

파티시에가 되고 싶은 여자! 그리고 재기를 꿈꾸는 천재 파티쉐 남자!

두 사람은 원하는 달콤한 꿈을 맛볼 수 있을까?","#현대로맨스, #동거물, #우연한만남, #까칠남, #상처남, #능력남, #엉뚱발랄녀, #평범녀, #힐링물, #로맨틱코미디, #계약관계, #사제지간, #라이벌/앙숙",전체이용가
묵검향 난세영웅 컬렉션,묵검향,무협,319.2만,9.8,전체699,전체 874,"그의 쾌진격을 막을 자는 존재하지 않는다!


※수록작품
1. 청운적하검
2. 천졸 1,2부
3. 절대무쌍 1,2부
4. 염왕진천하 1,2부",해시태그 없음,15세이용가
신시,정은숙,판타지,208.4만,10.0,전체108,"전체 2,696",12개의 시간으로 세상을 지배하는 십이지신. 동물 신들의 버라이어티한 배틀!,"#영웅/신화, #신",전체이용가
조상님이 돌아왔다,WONDER,드라마,170.8만,9.9,전체60,"전체 1,327",실수로 조상님을 불러냈다. 이 분을 무사히 돌려보내려면..?!,"#판타지물, #귀신, #가족, #기묘한",전체이용가
폭군의 행방,"DIAN,유한려",로판,"4,188.1만",9.9,전체125,전체 3.4만,"까마득한 옛날, 아름답고 무자비했으며 탐욕스러운 왕이 있었다.
그의 생전 기록을 들여다본 신은 고개를 내저었다.
그리고 왕에게 가장 고통 받았던 세 여인에게 신은 물었다. 

""너희는 그에게 무슨 형벌을 내리기를 바라느냐?""

그러자 서로를 바라본 세 여인이 잠시 후 일제히 대답했다.

""저희 모두를 다시 지상 세계로 내려보내주십시오.""

세 여인에 의하여 아름다운 외모와 뛰어난 검솜씨,
그 누구도 사랑하지 않는 강철의 심장을 빼앗긴 채 환생을 하게된 지엔.

그리고 그녀 앞에 남자로 환생을한 전생의 여인들이
차례차례 나타나기 시작하면서 네 사람의 악연은 반복 되기 시작하는데……!

""왜 똥을 싼 것은 전생의 자신인데 엿을 먹는 것은 현생의 자신인가!""","#로맨스판타지, #환생물, #왕족/귀족, #차도남, #엉뚱발랄녀, #신분차이",전체이용가
살벌한 동거,"백하나,하엘",로맨스,"1,800.7만",9.9,전체72,"전체 8,859","사랑하는 완벽한 남자친구, 진형과 행복한 결혼식을 올린 해솔.
그런데 진형은 알고보니 킬러?!
도저히 감당할 수 없는 사실에 혼란스러워 하던 해솔은 덜컥 이혼해버린다.

이후 생계를 위해 쉐어하우스를 오픈했는데..

입주자가 전남편과 전남친이라니?",해시태그 없음,전체이용가
부탁해요! 이별귀,"동남,하나",드라마,296.2만,9.9,전체79,"전체 2,707",연인들의 이별을 관장하는 귀신들의 특별한 커플 브레이킹! 과연 성공할 수 있을까?,"#판타지물, #귀신, #성장물, #스릴 넘치는",전체이용가
제비전,고은,로맨스,439.2만,9.9,전체90,"전체 5,165","까칠한 흥부와 왕자병 놀부, 두 형제 사이에 낀 제비의 험난한 은혜 갚기!","#인외존재, #퓨전사극, #바람둥이, #까칠남, #엉뚱발랄녀, #계약관계, #로맨틱코미디",전체이용가
아이리스 - 스마트폰을 든 레이디,"윤혜,유수완",로판,"5,613만",9.9,전체149,전체 3.9만,"남편은 사촌동생과 바람이 나고 가문은 송두리째 시가에 빼앗겼다.
절망에 빠져 생을 마감한 순간, 전생의 기억이 떠올랐다.
서울의 취업준비생 백연화의 삶이.

과거로 돌아온 그녀는 결심했다.

두 번 다시 그들에게 버려지지 않겠다. 이제 내가 그들을 버리리라!

그런데…….

이안은 아이리스의 눈을 지그시 응시했다.
“일전에 제가 했던 말을 기억하십니까?”
“의뢰비는 다른 것으로 받으시겠다는 말씀 말인가요?”
“예. 지금 받고 싶군요.”
아이리스는 가진 게 없는 사람이었다.
다른 귀족 자제처럼 든든한 부모가 있는 것도 아니고, 돈이 많지도 않았다.
그런 자신에게 무얼 받겠다는 말일까.
아이리스가 깜빡였다.
그가 빙그레 웃으며 말했다.
“나랑 연애하자.”

선황의 장자, 제국 최고의 미남, 완벽한 남편감으로 손꼽히는 발렌시아가 공작이 왜 내게?!
복수를 위한 동아줄이 날 잡아달라고 살랑거린다.


*********************

로판 화제작 유수완 작가님의 <아이리스 - 스마트폰을 든 레이디> 본격 웹툰화!
아이리스의 통쾌한 복수극, 공작과의 설레는 연애를 웹툰으로 만나 보세요!

*********************",해시태그 없음,전체이용가
웨딩 임파서블,"이청,송정원",로맨스,"1,128만",9.9,전체73,전체 1.3만,"서른 세 살, 10년 째 무명 연극배우인 나아정.
재벌 3세와 약혼하다?!

그녀는 뭐 하나 내세울 것이 없기에
당연히 시부모님의 매서운 반대를 예상했다.
그러나 그녀의 예상과는 다르게 너무나도 순조롭게 결혼이 성사되려고 한다.
아니, 그렇게 생각했는데!

“형, 미쳤어?
내가 이 결혼, 죽어도 허락 안 한다고!!”
폭풍처럼 몰아닥친 예비 시동생의 습격!

[특명] 예비 시동생의 결혼 허락을 받아라!
그것도 단 두 달 내에!

“누가 이기나 두고 봅시다.”

그렇게 시작된 밉살맞은 예비 시동생의 험난한 시집살이!

그런데... 여기에 숨겨진 비밀 한 가지.
사실 약혼자 지경이 게이?!
아정은 5억 원을 받기 위해 지경과의 위장 결혼을 계획한 건데…….
이 결혼, 무사히 골인할 수 있을까?

시동생을 물리치고 결혼에 성공하라!
웨딩 임파서블!
***********************************************
2017 디앤씨미디어X카카오페이지 공모전 노블 코믹 수상작.
<웨딩 임파서블>이 웹툰으로 다시 시작합니다!

[표지 및 로고 디자인] 송가희",#현대로맨스,전체이용가
황태자 약혼녀로 살아남기 [개정판],"봉봉,휘색",로판,961.5만,9.7,전체81,"전체 5,824","하윤은 대기업 비서로서 여러 군데에서 입사제의를 받을 정도로 유능한 인재이다.    
퇴근길에 하윤은 이세계 ‘라피스 제국’으로 떨어지게 되고, 그곳에서 제국의 황자인 앨런을 만나게 된다.
앨런은 하윤을 예언의 그녀라 칭하며 자신이 황태자가 되는 것을 도우라하고, 
하윤은 자신이 살던 곳으로 돌아가기 위해 앨런의 제안에 동의한다.
앨런의 약혼녀 행세로 민심과 황제의 마음을 사로잡고 앨런과도 점점 가까워지며 사랑의 감정을 느끼는데...",해시태그 없음,전체이용가
"도와줘요, 이비씨!","단투,쌈바",판타지,98.8만,9.9,전체116,"전체 1,000","먼 과거, 다툼이 끊이지 않던 세계가 있었다.
끝없는 투쟁 속에서 인간들은 신앙의 힘을 빌어 스스로를 지키려했다.
섭리를 벗어난 존재들에게 위협당하며 그를 다스릴 신앙의 용사를 섬기는 위태로운 균형의 세계….
그러던 어느날, 그 균형을 무너트릴 기묘한 두 사람이 등장하는데…?
세계를 뒤집을 이색 커플의 모험이 이곳에서 시작된다!!
[매주 화요일 연재됩니다!]","#생존, #전쟁",15세이용가
레드허니,"85,남편,은비",로판,771.2만,9.9,전체72,전체 1.1만,"현대에도 뱀파이어는 존재한다. 뱀파이어 사회는 인간 사회와 함께 맞물려 있다. 
뱀파이어 왕가 중에서 가장 힘이 강력한 장미 가문 출신의 여왕이 있었다. 그리고 지금, 그녀의 딸이 차기 여왕으로 추대되는데...
주인공 신환희는 중성적인 매력을 가진 큰 키의 소녀다. 그녀는 남자 배구부 주장 은연우를 좋아하고 있다.
어느 날, 환희는 우연한 계기로 자신이 뱀파이어 사회의 차기 여왕 후보임을 알게 된다. 
그리고 그저 친구인 줄 알았던 주승준이 자신의 정체를 밝히면서, 환희의 일상은 순식간에 달라지는데……",해시태그 없음,전체이용가
다정하게 말해줘,씽씽,BL,738.4만,10.0,전체123,"전체 5,920","상품 하자 때문에 클레임 전화만 걸었을 뿐인데… 
좋아도 너무 좋은 상담원의 목소리에 흥분해버린 영하. 
그런 영하 앞에 상담원과 똑같은 목소리를 가진 남자가 등장한다?!

취향의 목소리에 흥분하는 영하.
연애보다 일이 더 좋은 꿀성대 은성,
성인용품 전문점 어덜트 엔젤 주인 선남,
영하의 첫사랑, 유도 선수 운이까지!

영하를 둘러싼 세 남자의 단짠단짠 사각(?)관계 로맨스!",해시태그 없음,15세이용가
리얼 러브 독,"건전지,신이호",BL,468.4만,10.0,전체42,"전체 2,302","＂협박당하고, 돈 뺏기고, 몸도 굴려지고 싶다.＂
이상한 한 마디로 시작된 계약관계...! 김주인, 27세. 단정하고 지적인 국어교사. 손영우, 32세. 왕년의 아이돌 가수. (현재는 배우로 전업, 인기는 그럭저럭 별로.) 성격과 성벽이 정반대인 두 사람. 낮에는 선생님과 연예인, 밤에는 주인님과 노예로 지내는 이런 관계 속에서 완벽한 사랑을 찾을 수 있을까...?",#현대물,15세이용가
점핑걸,"마하로,우주용",로맨스,60.6만,9.7,전체60,"전체 1,032","XX녀, 현대판 마녀사냥을 당한 그녀들의 엽기발랄 생존기","#현대로맨스, #다정남, #엉뚱발랄녀, #친구>연인, #로맨틱코미디",전체이용가
고요새,오늘만 사는 형제,BL,"1,052.2만",9.8,전체74,"전체 6,155","고전무용으로 이름을 떨치던 청은 20살이 되는 해, 
갑자기 무용을 그만두고 카페 아르바이트를 하면서 생계를 이어간다.

어느 날 구릿빛 피부의 남성이 청을 찾아온다.
화려했던 청의 고전무용시절을 기억하는 남자의 정체는....[개정판, 완결]",해시태그 없음,15세이용가
괜찮아 애송이 완전판,진아,드라마,684.8만,9.9,전체517,전체 1.2만,"<괜찮아 애송이>가 완전판으로 돌아왔다!

덩치… 도 조금 커졌고
나이… 도 조금 먹었고
세상 사는 스킬… 도 조금 늘어야 하는데
난 왜 아직도 애송이인 것인가!

평범한 듯 평범하지 않은,
엉뚱발랄 애송이 라이프를 완전판으로 즐기세요!",해시태그 없음,전체이용가
소녀샵,유기,로맨스,"3,467.7만",10.0,전체97,전체 4.4만,"쇼핑몰에서 옷을 샀더니 모델을 받았다?!
평범한 회사원 안경진과 배송 된 쇼핑몰 모델 소희가 같이 살면서 벌어지는 따뜻한 일상,로맨스 웹툰!",#GL,전체이용가
아델라이드,"이수호,채하빈",로판,"4,202.7만",9.9,전체87,전체 3.5만,"갑자기 교통사고를 당하고 환생한 지 17년. 
지루하기만 했던 아델라이드 인생에 날아든 
대박! 대박! 대박사건☆

“뭐라고? 황궁에 차원 이동자가 나타났다고?”

차원 이동자 수잔을 만나기 위해 제도로 올라온 아델에게
의외의 만남이 기다리고 있었다.
엘리아스 공작 펠릭스는 공작 부인 자리를 노리는 수잔을 떼어놓기 위해
아델에게 계약 약혼을 제안하지만,
어째… 뱀 잡으려다 여우를 만난 꼴?! 
그리고 마침내 마주친 차원 이동자 수잔의 정체!!

빨간 머리, 푸른 눈. 
너무 사랑스러운 내숭제로 ‘사이다’ 그녀 아델라이드가 온다!

앙큼발랄 환생소녀 아델과 철혈공작 펠릭스의 코믹 로맨스!
************************************************

2015 블라클×카카오페이지 공모전 수상작 <아델라이드의 라 돌체 비타>가 만화로 재탄생!

************************************************

[표지 및 로고 디자인] 송가희","#로맨스판타지, #환생물, #상처남, #냉정남, #사이다녀, #엉뚱발랄녀, #직진녀, #계약관계, #로맨틱코미디",전체이용가
크리스마스에 기적이 생길 확률,"박한나,햄친,이음새",로맨스,"2,318.4만",10.0,전체98,전체 2.2만,"'사랑'은 대체 어떻게 해야 하는 걸까.

크리스마스 이브.
""헤어지자. 번호 바꿨으니까 하고 싶은 말 있으면 지금 해."" 
남은은 유준에게 뭐라 대꾸로 못한 채 차였다.

7년 후, 남은의 앞에 나타난 톱배우 유준은
더 냉정한 모습으로 남은을 열받게 하고.

그런 남은의 앞에 나타난 연하 아이돌 안성윤.
따뜻하고, 대범하고, 유쾌하기까지 한 이 남자는
남은에게 '사랑을 받는 것'이 무엇인지 알려준다.

한편 유준에게는
차마 알리지 못한 비밀이 있어보이는데…….

<이음새- 크리스마스에 기적이 생길 확률> 웹툰화!

연하 아이돌 vs 톱배우 전남친
#멍뭉미남주 #운명 #아련 #청춘 #첫사랑 #크리스마스 #달달물 #삼각관계",해시태그 없음,전체이용가
사랑과 우정 사이에서 (개정판),"빨간구두,랙킹",BL,419.2만,9.8,전체52,"전체 4,591","* 이 작품은 개정판으로 일부 페이지가 수정되었습니다.

권투로 친해진 고교동창 ‘우정’을 남몰래 좋아해 온 ‘진우’는 오랜 기간 끙끙 앓다 드디어 '우정'이에게 술김에 고백을 하고 아찔한 하룻밤까지 함께 하는데… 뭐?? 네가 사실 '우정'이가 아니라, 동생 ‘사랑’이라고? 이게 무슨 소리야?! 일란성 쌍둥이 형제 '사랑'과 '우정' 사이에 끼어버린 진우. 얽히고설킨 관계 속, 아픈 청춘들의 사랑과 우정 이야기.",해시태그 없음,15세이용가
고백을 못하고,석영,BL,688.2만,9.9,전체93,전체 1만,"이젠 한계야. 더 이상 좋아하는 마음을 감출 수 없어!

진우네 자취방에 방학 동안만 살게 해달라던 기섭.
하지만 같이 산 지 벌써 반 년이나 지나버렸다.
한지붕 아래에서 살다 보니
진우는 기섭을 향한 마음을 점점 숨기기 힘들어지는데...

누구나 한 번쯤은 겪어 봤을 법한
사랑과 우정사이... 그 미묘한 감정",#현대물,15세이용가
연애가 제일 쉬웠어요,참치캔,로맨스,376.3만,9.9,전체48,"전체 3,945",말썽 피우면 호랑이한테 시집보낸다! 그 말 누가 믿냐고? 뒷산에 살던 호랑이가 믿죠,"#현대로맨스, #다정남, #직진남, #엉뚱발랄녀",전체이용가
하수전설 [개정판],묵검향,무협,518.5만,9.8,전체207,"전체 1,301","※본 작품은 전연령가 버전으로 개정되었으며,
개정작업에 따라 수정되거나 삭제된 곳이 있을 수 있습니다.

하수팔철칙 一 하수는 음흉해야 한다. 二 하수는 눈치가 빨라야 한다. 三 하수는 절대 화를 내면 안 된다. 四 하수는 절대 검을 함부로 뽑으면 안 된다. 五 하수는 시비를 만들어서는 안 된다. 六 하수는 미인을 멀리해야 한다. 七 하수는 결코 자신보다 낮은 하수와 어울리면 안 된다. 八 하수는 자신의 분수를 알아야 한다. 나는 일찍이 이러한 하수 팔 철칙을 지킨다면 고수로 행세할 수 있다는 것을 깨달았다.",해시태그 없음,15세이용가
겨울하나 + 피노키오,마루,로맨스,311.8만,9.9,전체90,"전체 3,181","겨울하나 : 유령소년 유가온이 죽은뒤에 맞는 첫 인연에 대한 이야기
피노키오 : 행복해지고 싶은 사람들과 한 소년의 행복찾기!","#현대로맨스, #성장물, #첫사랑, #순진남, #다정녀, #계약관계, #달달물",전체이용가
들숨날숨,와자,드라마,31.9만,9.6,전체59,전체 581,죽음을 그리는 한 남자의 이야기,"#판타지물, #초능력, #연쇄살인, #작가, #분량많은",전체이용가
제왕의 꽃,"토연,이승희",로맨스,"3,421.9만",9.9,전체80,전체 1.5만,"20살의 봄, 운명의 남자를 만나 사랑에 빠지고 싶은 평범한 대학생 한송이.
새로 새관한 체육관에서 운동을 하고 개운하게 샤워실에 발을 내딛는 순간,
남자의 알몸이 떡하니 사우나실에서 나오는데… '헉? 저건 황제왕?!'

이름만큼이나 완벽한 삶을 살아가고 있는 한국대 최연소 교수 황제왕. 
어느 날 샤워실에서 알몸으로 마주친 한송이로 인해 그는 난생처음 엄청난 혼란에 빠지고 마는데…

자체발광 교수님과 엉뚱매력 그녀의 단짠단짠 캠퍼스 스캔들!",해시태그 없음,15세이용가
사랑이 오기를,once,BL,857.4만,9.8,전체65,"전체 5,948","미남에, 프랜차이즈 업계의 큰 손인 강주혁 사장. 그 밑에서 일하고 있는 서이진은 완벽한 사장님이 게이인 게 흠이라고 생각한다. 그러던 중 사채업자들에게 아버지의 회사를 강제로 빼앗기게 될 위기에 처한 이진. 어둠의 세계와 연이 있는 주혁이 이진을 도와주겠다고 나서는데, 댓가는...사장님의 잠자리 상대...?!","#현대물, #전문직물, #갑을관계, #계약연애/결혼, #능력, #다정, #재력, #연상, #평범한, #작화가 쩌는",15세이용가
도망치는 건 부끄럽지만 도움이 된다,우미노 츠나미,로맨스,173.3만,9.9,전체57,"전체 2,491","직업으로서의 결혼은 어떤가요?

모리야마 미쿠리(25세), 남친 없음. 대학원까지 졸업했지만 취직 실패, 비정규직으로 일하다 계약해지, 현재 취업 준비중. 
보다 못한 아버지의 주선으로 싱글남 회사원 츠자키 히라마사(36세)의 가사 도우미로, 일주일에 1회 일하기 시작한다. 
서로에게 쾌적한 관계를 구축한 두 사람이지만, 집안 사정으로 미쿠리가 일을 그만두게 된다. 
현재 상태를 유지하고 싶은 두 사람이 내린 결론은 취직으로서의 결혼, 계약 결혼이었다!
Nigeru wa Haji daga YakunitatsuⓒTsunami Umino 2013
All rights reserved.
First published in Japan in 2013 by Kodansha Ltd., Tokyo
Electronic Publishing rights for this Korean edition arranged through Kodansha Ltd.",해시태그 없음,전체이용가
