Title,Writer,Genre,View Count,Rating,Episode Count,Comment Count,Story,Hashtags,Age Rating
하렘생존기,오리발,드라마,"1,152.8만",10.0,전체122,전체 1.2만,"17세기 오스만 제국,
왕궁 하렘에 끌려온 기독교인 노예 나스챠와 아샤.
같은 날 왕궁에 팔린, 출신은 다르지만 똑같은 빨간 머리카락을 가진 두 소녀.
 
""날 배신한 건 당신이에요.""
""너는 정말로 나를 미워했구나...""
 
그녀들의 우정과 음모와 사랑, 그리고 욕망 이야기.
 
*이 이야기는 역사적 사실을 모티브로 하였으나 실제 역사와는 다른 픽션입니다.","#시대물, #음모, #친구, #왕족/귀족, #여주중심",15세이용가
검은 머리 전술 천재,"팀 벤치(WHYNOTME),강로이",드라마,356.2만,9.9,전체66,"전체 5,008","3부 K-리그 

전략분석관인 주인공 마정우. 

나날이 늘어나기만 하는 빚에 시달리던 중, 소식도 없이 돌아가신 할아버지로부터 물려받은 영국의 축구 구단! 구단 따위 팔아 치우고 새 삶을 시작하려 했더니, 

'뭐? 구단 부채만 1500억!?'

정우는 어떻게든 부채를 탕감시키려 구단주에 감독직까지 직접 발벗고 나서게 되는데…….","#일상물, #스포츠물, #스포츠능력물, #망나니, #축구선수, #스릴 넘치는, #남주중심, #분량많은, #일상, #군대, #현대물, #전문직, #서바이벌, #경영, #감독/스카우터",전체이용가
제목 없음,작가 없음,장르 없음,조회수 없음,별점 없음,회차수 없음,댓글수 없음,줄거리 없음,해시태그 없음,연령 등급 없음
우리는,방자,드라마,9.5만,9.7,전체39,전체 144,"뺑소니를 친 아버지가 사고로 죽고
보육원에 버려져 거칠게 살던 진태는
엄마의 오랜 친구였던 미자와 그녀의 딸 연주에게
거둬지면서 평범하고 따듯한 일상을 맞이하게 된다.

그러던 18살의 어느 날, 첫사랑이었던 연주가 동네 바보에게 살해되면서
진태의 인생은 다시 바닥으로 곤두박질치고 만다.

연주가 죽은 충격으로 쓰러진 미자는 깨어나지 못하고,
진태는 미자의 병원비를 마련하기 위해 온갖 쓰레기 같은 짓을 하며
미자를 살리겠다는 집념으로 살아간다.

하지만 결국 미자마저 죽고,
절망에 빠진 진태는 죽은 미자를 납골당에 모시고 내려가던
빗길에 큰 사고를 당하고, 정신을 차려보니 18살 자신의 몸으로 깨어난다.

진태는 이 말도 안 되는 상황이 신이 주신 기회인지,
신의 장난인지 모르겠지만 연주를 살리기 위해 고군분투한다.

그런데 연주의 죽음을 둘러싼 진실이 서서히 드러나면서
진태는 감춰졌던 진실을 마주하게 되는데…
과연 진태는 연주를 구하고 행복한 일상을 맞이할 수 있을까?","#미스터리, #회귀/타임슬립, #범죄, #친구, #첫사랑, #학생, #이야기중심",15세이용가
노병귀환 [개정판],묵검향,무협,101.2만,10.0,전체192,전체 442,"장장 30여 년을 끌어오던 지리한 전쟁은 끝났으나,
아무도 돌아오지 않았다.

열 달 스무닷새째가 되던 그날까지는…",해시태그 없음,15세이용가
오늘이 내일에게,"문득,다옴",로맨스,171.7만,9.8,전체65,"전체 1,278","18년 전 세간의 주목을 받았던 '한성 아파트 붕괴 사건'에서 기적적으로 살아남은 두 명의 어린 생존자. 
둘은 그날의 사건을 계기로 전혀 다른 삶을 살아간다. 
내일은 없다는 생각으로 제대로 된 '오늘'을 사는 여자와 죽음이 두려워 자체적으로 '히키코모리'가 된 남자. 18년 후 우연한 계기로 만나게 되는 두 사람은 과연 하나 뿐인 오늘을 잘 살아낼 수 있을까.","#현대로맨스, #재회물, #성장물, #연예계물, #우연한만남, #트라우마, #상처남, #순정남, #능력녀, #엉뚱발랄녀, #걸크러쉬, #까칠녀, #삼각관계, #로맨틱코미디, #드라마",전체이용가
뜨거운 웬수,"여우,김수진",로맨스,"1,374.7만",9.9,전체60,"전체 7,613","20대 초반 한창 어리고 예쁜 나이에 첫눈에 반해 연애 한 달만에 결혼한 예가령과 한제윤은 1년을 채 살지 못하고 서로의 마음에 상처만 남긴 채로 이혼하게 된다. 약 6년의 시간이 지난 후 개량한복 사업으로 대박을 터뜨린 가령과 변호사로 활동하던 제윤은 가령의 친할머니의 유언으로 인해 다시 만나게 되는데….


6년 전 웬수가 된 우리, 다시 뜨겁게 사랑할 수 있을까?

훈훈한 돌싱 남녀의 달콤살벌 재결합 동거 러브스토리!",해시태그 없음,전체이용가
그림자 왕관,"해위,차녹",BL,155.1만,9.9,전체50,"전체 2,444","차원이동 한 주인공이 로윈의 왕자 다니엘에게 비오는 날 주워지며 시작되는 이야기.
주인공은 다니엘에게 라엘이라는 이름을 받고 그림자 왕자로서 살아가게 된다.
라엘은 어느 날, 제국의 황제 레온하르트를 만나게 되는데....","#성장물, #현대물, #판타지물, #궁정로맨스, #황제, #귀족, #계략, #집착, #사랑꾼, #능력있는, #도망, #강한, #평범한, #운명적사랑, #노블코믹",15세이용가
프로젝트 S,"통조림,박수정",로맨스,677.5만,9.6,전체96,"전체 4,691","코스메틱 회사에서 일하는 승아는 최근 서진호텔에서 개최한 호텔 어메니티 공모전에 팀 프로젝트로 참여하나 예선에서 떨어지고 만다. 
이 공모전에 사활을 건 승아와 회사 사람들은 몹시 아쉬워하며 어떻게 해서든 서진호텔의 관계자를 만나보자는 데 의견이 모아지고, 
승아가 서진호텔의 후계자인 서준형과 대학교 선후배 사이라는 걸 알게 되어 무작정 승아의 등을 떠민다. 

사실 승아는 대학교 때 준형을 짝사랑하여 고백까지 했지만 무참히 차였던 아픈 기억을 가지고 있던 터라 내키지 않지만 
회사를 위해 용기를 내 준형에게 연락을 한다. 
당연히 거절당할 줄 알았지만 의외로 준형은 순순히 만남에 응해주고, 
드디어 만나게 된 당일 승아를 매우 반기던 준형이 서진호텔 공모전 이야기를 꺼내자 돌연 까칠하게 굴며 
'승아 너 때문에 떨어진 것이다'라는 막말을 하는데?! 

세상부러울 것 없어 보이는 미남 재벌 후계자가 도대체 나에게 왜 이럴까?!! 
경쾌하고 발랄한 승아의 코스메틱 로맨스를 기대해주세요!",해시태그 없음,15세이용가
입술이 닿기까지,"나빛,루퍼",BL,574.6만,9.9,전체64,"전체 3,152",헤어진 연인이 어느날 같은 직장에 나타난다면? 둘의 관계를 오직 서로만 알고 있다면? 그 연인이 가장 친한 친구의 동생이라면? 그 직장이 둘의 추억이 가득 묻어있는 학교라면? 모교의 교사가 되어 다시 만난 두 남자! 미련으로 똘똘 뭉친 두 남자의 교내 연애사.,"#현대물, #오해물, #짝사랑, #운명, #첫사랑, #연하, #다정, #소심, #연상의, #두근거리는, #이야기중심",15세이용가
펌킨타임,개다래,로맨스,979.1만,9.9,전체65,"전체 9,209","'신해원'은 마지막 야구시합을 앞두고 
성별이 남자에서 여자로 바뀌게 되지만

이 사실을 자신의 가장 친한 친구인 
'강태주' 에게도 차마 말하지 못한다.

'태주'가 유학을 떠나게 되면서 두사람은 헤어지게 되고, 
'해원'은 자취를 감춘다.

몇 년뒤 한국에 돌아온 '태주'가 '해원'의 행방을 찾기 시작하고, 
그 때 나타난 여고생의 존재가 자꾸 해원과 겹쳐보이면서 감정은 커져간다.","#현대로맨스, #학원물, #성장물, #스포츠물, #첫사랑, #까칠남, #운동선수, #평범녀, #털털녀, #친구>연인, #소꿉친구",전체이용가
금의위,황성,무협,706.3만,9.9,전체158,"전체 1,578","북방족과의 길고도 지루한 싸움이 이어지던 중원.
전쟁에 참여한 주인을 따라 심부름꾼 서동으로 종군한 청풍.

이후 북방전쟁의 사신, 금의위의 견왕, 마교의 교주이자 
정북장군에 정북후라는 제후의 신분까지 오르는 이 사내.

황제가 하사한 호국진무대장군(護國振武大將軍)에 
백만 평의 봉토(封土)까지 버리고 
홀연히 사라지기까지의 대 인생역정!

누구나 알고 있던, 그러나 알지 못하던 
금의위의 모든 것이 이 한 편 안에 펼쳐져 있다.",해시태그 없음,15세이용가
미치기 좋은 날,유사,BL,981.9만,9.9,전체66,전체 1만,"*미치기 좋은 날[일반판] 입니다

[매월 10일/20일/30일 업데이트]

구질구질하고 무료한 일상에 TV 속의 그가 들어왔다! 

<적의 심장, 그를 가지다> 유사 올컬러 연재작!  

아픈 여동생을 위해 고달픈 현실을 살아내고 있는 '호수'의 삶 위로 눈부신 별 하나가 떴다.  
그는 바로 컴백을 앞두고 있던 인기 가수 '이서'. 하지만 이서는 친모라 주장하는 여인이 등장해 돌연 잠적 중이었는데…  
화려함 속 깊이 어떤 상처를 숨기고 신음하던 이서에게 호수는 유일한 위안이 되어 간다.  
그리고 그날 이후로 호수에게선 평범한 하루란 존재하지 않는 날이 되어 버린다….","#현대물, #작화가 쩌는, #고퀄리티",15세이용가
미생1,윤태호,드라마,179.4만,9.8,전체147,"전체 1,705",자신의 삶을 승리하기 위해 한 수 한 수 돌을 잇는 사람들의 이야기,"#현대물, #경영, #성장물, #회사원, #이야기중심",전체이용가
황성 복수무적 컬렉션,황성,무협,548만,9.7,전체354,"전체 1,031","복수의 칼 끝이 중원을 향한다!
[황성 복수무적 컬렉션]

** 구성 작품 **

1. 철혈도 [개정판]
2. 만능서생 [개정판]
3. 구천혈가 [개정판]
4. 적룡마제 [개정판]
5. 포룡 [개정판]",해시태그 없음,15세이용가
트레이스 리마스터,네스티캣,액션,289만,9.8,전체131,"전체 2,019","어느날 갑자기 세상에 나타나 인간들을 공격하기 시작한 정체불명의 존재 트러블.
트러블이 나타난 후 인간들에게도 트러블에 맞서 싸울 수 있는 능력자들이 나타나기 시작했다.
트러블, 트레이스, 인간.
각자의 생존을 건 싸움이 시작된다.","#퓨전, #먼치킨, #초능력",전체이용가
탐닉 [개정판],"지락,태성",BL,284만,9.8,전체52,"전체 1,474","종족 간 번식을 위해 인간들 틈에서
살아가고 있는 늑대와 여우.
그들에겐 번식하는 데 있어서
라이벌인 서로와 어울리거나
사랑하면 안 된다는 규율이 있다.
하지만 그 규율을 깨고 서로에게 이끌리는
늑대 한시랑과 여우 김호는 비밀리에
아슬아슬한 관계를 이어나가게 되는데...


(해당 작품은 15세이용가로 개정된 '개정판' 작품입니다.)",#현대물,15세이용가
몬스터헌터,"폴른스타,닛베",액션,"1,200.1만",9.4,전체206,"전체 5,025","먼 미래, 알 수 없는 이유로 지구는 멸망한다.
그런 지구에 난데없이 등장한 외계 종족의 몬스터들은
지구를 차지해 자신들의 지배 아래 두려고 한다.
이를 대적하기 위해 인간들이 모여 만든 인류 세력 코버넌트와 외계 종족,
두 세력은 지구를 두고 서로 치열한 다툼을 벌인다.

코버넌트에게 일명 버려진 자들이라고 불리는 인간들은
폐허의 땅이라는 곳에 모여 산다. 앞으로 10년 동안
벌어질 모든 일을 알고 있는 진무한을 선두로
폐허의 땅의 사람들이 코버넌트, 외계 종족에 대적하는 또 하나의 세력으로 성장한다.

제공: 텐센트","#퓨전, #회귀, #천재, #만능",전체이용가
제목 없음,작가 없음,장르 없음,조회수 없음,별점 없음,회차수 없음,댓글수 없음,줄거리 없음,해시태그 없음,연령 등급 없음
조동길,"김규태,서현",액션,138.3만,9.7,전체62,전체 873,주먹으로 다지는 뜨거운 의리와 우정,"#격투, #깽판, #학생, #성장, #조력자, #협객, #천재",15세이용가
묵검향 용호상박 컬렉션,묵검향,무협,104.1만,10.0,전체444,전체 117,"(본 작품은 개정판으로, 일부 편집되거나 삭제된 부분이 존재합니다)

※수록작품
1. 자객전서 1,2부
2. 십만대적검 1,2부
3. 벽력검제
4. 도편수 1,2부","#검, #협객",15세이용가
헤어짐의 방법,"온도,아마릴리아",BL,146.2만,9.8,전체65,"전체 1,576","외신 통신사 TPA 소속 종군기자인 하조윤은 내전지역 취재 중 사고에 휘말려 5년 간 혼수상태에 빠진다. 기적적으로 의식을 되찾고 귀국해 옛 연인을 찾아가지만 연인의 옆은 이미 다른 누군가로 채워져 있었는데… 갓난 시절부터 친구였고, 머리가 굳고 나서는 사랑이었다. 태어나서 지금껏 단 한 번도 이별을 생각해본 적 없던 연인에게 내가 아닌 다른 연인이 생겼다. 세상은 모든 결과가 나의 이기심과, 나의 무책임 탓이라 손가락질한다. 헤어짐에도 시간과 방법이 필요했지만, 한 번도 이별을 경험하지 못한 하조윤은 속수무책으로 무너지며 자신을 잊으려는 옛 연인에게 매달릴 뿐이다. 그리고 그런 그의 곁으로 한 남자가 다가왔다. 마음은 필요 없고 오로지 몸만 즐기자는 이 남자. 서른 한 해 동안 살아온 인생의 어느 지점에서 하조윤은 사랑과 헤어짐, 그리고 책임감을 처음으로 직면하게 된다.","#현대물, #전문직물, #냉정, #능력, #무심, #연상, #후회, #약한, #원작소설, #잔잔한",15세이용가
고교권왕,김성모,액션,"1,128.3만",8.6,전체120,"전체 4,926","국내 굴지그룹인 바이오유업의 장자인 한류. 
계모의 위협으로부터 자신의 몸을 지키고자 산속에서 16세기 신안주에 살고 있던 조선인들의 무술을 수련 받게 된다. ​전설처럼 내려오는 무술을 전수받은 한류는 후계자에게 내려오는 고유 무술 계승자에 대한 증표인 잉어 문신을 새겨 더욱 강해지고 그런 한류를 제거하기 위해 계모 유정희는 전국의 일진들을 고용하여 한류를 향한 살해 계획을 세우는데...., 한류를 제거하기 위해 모이는 전국의 일진들! 과연, 한류는 이 모든 상황을 극복하고 자신과 바이오 유업을 지켜낼 수 있을까?",해시태그 없음,15세이용가
신의 태궁,해소금,드라마,119.4만,10.0,전체104,"전체 1,108","신의 아이를 낳아 기르는 여인과
그를 사랑한 도깨비의 이야기!

신들의 궁전인 태궁
그리고 신의 아이를 낳아 기르는 여인인 수영이 살고 있다

이곳에서 나고 자란 신의 아이는 
장성하여 인간세상으로 내려간 후 
세상사람들의 소원과 억울함을 풀어주는 무당이 된다. 

신의 아이 외에도 태궁의 수발을 드는 도깨비들이 있었지만 
이들과는 말할 수도, 가깝게 지낼 수도 없었기 때문에 

수영은 신의 아이가 떠나고 나면 
늘 혼자 아이들을 추억하는 것으로 일상을 보내곤 했다.
내려보낸 신의 아이 또한 자신에 대한 기억을 잊는 데다 
두 번 다시 만날 수 없었기 때문이었다. 

그날도 홀로 생각에 잠긴 수영에게 
어느 날 갑자기 한 신의 아이가 찾아온다. 
그것도 자신을 기억하는 채로.","#동양풍, #신령, #환생물, #짝사랑, #신분차이, #고퀄리티",전체이용가
스탯보는 천마님,"마검,시나림, 혯님",무협,35.7만,8.7,전체50,전체 318,"무극지경을 쫓던 천마에게 찾아온 전무후무한 기사(奇事)

“임시 플레이어가 뭐냐?”
“레벨은 또 뭐고?”

마교에서, 아니 천하에서 가장 똑똑하다는 혈마 악선생 마저도 내 말뜻을 알아먹질 못했다.

마교의 지존 천마!
퀘스트에 심취하다!

[축하드립니다. 정식 플레이어로 등록됩니다.]
[특전으로 ‘환생’의 길이 열립니다.]

그런데 환생이라고?","#퓨전, #귀환, #무림, #먼치킨, #육아, #시스템, #성장, #빙의, #천재, #회귀, #검, #권, #마교, #천마, #정파",전체이용가
야설록 무황 컬렉션,야설록,무협,76.4만,10.0,전체240,전체 214,"<야설록 무황 컬렉션> 구성작품

1. 무황신의 [개정판]
2. 의기충천 [개정판]
3. 마검마후 [개정판]
4. 신무대전 [개정판]","#정통, #의원",15세이용가
홈런의 공식,황지성,드라마,74.2만,9.7,전체55,전체 572,"하차감 좋은 외제차. 한강뷰 아파트에 사는 게 꿈이었던
서른살 취준생 진국은 알바를 마치고 집에 가던 길에
야구공을 주우려 차도로 뛰어든 어린이를 발견하고
본능적으로 몸을 던져 구하지만 교통사고로 의식을 잃게 된다.
 
진국이 눈을 뜬 곳은 병원도 저승도 아닌
만원 관중이 운집한 야구장 한가운데.

무려 연봉 30억에 빛나는
대한민국 홈런왕 천재형의 몸에 빙의 된 것. 
진국의 손엔 드림카였던 외제차의 키와
한강뷰 펜트하우스 출입카드가 쥐어져 있다. 
급기야 집으로 찾아온 미모의 여자친구까지.

딱 하루만 성공한 사람의 삶을 누려보려 했던 게 화근이 되어 
메이저리그 스카우터들이 지켜보는
300억짜리 면접 무대에 서게 된 진국.
하필 상대 투수는 라이벌로 불리는 국가대표 에이스 선하준.

진국은 전공인 데이터 통계학 실력을 발휘하며
어설프게 배트를 움켜쥐는데...","#현대물, #성장물, #영혼체인지/빙의, #야구선수, #취업준비생",전체이용가
제목 없음,작가 없음,장르 없음,조회수 없음,별점 없음,회차수 없음,댓글수 없음,줄거리 없음,해시태그 없음,연령 등급 없음
사이클링 히트,"사가,자발체광,NAPUL",BL,132.2만,9.9,전체66,"전체 2,692","한국 고교야구협회에 등록된 고등학교 3학년은 약 900명.
이중 프로에 진출하는 선수는 100명이 채 안 된다.

고교 야구 선수로서 마지막 해를 맞은 임성.
3년 전 자신을 9회말 투 런 시킨 타자 김희도와 재회하지만,
김희도는 막 입부한 야구부를 그만두려 한다.

""내게 집착하는 이유가 뭡니까?""

""집착?""

설마 그런 질문을 받을 줄은 몰랐는데.

임성이 김희도와 같은 그라운드에 선 것은 단 한 번의 경기뿐이었다.
김희도와 다시 대결하고 싶다, 꼭 이기고 싶다.
호승심은 호기심으로 그리고 김희도를 더 알고 싶다는 일방적인 친밀함으로 바뀌었다.

""내가 너랑 하고 싶으니까.""

반듯하게 뻗어있던 김희도의 눈썹 끝이 살짝 올라갔다.
처음으로 김희도에게 변화를 이끌어낸 임성이 조금 짖궂게 웃었다.

고교 3학년, 태양이 내리쬐는 그라운드 위.
소년들의 야구도 사랑도 사이클링 히트가 될 수 있을까?","#현대물, #캠퍼스물, #학원물, #짝사랑, #능력, #미인, #연하, #집착, #츤데레, #미남, #연상의, #연상연하, #사랑스러운, #두근거리는",전체이용가
제목 없음,작가 없음,장르 없음,조회수 없음,별점 없음,회차수 없음,댓글수 없음,줄거리 없음,해시태그 없음,연령 등급 없음
꽃피는 날까지 [개정판],MARA,BL,32.6만,9.7,전체38,전체 319,"#서양판타지#동양판타지#황자공#황자수#계약관계

태양과 빛의 나라 베슈타르 제국, 불과 순아의 나라 영화국은
오랫동안 이어진 전쟁 끝에 평화 조약을 맺어 나라의 안정을 되찾고자 했다.
그 조약에 따라 영화국의 대표 이연은 베슈타르 제국으로 떠나고, 그곳에서 칼릭스를 만나게 되는데...","#동양풍, #서양풍, #유혹, #존대하는, #판타지물, #궁정로맨스",15세이용가
환상의 아이들,김다,드라마,35.9만,10.0,전체77,전체 972,"귀신이라면 지긋지긋한 태경, 저주받은 학교에서 귀신보다 위험한 놈과 엮였다","#학원물, #성장물, #귀신, #학생, #무서운",전체이용가
플리즈 비 마이 베이비 [개정판],닥복,BL,16만,9.8,전체46,전체 234,"교통사고 기억상실증에 걸린 강민우. 
그런 그의 곁으로 세 명의 남성이 다가오는데...
그들은 각자 “내가 진짜 남자친구야!”라고 주장하고,
한순간에 세 명의 남친이 생겨버린 민우는 ‘진짜’를 찾기 위해 몸의 대화를 시작한다.","#현대물, #계략, #다정, #능글, #능력, #재력, #짐승, #집착, #가난, #평범한, #라이벌/앙숙, #삼각관계, #질투, #두근거리는, #사랑스러운",15세이용가
어쩌다 햄스터,하루살이,드라마,37.8만,10.0,전체58,전체 604,"귀여운 일만 가득할 줄 알았지?
햄스터 모시기의 현실로 어서오시쥐!
어쩌다 햄스터 쥐인님을 모시게 된
노답 초보 햄집사의 좌충우돌 쥐인님 모시기","#힐링물, #일상, #가족, #동물, #작가, #사랑스러운",전체이용가
플랜터스의 정원,김현식,드라마,35.8만,9.6,전체115,전체 535,"“저는 당신이 마음에 들었어요!”

우리가 사는 세계의 바깥, ‘정원’이라 불리는 곳에 거주하는 이계의 신(神)격 존재 '플랜터스'. 
평범한 인간 '이루미'는 우연히 이 세계에 온, 정원이 불완전한 플랜터스, '알레프'와 만난다.

<어린 왕자>를 읽고 ‘이 세상에 단 하나뿐인 자신만의 친구’를 찾기 위해 왔다는 알레프의 친구 제안을 차마 거절하지 못한 루미는 그를 받아들이지만
기다렸단 듯이 나타나선, 오랜만이라며 루미를 정원사라고 부르는 알레프와 닮은 누군가.
어째선지 플랜터스의 존재와 알레프에 대해 알고있는 수상 쩍은 교수.
루미는 자주읽던‘SPR 기관’이란 인류보호기관 콘셉트의 괴담 사이트의 글에서 왠지 모르게 플랜터스를 암시하는 듯한 느낌을 받는데….","#미스터리, #스릴러, #호러, #오컬트, #초월적존재, #친구, #학생, #기묘한, #무서운, #스릴 넘치는, #여주중심",전체이용가
제목 없음,작가 없음,장르 없음,조회수 없음,별점 없음,회차수 없음,댓글수 없음,줄거리 없음,해시태그 없음,연령 등급 없음
무림살롱,"지운,만년2인자",무협,24.9만,9.8,전체60,전체 441,"신선계에서 옥황상제의 전담 헤어 디자이너를 맡으며 
패션과 유행을 선도하는 미의 신으로써 모든 신선들의 선망을 받았던 진율. 

하늘 높은 줄 모르고 안하무인으로 오만방자하게 굴다 
옥황상제의 머리 한 가운데에 고속도로를 뚫어버리는 대형사고를 치고 
상제의 노여움을 사 인간계로 추방당하는데…

인간계로 떨어진 진율은 자신의 솜씨를 활용하여 힘을 되찾아 신선계로 복귀할 계획을 세우지만, 
인간계에 떨어진 그 날부터 일이 꼬이기 시작한다?!

과연 진율은 힘을 되찾아 신선계로 돌아갈 수 있을까?","#퓨전, #생존, #조력자, #성장",전체이용가
야설록 고검독보행 컬렉션,야설록,무협,124.4만,9.5,전체364,전체 182,"<야설록 고검독보행 컬렉션> 작품구성

1. 취국 [개정판]
2. 고검독보행 [개정판]
3. 대마군 [개정판]
4. 나락검 [개정판]
5. 십오야십오검 [개정판]","#정통, #무림, #성장",15세이용가
"적의 심장, 그를 가지다",유사,BL,"2,809.6만",10.0,전체64,전체 1.5만,"*적의 심장, 그를 가지다(개정판) 입니다

원수의 가슴 속으로 빠져들게 되는, 그 거부할 수 없는 유혹! 

새 왕조를 세운 일등공신, 그의 이름은 피의 폭군 '이겐'. 세상이 두려워하는 그의 잔인함은 십 여년 전의 복수로 아즈쿤 가를 몰살시키기에 이른다. 반면에 하루아침에 반역자로 몰린 아즈쿤 가의 유일한 생존자 '카산'은 자신의 질긴 목숨을 원망하며 고통스러워 하는데… 가족을 몰살시킨 장본인이 이겐이라는 것을 아직 모르는 카산은 그의 목욕 시중을 드는 노예가 되고, 냉혈한인 줄로만 알았던 이겐에게서 알 수 없는 매력을 느끼며 그에게 점점 빠져들게 된다.",#가상시대물,15세이용가
미소찢는 남자,최희선,드라마,19.5만,9.9,전체43,전체 322,"오랜 기간 살인사건이 없던 구회시에서
청테이프로 입가를 봉하고 입을 찢어버리는
참혹한 살인사건이 일어난다.

사건을 담당하는 형사 김수현과 나태주는
수사 내용을 공표하기도 전에
사건의 세부내용을 기사로 쓴 기자 황효준을 의심하고,
아버지가 살해당한 것을 듣고 기뻐하는 듯한
피해자 김성철의 아들 김지운을 의문스럽게 생각한다.

수사 중 피해자 김성철이 마약과 관련된 걸 알아내고,
용의자를 파악하던 중,
김성철 살인사건과 같이 입이 찢어진 사체가 발견된다.

연쇄살인인가?","#미스터리, #범죄, #연쇄살인, #라이벌, #친구, #형사, #학생, #스릴 넘치는",15세이용가
